"QUEEN MARLENE, INC.",TAXI SERVICE
"QUEEN OF DENIAL, INC.",ARTIST ROYALTIES
QUEEN OF HEARTS LLC,PRODUCT DEVELOPMENT & INTELLECTUAL PROPERTY
"QUEEN OF HEARTS, LLC",REAL ESTATE - RESIDENTIAL REAL ESTATE
"QUEEN OF SHEBA, INC.",RESTAURANT
"QUEEN OF SORTS, LLC","RETAIL STOREFRONT SELLING: HOME DECOR, GIFTS, JEWELRY, CANDLES, CLOTHING, HO"
QUEEN OF THE FLEET LLC,AIRCRAFT OWNERSHIP
QUEEN R.E. LLC,THE GENERAL CHARACTER OF THE BUSINESS OF THE LLC IS TO ENGAGE IN THE BUSINESS
QUEEN REALTY LLC,"TO OWN, MANAGE, BUY, RENT, SELL, DEVELOP AND/OR CONSTRUCT REAL PROPERTY, TO"
"QUEEN SCREW & MANUFACTURING, INC.",MANUFACTURING
QUEEN SPA LLC,NAIL SALON
"QUEEN STAR, INC.",NAIL SALON
QUEEN STREET REALTY LLC,RENTAL PROPERTY
"QUEEN YANG, INC.",RESTAURANT
"QUEENAN ELECTRICAL SERVICES, LLC",ELECTRICAL INSTALLATION AND REPAIR FOR COMMERCIAL CUSTOMERS.
QUEENBEE VENTURES INCORPORATED,"MANAGEMENT , ORGANIZATION, CLEANING RESIDENTIAL PR"
QUEENS PIZZA INCORPORATED,RESTAURANT
QUEENSBERRY ASSOCIATES LIMITED,REAL ESTATE OWNERSHIP AND RENTAL
QUEENSBERRY REALTY CORP.,REAL ESTATE COMPANY
"QUEENSBURY CAB, INC.",TAXI CAB LEASES/RENTALS
QUEENSBURY GENERAL CORP.,"TO ACQUIRE BY PURCHASE, EXCHANGE, LEASE, OR OTHERW"
QUEENSTON FARM LLC,THE GENERAL CHARACTER OF THE BUSINESS OF THE LLC SHALL INITIALLY BE TO OWN RE
"QUEEQUEG PROPERTIES, LLC","TO ACQUIRE, MANAGE, DEVELOP, LEASE, SELL AND INVEST IN REAL PROPERTY AND TO O"
"QUEEQUEG, LLC",RESTAURANT
"QUEER EYE LLC, THE",MERCHANDISING AND ANCILLARY MARKETING
QUEIROZ CLEANING INC,CLEANING SERVICES
QUEIROZ CONSTRUCTION & SERVICE INC,"FRAMING, PAINTING, SIDING, ROOFING, ELECTRIC, ETC."
QUEIROZ DIOGENES INC,COMMERCIAL AND RESIDENTIAL
"QUELLO SCELTO, LLC","ENTERTAINMENT MAKING AND SELLING MUSIC, PROVIDED SONG WRITING SERVICES, AN"
"QUELLTX, INC.","Q-STATE HOLDINGS, INC."
"QUENCH COLLECTIVE, LLC","CONSULTING - MARKETING - TRADE SHOW STRATEGY, PR, PRESS RELEASES."
"QUENCH GYM FOR WOMEN, INC.",HEALTH CLUB FOR WOMEN
"QUENCH JUICERY, LLC",COFFEE SHOP
"QUENCH USA, INC.",COMMERCIAL WATER PURIFICATION EQUIPMENT RENTAL.
"QUENTAL ELECTRIC CO., INC.",ELECTRICAL
QUENTIN EDU LLC,EDUCATION CONSULTING
"QUEQUECHAN CONTRACTING, INC.",RESIDENTIAL CONSTRUCTION
QUEQUECHAN DEVELOPMENT LLC,REAL ESTATE DEVELOPMENT
QUEQUECHAN MANAGEMENT CORP.,CONSULTING
"QUERBIE, INC.",INTERNET SEARCH ENGINE
QUERCEGEN PHARMA LLC,RESEARCH AND DEVELOPMENT IN THE SUPPLEMENT AND PHARMACEUTICAL FIELDS
QUERCEGEN PHARMACEUTICALS LLC,RESEARCH AND DEVELOPMENT IN THE SUPPLEMENT AND PHARMACEUTICAL FIELDS.
QUERCEGEN TECHNOLOGIES HOLDINGS LLC,RESEARCH AND DEVELOPMENT IN THE SUPPLEMENT AND PHARMACEUTICAL FIELDS
"QUERCIA, LIMITED PARTNERSHIP","THE PARTNERSHIP WAS FORMED FOR THE PURPOSE OF THE PURCHASE, SALE, MANAGEME"
QUERCUS BROKERAGE INC.,INSURANCE BROKERAGE
"QUERCUS CONSULTING PROJECT MANAGEMENT, INC.",CONSULTING FOR REAL ESTATE PROJECT MANAGEMENT
QUERCUS LLC,INVESTMENT SECURITIES
"QUERCUS PROPERTIES, LLC",RENTAL REAL ESTATE
"THE INSURANCE AGENCY OF CAPE COD, INC.",INSURANCE AGENCY
"QUERIDA PORTUGUESE WATER DOGS, LLC","PORTUGUESE WATER DOG BREEDER (PUPPIES, ADULT DOGS, STUD DOGS)."
QUERKI INC.,SOFTWARE PUBLISHING
"QUESET COMMONS WWTF, LLC","THE GENERAL CHARACTER OF THE BUSINESS OF THE LLC IS TO ACQUIRE, FINANCE OR RE"
"QUESET COMMONS, LLC",THE GENERAL CHARACTER OF THE BUSINESS IS TO ENGAGE IN INVESTMENTS IN AND OW
"QUESET MEDICAL, INC.",DISTRIBUTION OF MEDICAL DEVICES AND OTHER LEGAL TH
"QUESET ON THE POND, LLC","THE GENERAL CHARACTER OF THE BUSINESS IS TO ACQUIRE, MANAGE, USE, DEVELOP, M"
"QUESET PROPERTIES, LLC","TO OWN, DEVELOP, IMPROVE, MAINTAIN, OPERATE, MORTGAGE, MARKET, DISTRIBUTE, SE"
QUESNAY INC.,CONSULTING
QUEST 26 MILLBURY LLC,REAL ESTATE OWNER
QUEST 28 MILLBURY LLC,REAL ESTATE OWNER
QUEST ABROAD INTERNATIONAL INC.,EDUCATION CONSULTANCY
"QUEST ADVENTURES, INC.",NATIONAL AND INTERNATIONAL SERVICE TRIPS
QUEST ADVISORS GROUP INC,BUSINESS ADVISOR
"QUEST BUILDERS GROUP, INC.",GENERAL CONTRACTOR
"QUEST BUSINESS ADVISORS, LLC",CONSULTING.
"QUEST CABINET REFACING, LLC","TO ENGAGE IN BUSINESS OF PROVIDING GENERAL CONSTRUCTION, CARPENTRY, CABINE"
"QUEST CAPITAL STRATEGIES, INC.",CEASE OPERATION
"QUEST CONSTRUCTION SERVICES, LLC",GENERAL CONSTRUCTION SERVICES
"AMACEL WISDOM, INC.",CONSULTING
"QUEST DEBT SOLUTIONS, LLC",DEBT SOLUTIONS
"QUEST DIAGNOSTICS CLINICAL LABORATORIES, INC.",CLINICAL LABORATORY TESTING
QUEST DIAGNOSTICS LLC,LABORATORY TESTING
QUEST DIAGNOSTICS MASSACHUSETTS LLC,LABORATORY
"QUEST ENGINEERING SOLUTIONS, INC.",ENGINEERING TESTING SERVICES
"QUEST ENTERPRISES, INC.",CONSTRUCTION MANAGEMENT
"QUEST FINANCIAL SERVICES, INC.",FINANCIAL PLANNIG & INVESTMENTS
QUEST GEOTHERMAL NH LLC,SUPPLY AND INSTALL RESIDENTIAL AND COMMERCIAL GEOTHERMAL PRODUCTS
"QUEST GLOBAL SERVICES-NA, INC",ENGINEERING SERVICES
"QUEST INVESTMENT PROPERTIES, LLC","INVESTING IN RESIDENTIAL REAL ESTATE FOR THE PURPOSES OF RENOVATIONS, REHABIL"
"SAVINGS PATH, INC.",FINANCIAL CONSULTING AND INVESTMENTS
"CAFFEINATE LABS, INC","CONSUMER PRODUCTS, AND ANY LAWFUL BUSINESS"
"QUEST NUTRITION, LLC",MANUFACTURING PROTEIN BARS
QUEST PROPERTIES LLC,"TO ENGAGE IN ALL REAL ESTATE TRANSACTIONS, INCLUDING BUT NOT LIMITED TO LEASI"
"QUEST REALTY, LLC",TO OWN AND LEASE COMMERCIAL REAL ESTATE
"QUEST RESOURCE MANAGEMENT GROUP, LLC",RESOURCE MANAGEMENT CONSULTING GROUP
"QUEST SAILING ADVENTURES, INC.",SAIL BOAT CHARTERS
"QUEST SERVICE GROUP, LLC",MERCHANDISING
QUEST SOFTWARE INC.,"DESIGN, DEVELOPMENT, SALE AND SUPPORT OF COMPUTER"
"QUEST SOFTWARE, INC.",CANNED RETAIL SOFTWARE
QUEST STEEL DETAILING & DESIGN LLC,"STEEL DRAFTING, DESIGN AND MISCELLANEOUS SERVICES FOR THE STEEL CONSTRUCTIO"
"QUEST TOWING SERVICES, L.L.C.","ADMINISTRATOR OF ROADSIDE AND TOWING CLAIMS FOR INSURANCE, FLEET AND WARR"
"QUEST TRAVEL ADVENTURES, LLC.",QUEST TRAVEL ADVENTURES PROVIDES LUXURY ALL- INCLUSIVE TRAVEL ADVENTURES I
"QUEST, INC.,THE",FULL SERVICE RESTAURANT
"QUESTAR AGENCY, INC.",INVESTMENT BANKING
"QUESTAR ASSESSMENT, INC.",K-12 EDUCATIONAL ASSESSMENT
QUESTAR CAPITAL CORPORATION,INVESTMENT BANKING
MALLINCKRODT ARD INC.,PHARMACEUTICAL MANUFACTURER
"CACI TECHNOLOGIES, INC.",PROVIDE IT AND NETWORK SOLUTIONS
QUESTER TANGENT CORPORATION,DELIVER TRAIN ELECTRONICS PRODUCTS
"QUESTEX, LLC","THE BUSINESS OF THE LLC IS TO PROVIDE PUBLICATIONS AND DIGITAL MEDIA SERVICES,"
"QUESTEX MEDIA GROUP, INC.",PUBLICATIONS AND DIGITAL MEDIA
QUESTICA LTD.,BUDGET SOFTWARE FOR PUBLIC SECTOR
QUESTIME LLC,THE ACTIVITIES OF THE BUSINESS IS TO CREATE AND CONDUCT PLOT PARTY GAMES AND
"QUESTION AUTHORITY, INC.",PROVIDE GENERAL CONSULTING AND RESEARCH SERVICES
QUESTIONMARK CORPORATION,COMPUTER SOFTWARE AND RELATED SERVICES
"GORMAN ACQUISITION, INC.",MARINE PRODUCTS
"QUESTUS, INC.",INTERACTIVE MARKETING
"QUETICO HOLDINGS, INC.",HOLDING COMPANY
"QUETONE MUSIC GROUP, LLC","THE COMPANY SHALL CONDUCT AS ITS GENERAL BUSINESS THE CREATING, PUBLISHING"
"QUEUES ENFORTH DEVELOPMENT, INC.",EMERGENCY DISPATCHING SOFTWARE
QUEZADA EXPRESS INC.,LIMO SERVICES
QUEZADA PAINTING & CARPENTRY LLC,PAINTING & CARPENTRY
QUEZIA ADVERTISEMENTS INC,ADVERTISEMENTS
"OMNITRACS, INC.",SOFTWARE FOR TRANSPORTATION
"QUIC PIC BBQ, LLC",RESTAURANT
"QUICHILENSES MARKET, INC.",CONVENINCE STORE
"QUICK & CLEAN CAR WASH OF WALTHAM, INC.",CAR WASH
NUNES LAND STONE WORK INC,RESIDENTIAL AND COMMERCIAL LANDSCAPE AND GARDEN
QUICK & RELIABLE TRANS INC,"CLASSIC LIMOUSINES OF NEW ENGLAND, INC"
"QUICK 'N CLEAN CAR WASH, INC.",CAR WASH
QUICK AND CLEAN LLC,LAUNDRY SERVICES
"QUICK AND EASY STAIR JIG, LLC",WHOLESALE - AGENT/BROKER - STAIR JIG
"QUICK BEAUTY, INC.",HAIR SALON
"REAL TRAVEL, INC.","MONEY TRANFERS AGENT , CHECK CASHING"
"QUICK BITE, INC.",RETAIL CONVENIENCE STORE
"QUICK BOOKKEEPING, LLC","THE COMPANY IS ESTABLISHED AND OPERATED TO RENDER GENERAL ACCOUNTING, BOO"
QUICK BRUSH PAINTING CORP.,PAINTING INTERIOR AND EXTERIOR
"QUICK BUILD TRUSS COMPANY, INC.",WOOD TRUSS MANUFACTURER
"QUICK CARRIER, INC.",FREIGHT
"QUICK CATCH LABS, LLC",DEVELOPMENT AND MARKETING OF WEB AND MOBILE WEB APPLICATIONS.
"QUICK CLOSE, LLC",REAL ESTATE DEVELOPMENT AND PROPERTY MANAGEMENT
"QUICK COMMISSION USA, LLC",TO ENGAGE IN THE BUSINESS OF FUNDING COMMISSIONS OF REAL ESTATE AGENTS AND
"QUICK CUTS, INC.",HAIR SALON
"QUICK DECISION, LLC","TO OWN, IMPROVE, LEASE, MANAGE, MAINTAIN AND OPERATE REAL ESTATE AND THE IM"
"QUICK DRY, INC.",QUICK DRY INC
"QUICK USA, INC.",EMPLOYMENT AGENCY
"QUICK EXCHANGE, INC.",MONEY TRANSMITALL & MONEY ORDERS CENTER
QUICK EXPRESS TRANSPORT INC.,INTERSTATE COMMERCE TRANSPORTATION
"QUICK EXPRESS, INCORPORATED",GASOLINE STATION & STORE
"QUICK FIX BUMPER LIMITED, INC.",AUTO BODY REPAIR
"QUICK FLICKS, LLC",THE BUSINESS CONSISTS OF 2 DVD RENTAL AND VENDING MACHINE KIOSKS. DVDS ARE
QUICK FOODS PROPERTIES LLC,TO ENGAGE IN ANY LAWFUL ACT OR ACTIVITY FOR WHICH LIMITED LIABILITY COMPANIE
"QUICK FUEL FLEET SERVICES, LLC",WHOLESALE DISTRIBUTION OF PETROLEUM AND RELATED PRODUCTS.
QUICK FUSE MEDIA LLC,THE GENERAL CHARACTER OF THE BUSINESS OF THE LLC IS TO ENGAGE IN THE BUSINESS
QUICK HEAL TECHNOLOGIES AMERICA INC.,ANTI VIRUS SOFTWARE PRODUCTS
"QUICK LANES, INC.",AUTOMOBILE OIL AND FLUID CHANGE
"TRUFI, LLC",DEBT SETTLEMENT SERVICES/UNSECURED PERSONAL LOANS
QUICK MANUFACTURING CO.,MANUFACTURING OF PRECISION MACHINED COMPONENTS.
"QUICK MART, INC.",CONVENIENCE STORE
QUICK MEDICAL CARE LLC,MEDICAL SERVICES
"QUICK MULCH, INC.",LANDSCAPING
"QUICK MUNCHIES, LLC",THE COMPANY WILL ENGAGE IN THE BUSINESS OF SELLING VENDING MACHINE PRODUC
"QUICK N EASY PEST, LLC",PEST CONTROL AND RELATED SERVICES.
"QUICK PASS SOLUTIONS, LLC","THE GENERAL CHARACTER OF THE BUSINESS OF THE COMPANY IS TO ACQUIRE, DEVELOP,"
"QUICK PAY FUNDING, LLC",THE GENERAL CHARACTER OF THE BUSINESS IS FUNDING FOR MERCHANT PROCESSING A
QUICK PICK DISPOSAL INC.,DEMOLITION
"QUICK PRINT LTD, INC.","PRINTING, COPYING, AD SPECIATY PROVIDERS"
"QUICK PROCESSING, LLC",GENERAL PARTNER OF COMPANY THAT PROVIDES MERCHANT PROCESSING SERVICES TO
"QUICK PROFESSIONAL SERVICES, INC.",JANITORIAL AND TRANSPORTATION SERVICES
"QUICK PROPERTIES, LLC",PROPERTY OWNERSHIP AND MANAGEMENT
"QUICK REALTY GROUP, LLC","TO OPERATE A REAL ESTATE BROKERAGE AND MANAGE REAL ESTATE PROPERTIES, AND A"
"QUICK RESPONSE ELECTRICAL SERVICE, LLC",LICENSED MASTER ELECTRICIAN
"QUICK SERVICE TRANSPORTATION, CORP.",TRANSPORTATION
"QUICK STOP CONVENIENCE, INC.",RETAIL CONVENIENCE STORE
"QUICK STOP MARKET, INC.",GROCERY STORE
"QUICK STOP MINI MART, INCORPORATED",CONVENIENCE STORE
QUICK STOP MOBILE SERVICE LLC,MOBILE OIL CHANGE & MAINTENANCE SERVICES
"QUICK STOP PRINTING, INC.",PRINTING AND COPYING
"QUICK STOP PROPERTIES, LLC",RENT AND MAINTAIN COMMERCIAL PROPERTIES
"QUICK STRIKE FOODS, LLC",QUICK SERVICE TAKE OUT RESTAURANT GROUP THAT SERVES BREAKFAST AND LUNCH M
QUICK TECHNOLOGIES LLC,SOFTWARE
"QUICK TEST, INC.",MARKET RESEARCH/DATA COLLECTION
"QUICK TRIP, INC.",BOON ENTERPRISES LLC
"QUICK-SLING, LLC",HVAC PRODUCTS
"QUICKBASE, INC.",DEVELOPMENT/SALE/SUPPORT OF COMPUTER SOFTWARE.
"QUICKCAD SERVICES, INC.",AUTOCAD SERVICES
QUICKCRAWL LLC,PROVIDE CUSTOM WEBCRAWLER SERVICES.
"QUICKDOC, INC.",DEVELOPMENT SOFTWARE
QUICKEN LOANS INC.,RESIDENTIAL MORTGAGE LENDING
QUICKFIX AUTO REPAIR CORP,UNLIMITED AUTOMOBILE REPAIR AND BODY WORK
QUICKIE MANUFACTURING CORPORATION,MANUFACTURING
"QUICKIN VARIETY, INC.",GAS & C STORE
"QUICKINSURED.COM, LLC",PROPERTY & CASUALTY INSURANCE AGENCY
"QUICKITT, LLC",SOFTWARE LICENSING AND DEVELOPMENT
"HMC RESTAURANT GROUP, LLC",OWN AND MANAGE RESTAURANT AND CAFE
QUICKLY SOLUTIONS INC,"PROVIDE SERVICE OF COPY AND FAX, SALES OF GOODS"
"QUICKLY WAY CONSTRUCTION, LLC",REAL ESTATE INVESTMENT
QUICKPAY FACTORING INC,BUSINESS SERVICES
"QUICKPAY, INC.",AUTOMATED PAYROLL SERVICE PROVIDER
QUICKPIVOT CORPORATION,Address (no PO Box)
"QUICKS HOLE, LLC",RESTAURANT;FOOD SERVICE
"QUICKSAND PLAYGROUND, LLC",THE COMPANY IS A SOFTWARE DEVELOPMENT FIRM. WE PRIMARILY DEVELOP GAMES FO
"QUICKSERV, INC.","PROCESS SERVERS, DELIVERY OF LEGAL DOCUMENTS"
"QUICKSILVA TITLE AND ESCROW, LLC",TITLE INSURANCE AND REAL ESTATE CLOSING SERVICES
"QUICKSILVA TITLE, LLC",REAL ESTATE CLOSINGS AND TRANSACTIONS
"QUICKSILVER BAKING COMPANY, LLC","QUICKSILVER BAKING COMPANY, LLC (QSB) IS FASHIONED AFTER OLD WORLD BAKESHO"
"QUICKSILVER CONSULTANTS, LLC",THE GENERAL CHARACTER OF THE BUSINESS OF THE LLC IS TO PROVIDE PROFESSIONAL S
QUICKSILVER INVESTMENTS LLC,"ACQUISITION, DEVELOPMENT, IMPROVEMENT, LEASING AND SALE OR EXCHANGE OF REA"
QUICKSILVER SOLUTIONS LLC,MANAGEMENT CONSULTING SERVICES
"QUICKSTEP COMMUNICATIONS, LLC",STRATEGIC COMMUNICATIONS AND MARKETING CONSULTING SERVICES.
"QUICKSTOP, LLC","SHIPPING, MOVING, TRUCK RENTALS AND REAL ESTATE"
QUICKSTREAM LLC,"BUY, SELL, CONSTRUCT, RENOVATE, LEASE AND MANAGE RESIDENTIAL AND COMMERCI"
"QUICKTIME DRY CLEANING, INC.",OWN AND OPERATE A DRY CLEANING BUSINESS.
"QUICKTOO.COM, INC.","QUICKTOO.COM, INC."
"QUICKWARE ENGINEERING & DESIGN, LLC","TO BUY, SUBSCRIBE FOR, OR OTHERWISE ACQUIRE OR OWN, HOLD, USE, DEAL IN, SELL,"
QUICKY'S FRANCHISE CORP.,ROYALIITIES
QUICWIT LLC.,QUICWIT IS A MOBILE TRIVIA APP DEVELOPED FOR IOS AND ANDROID MOBILE DEVICES.
QUIDDLERS LLC,COMMERCIAL REAL ESTATE
QUIDLEY AND COMPANY INCORPORATED,FINE ART SALES
"QUIDNET DEVELOPMENT, LLC","(I)OWN, MANAGE, LEASE, BUY, SELL, DEVELOP AND OPERATE REAL ESTATE; AND (II) ENGA"
QUIDNET ENERGY INC.,TECHNOLOGY DEVELOPMENT
QUIDNET HEDGES LLC,"TO ACQUIRE, OWN, DEVELOP, CONSTRUCT, REHABILITATE, RENOVATE, IMPROVE, MAINT"
"QUIDNET PROPERTIES, LLC",THE COMPANY OWNS AND MANAGES RENTAL REAL ESTATE.
"QUIET CORNER HEARING AIDS, INC.",MEDICAL
QUIET CORNER SPEECH & LANGUAGE LLC,PROVISION OF SPEECH AND LANGUAGE THERAPY SERVICES.
QUIET COVE LIMITED PARTNERSHIP,HOLDING REAL ESTATE
QUIET JUICE LLC,"THE COMPANY PRODUCES PODCASTS FOR PUBLIC MEDIA, EDUCATIONAL INSTITUTIONS"
"QUIET LOGISTICS, INC.",THIRD PARTY LOGISTICS
QUIET MIND STUDIO INC.,YOGA AND MASSAGE STUDIO
"QUIET MIND TOURING, LLC",TOURING COMPANY
"QUIET PROFESSIONAL SECURITY, LLC","DEFENSE CONSULTING, PROTECTION AND INVESTIGATIVE SERVICES."
"QUIET RIDE, INC.",TO PROVIDE DOMESTIC SERVICES
"QUIET SOFTWARE, INC.","QUIET SOFTWARE, INC."
"QUIET THERAPEUTICS, INC.",PROVIDING CLINICAL TRIAL SERVICES TO PARENT COMPAN
QUIET WAY LLC,INVESTMENT
"QUIETUDE QUILTS, LLC","HANDMADE MAIL-TO-ORDER PRODUCTS FOR BABIES AND CHILDREN, SOLD THROUGH W"
"QUIG PROPERTIES, INC.",REAL ESTATE INVESTMENT FOR RE-SALE OR RENTAL
"QUIG'SDIGS, LLC","TO AQUIRE,OWN,OPERATE,LEASE,MANAGE,DEVELOPE AND SELL REAL ESTATE AND TO CA"
"QUIGLEY & ASSOCIATES, LLC",PRIVATE DETECTIVE AGENCY.
"QUIGLEY BUILDERS, INC.",GENERAL CONTRACTORS AND BUILDERS
"QUIGLEY ISM, LLC",REAL ESTATE - MANAGING REAL ESTATE
"QUIGLEY MARKETING, LLC",THE GENERAL CHARACTER OF THE BUSINESS OF THE LLC IS TO ENGAGE IN CONSULTING
QUIGLEY REALTY LLC,INVESTMENT PROPERTY
QUIGLEY SCIENTIFIC CORPORATION,PROVIDES SOLUTIONS TO INDUSTRIAL PROBLEMS.
"QUIGLEY, RAIMO & CO., P.C.",CPA PRACTICE
"QUIGLEY, INC",REAL ESTATE
QUIK & EZ ESALES LLC,PROVIDE A SERVICE FOR PEOPLE BY SELLING THEIR ITEM ON EBAY FOR THEM.
"QUIK FOODS II, INC.",OPERATE A FAST FOOD RESTAURANT
"QUIK FOODS IV, LLC",OPERATE FAST FOOD RESTAURANTS
"QUIK FOODS V, LLC",OPERATE FAST FOOD RESTAURANT
"QUIK FOODS, INC.",OPERATE A FAST FOOD RESTAURANT
QUIK FUND INC.,MORTGAGE
QUIK LOC INC.,MANUFACTURE METAL DEVICE
QUIK VIDEO LLC,PROVIDE AUTO DEALERSHIPS WITH SERVICE DEPARTMENT SOLUTIONS
"QUIK-SET FASTENING SYSTEMS, INC.",FRANCHISE DISTRIBUTION FASTENING PRODUCTS AND SYST
"QUIK-TOOL, LLC",INDUSTRIAL TOOLING SUPPLIER
QUIKCORD INC.,DESIGN AND SELL MILITARY AND CONSUMER PRODUCTS.
"QUIKLUBE & WASH, INC.","OIL CHANGE, AUTO REPAIR, CAR WASH"
QUIKPOINT CORPORATION,MANUFACTURING OF MOTOR GUNS
"QUIKRETE COMPANIES, INC.THE",MANUFACTURE AND SELL CEMENTITOUS PRODUCTS
QUIKTRAK INC.,"INSPECTION, TESTING AND CERTIFICATION"
QUILES & ASSOCIATES LLC,"ENGAGE IN ADJUSTMENT / CONSTRUCTION CONSULTING, AND TO ENGAGE IN ANY OTHE"
QUILKI LLC,GENERAL CONTRACTING AND REAL ESTATE DEVELOPMENT
"QUILL AND PRESS, INC.",RETAIL STATIONER
QUILL CORPORATION,QUILL DISTRIBUTION & SALES- - -C CORP
"QUILL HILL, INC.",REAL ESTATE
QUILL LLC,QUILL DISTRIBUTION & SALES
"QUILLARD BROS. GARAGE, INC.",AUTOMOBILE SERVICE STATION
"QUILLING CARD, LLC",WHOLESALE OF GREETING CARDS
"QUILT INSURANCE AGENCY, LLC",INSURANCE SALES AND SERVICES.
"QUILT, INC.",INSURANCE SALES AND SERVICES
"QUILTER'S ARK, INC.",RETAIL SALES FABRIC AND SEWING MACHINES
"QUILTER'S STASH, INC.",RETAIL SALE OF FABRIC AND QUILTING SUPPLIES
"QUILTER'S WAY, INC.",RETAIL SALES OF FABRIC AND QUILTING SUPPLIES
QUILTERS COMMON LLC,RETAIL FABRIC AND RELATED SUPPLY SHOP.
QUILTERS LOFT LLC,THE GENERAL CHARACTER OF THE BUSINESS IS THE SALE OF FABRIC AND QUILTS AND AL
QUILTING THE TOP LLC,PUTTING TOGETHER AND QUILTING OF QUILTS.
"QUILTS & TREASURES, INC.",RETAILS SALES OF FABRIC AND QUILTING SUPPLIES
"QUILTS 4 CURES, LLC",INTERNET-BASED COMPANY THAT MAKES AND SELLS HANDMADE GIFT ITEMS.
"QUILTY AND ASSOCIATES, INC",PROVIDES QUALITY CONTROL AND REGULATORY CONSULTING
QUIMBY ELECTRICAL APPLIANCE CO.,APPLIANCE SALES AND REPAIRS
"QUIMBY REALTY, L.L.C.",REAL ESTATE INVESTMENTS
QUINAPOXET GROUP LLC,CONSULTING SERVICES AND ANY AND ALL FOR-PROFIT BUSINESS ACTIVITIES
QUINAVE LLC,"TO ENGAGE IN THE INVESTMENT, OWNERSHIP AND DEVELOPMENT OF REAL ESTATE"
QUINCE CORP.,REAL ESTATE MGMT.
QUINCE LIMITED PARTNERSHIP,REAL ESTATE OWNERSHIP
QUINCITY INC.,FRANCHISE CONVENIENCE STORE
QUINCY & CO. INC.,REAL ESTATE DEVELOPMENT AND PROPERTY MANAGEMENT
QUINCY 1ST LLC,"OWN, DEVELOP, OPERATE, MANAGE, RENT, LEASE, REHABILITATE, HOLD AND SELL REAL E"
QUINCY 2ND LLC,"OWN, DEVELOP, OPERATE, MANAGE, RENT, LEASE, REHABILITATE, HOLD AND SELL REAL E"
QUINCY 3RD LLC,"THE GENERAL CHARACTER OF THE BUSINESS OF THE LLC IS TO OWN, DEVELOP, OPERATE,"
QUINCY 4TH LLC,"THE GENERAL CHARACTER OF THE BUSINESS OF THE LLC IS TO OWN, DEVELOP, OPERATE,"
QUINCY ADAMS BUILDING CORPORATION,REAL ESTATE MANANGEMENT
"QUINCY ADAMS GARDEN CENTER, INC.",GARDEN CENTER
"QUINCY ADAMS CONSTRUCTION CO., INC.",REAL ESTATE RENTALS
"QUINCY ADAMS CVS, INC.",RETAIL PHARMACY
"QUINCY ADAMS, LLC","TO ACQUIRE, DEVELOP, LEASE, SUBLEASE, OPERATE, MORTGAGE, SELL AND OTHERWISE D"
"QUINCY AMUSEMENTS, INC.",MOVIE THEATRES
"QUINCY ANDOVER, LLC",THE PURPOSE AND BUSINESS OF THE LIMITED LIABILITY COMPANY SHALL CONSIST OF
"QUINCY ASH STREET HOLDINGS, LLC","ENGAGE IN INVESTMENT, OWNERSHIP AND DEVELOPMENT OF REAL ESTATE AND INTERE"
QUINCY ASSETS LLC,"TO ENGAGE IN REAL ESTATE INVESTMENT AND DEVELOPMENT, REAL ESTATE MANAGEME"
"QUINCY AUTO AUCTION, INC.",THE OPERATION OF AN AUTO AUCTION BUSINESS
"SOUTH SHORE DRIVING ACADEMY, INC.",DRIVER EDUCATION AND TRAINING
"QUINCY AUTO TECH, LLC",GENERAL AUTOMOTIVE REPAIRS.
"QUINCY AUTOBODY, INC.",AUTO BODY REPAIR
"QUINCY AVALON, LLC","REAL ESTATE DEVELOPMENT, OWNERSHIP AND OPERATION"
QUINCY AVE. ASSOCIATES LLC,REAL ESTATE
QUINCY AVENUE CORPORATION,REAL ESTATE
"QUINCY AVENUE DONUTS, L.L.C.",RETAIL TRADE-FOOD AND BEVERAGE
QUINCY AVENUE LIMITED PARTNERSHIP,REAL ESTATE
"QUINCY AVENUE REALTY, LLC",RESIDENTIAL APARTMENT RENTALS.
"QUINCY AVENUE, LLC",MANAGEMENT OF RENTAL PROPERTY
QUINCY BIGELOW REALTY CORPORATION,REAL ESTATE MANAGEMENT
"QUINCY BJ, LLC","TO ACQUIRE, OWN, DEVELOP, HOLD FOR INVESTMENT, MANAGE, OPERATE, LEASE, SELL,"
QUINCY BRIDGE CAPITAL LLC,"THE GENERAL CHARACTER OF THE COMPANY'S BUSINESS IS TO: (A) MAKE, SERVICE AND"
QUINCY C MARKET INC.,"BEER, WINE AND CONVENIENCE STORE"
"QUINCY CAFE, INC.",FOOD SERVICES
"QUINCY CAPITAL FUNDING, LLC","THE GENERAL CHARACTER OF THE COMPANY S BUSINESS IS TO: (A) MAKE,SERVICE AND"
"QUINCY CAR WASH, INC.",CAR WASH
"QUINCY CCD, LLC",MANAGEMENT SERVICES
"QUINCY CENTER FOR ENDODONTICS, P.C.",DENTAL OFFICE
"QUINCY CENTER PRIMARY CARE, P.C.",MEDICAL PRACTICE
"QUINCY CHECKER CAB, LLC",TRANSPORTATION / TAXI CAB COMPANY
"QUINCY CHESTNUT PLACE, LIMITED PARTNERSHIP","TO ACQUIRE, MAINTAIN, IMPROVE, OPERATE, MORTGAGE, EXCHANGE, LEASE, LET, HOLD"
"QUINCY CHESTNUT PLACE, LLC","THE GENERAL CHARACTER OF THE BUSINESS OF THE LLC IS (A) THE INVESTMENT IN, AND"
"QUINCY CHESTNUT STREET, LLC",THE PURPOSE AND BUSINESS OF THE LIMITED LIABILITY COMPANY SHALL CONSIST OF A
"QUINCY CHICKEN, LLC",OWN AND OPERATE A POPEYE'S FRANCHISE AND ALL MATTERS INCIDENTAL THERETO
"QUINCY CLASSIC HOMES, INC.",REAL ESTATE
QUINCY COMMONS ASSOCIATES LLC,"THE GENERAL CHARACTER OF THE BUSINESS OF THE LLC SHALL BE TO ACQUIRE, OWN, D"
QUINCY CONTRACTORS LLC,"HEAVY CIVIL AND MARINE CONTRACTING, RESIDENTIAL CONTRACTING AND ANY OTHER"
QUINCY CONVENIENCE STORE LLC,SELL GROCERIES PRODUCTS
"QUINCY CVS, INC.",RETAIL PHARMACY
"QUINCY DENTAL ASSOCIATES, LLC",THE COMPANY MAY ENGAGE IN ANY LAWFUL BUSINESS PERMITTED BY THE MASSACHUS
QUINCY DENTAL REALTY GROUP LLC,"TO ENGAGE IN INVESTMENT, OWNERSHIP AND DEVELOPMENT IN REAL ESTATE AND IN A"
QUINCY DEV LLC,"TO OWN, MANAGE AND DEVELOP REAL ESTATE"
QUINCY DEVELOPMENT GROUP LLC,"LAND DEVELOPMENT, CONSTRUCTION, BUILDING AND SELLING REAL ESTATE"
"QUINCY DRY CLEANING, INC.",OWN AND OPERATE A DRY CLEANING BUSINESS.
"QUINCY EDISON PARK, LLC","THE GENERAL CHARACTER OF THE BUSINESS OF THE LLC IS TO OWN, DEVELOP, MANAGE,"
"QUINCY ELECTRONICS CO, INC.",MANUFACTURING AND REPAIR OF INSTRUMENTS
"QUINCY EMERGENCY CARE, P.C.",MEDICAL OFFICE
QUINCY ENDODONTICS INC.,DENTAL OFFICE
"QUINCY ENTERTAINING, INC.",FULL SERVICE RESTAURANT
"QUINCY FITNESS, INC.",FITNESS CENTER
"QUINCY FOREIGN CAR CENTER,INC.",AUTO REPAIR & SALES
TOWN FAIR TIRE CENTERS OF QUINCY LLC,SALE AND INSTALLATION OF TIRES AND WHEELS
"QUINCY FOXBORO, LLC","THE PURPOSE AND BUSINESS OF THE COMPANY SHALL CONSIST OF ACQUIRING, OWNIN"
"QUINCY GAR MING, INC.",RESTAURANT
QUINCY GATE AUTO INC,"AUTO REPAIR, AUTO, SALE, TRANSPORTATION"
"QUINCY GRANITE REALTY, LLC",TO OWN AND DEVELOP REAL ESTATE
"QUINCY GROUP, INC., THE",INVESTMENT AND FINANCIAL SERVICES
QUINCY HANCOCK STREET LLC,REAL ESTATE
"QUINCY HAPPY CHILDREN DAYCARE, LLC","TO EDUCATE AND PROVIDE DAYCARE FOR CHILDREN, AND TO ENGAGE IN ACTIVITIES DIR"
"QUINCY HAYWARD STREET, LLC","THE BUSINESS OF THE COMPANY SHALL BE TO ENGAGE IN ANY LAWFUL BUSINESS, TRADE,"
NSL QUINCY LLC,NURSING HOME MANAGEMENT
QUINCY HEIGHTS LIMITED PARTNERSHIP,"TO ACQUIRE, HOLD, INVEST IN AND OTHERWISE DEAL IN AND WITH INTERESTS IN AFFOR"
QUINCY HEIGHTS II LIMITED PARTNERSHIP,"TO ACQUIRE, HOLD, INVEST IN AND OTHERWISE DEAL IN AND WITH INTERESTS IN"
QUINCY HIGH CARE DENTISTRY LLC,DENTISTRY PROVIDED BY DR. MOATAZ SHABAN DMD AT ADDRESS: 67 CODDINGTON ST. L
"ADVANCED HEALTHCARE, INC.",HOME CARE SERVICES
QUINCY MRI LIMITED PARTNERSHIP,DIAGNOSTIC IMAGING
QUINCY HOWARD LLC,THE GENERAL CHARACTER OF THE BUSINESS OF THE LLC IS TO ACQUIRE BY PURCHASE O
"QUINCY HUNGRY TUMMY, INC.",RESTAURANT SERVICES
"QUINCY INSURANCE AGENCY, LLC",THE GENERAL CHARACTER OF THE BUSINESS OF THE COMPANY IS ACT EXCLUSIVELY AS
"QUINCY INTERNATIONAL FOODS, INC.",RETAIL
"QUINCY INVESTMENT HOLDINGS, LLC",THE GENERAL CHARACTER OF THE BUSINESS OF THE COMPANY IS (1) TO ACQUIRE AND H
"TUAN AND THANH INVESTMENT, LLC","TO MANAGE, BUY AND SELL, LEASE, CONSTRUCT REAL ESTATE PROPERTIES AND CONDU"
QUINCY IVANHOE LLC,REAL ESTATE
"QUINCY LINCOLN, LLC","THE GENERAL CHARACTER OF THE BUSINESS OF THE COMPANY IS TO INVEST IN, ACQUIR"
QUINCY LIQUOR STORE INC.,LIQUOR STORE
QUINCY LUCKY DRAGON INC,RESTAURANT
"QUINCY MARITIME PARK, LLC","TO BUY, SELL, LEASE AND MORTGAGE REAL ESTATE FOR THE PUROPOSE OF CONDUCTING"
QUINCY MARKET INV INC,CONVENIENCE STORE
"CHESTNUT DEVELOPMENT, LLC","THE PURPOSE AND BUSINESS OF THE COMPANY SHALL CONSIST OF ACQUIRING, OWNIN"
"QUINCY MEDFORD, LLC",THE PURPOSE AND BUSINESS OF THE LIMITED LIABILITY COMPANY SHALL CONSIST OF A
"QUINCY MEDIA, INC.",INTERNET MEDIA
"QUINCY MEDICAL CENTER, A STEWARD FAMILY HOSPITAL,",HOSPITAL SERVICES
"QUINCY MEMORIALS, INC.",MONUMENT GRANITE SALES
"QUINCY MOTORSPORTS, INC.","MOTORSPORTS PARTS, SERVICE AND SALES"
"QUINCY MUTUAL GROUP, INC.",MANAGEMENT SUPPORT COMPANY
QUINCY NETWORKS INCORPORATED,"COMPUTER SERVICE, CONSULTING,TECH SUPPORT, AND SAL"
"QUINCY OCAMPO, INC.",REAL ESTATE INVESTMENT/MANAGEMENT
"QUINCY OFFICE INVESTORS, INC.",INVESTMENT IN REAL ESTATE
QUINCY ONLINE CONSULTING LLC,CONSULTING SERVICES
"QUINCY PALACE ADULT DAY HEALTHCARE, INC.",ADULT DAY HEALTH CARE
QUINCY PARCEL HOLDING CORP.,RETAIL PHARMACY
QUINCY PARTNERS LLC,CONSULTING SERVICES
"METRO SOUTH PATHOLOGY, INC.",MEDICAL SERVICES-PATHOLOGY
"QUINCY PEDIATRIC ASSOCIATES, INC.",PEDIATRIC MEDICAL PRACTICE
"QUINCY PEDIATRIC DENTAL, P.C.",DENTAL PRACTICE
"QUINCY PERPETUATION PARTNERS, LLC",THE GENERAL CHARACTER OF THE COMPANY’ S BUSINESS IS (A) TO INVEST IN (INCLUDIN
QUINCY PET-CT SERVICES LLC,MAGNETIC RESONANCE IMAGING
QUINCY PHYSICAL THERAPY LLC,PHYSICAL THERAPY OFFICE
"QUINCY POINT SELF SERVICE CAR WASH, INC.",CAR WASH
QUINCY PRIMARY CARE LLC,THE GENERAL CHARACTER OF THE BUSINESS OF THE COMPANY IS TO FACILITATE PHYSIC
"QUINCY PRIMARY HEALTHCARE, P.C.",HEALTHCARE
"QUINCY PRINTING SERVICES, LIMITED",DIGITAL PRINT SERVICE PROVIDER
"QUINCY PRODUCTS, INC.",RETAIL MUSIC STORE
"QUINCY PROPERTY OWNER I, LLC","TO ACQUIRE, HOLD, LEASE, DEVELOP AND DISPOSE OF REAL PROPERTY AND ALL INTERES"
"QUINCY REAL ESTATE INVESTORS, INC.",REAL ESTATE INVESTMENT
QUINCY REALTY LLC,REAL ESTATE INVESTMENT
QUINCY RENTALS LLC,"ENGAGE IN THE BUSINESS OF REAL ESTATE MANAGEMENT, RENTING, LEASING, BUYING A"
QUINCY RETAIL BUILDING CORP.,"OWN,DEVELOP,LEASE REAL ESTATE"
