Q & A REALTY CORP.,"PURCHASE, OWN, LEASE, SELL REAL ESTATE"
"Q & Q RESTAURANT, INC.",RESTAURANT
"Q-FREE TCS, INC.",INTELLIGENT TRANSPORTATION SYSTEMS SALES
Q ANALYSTS LLC,IT CONSULTING (WE ARE A STAFFING COMPANY IN THE IT BUSINESS)
"Q AND J AUTOMOTIVE, INC.",AUTO SERVICE
"Q B S CONSULTING, INC.",SOFTWARE DEVELOPMENT
Q BEVERAGE (NY) LLC,"OWN, MANAGE, AND OPERATE REAL ESTATE"
"Q & A, INC.",HAIR SALON
Q CAFE LLC,RESTAURANT & CATERING
"Q CAPITAL STRATEGIES, LLC",LIFE SETTLEMENT PROVIDER
Q CENTER LLC,PROVIDES ADMINISTRATIVE AND CONSULTING SERVICES
"Q CHINATOWN REALTOR, LLC","REAL ESTATE BUY, SELL MANAGE, CONTROL AND IMPROVEMENT AND ALL OTHER BUSIN"
Q COMPANY INC.,"MANUFACTURER, HOME APPRAISAL"
Q CONTRACTING INC.,CONSTRUTION: RESIDENTIAL & COMMERICAL
"Q & D ASSOCIATES, INC.",FURNITURE WHOLESALE FOR COMMISSIONS
"Q DEL, LLC",THIS IS A DINE IN/TAKE OUT RESTAURANT.
"Q DEVELOPMENTS, LLC",PRODUCT DEVELOPMENT AND LICENSING OF INTELLECTUAL PROPERTY AND TO ENGAGE
"Q DIVISION RECORDS, LLC",LICENSE AND SALE OF RECORDED MUSIC
Q ENTERPRISES LLC,ECOMMERCE
Q & H INC.,DAIRY DRINKS SALE
Q FACTOR COMMUNICATIONS CORP.,TELECOM SOFTWARE DESIGN
Q FASHIONS CORP.,CLOTHING STORE
Q FINANCIAL GROUP LLC,SALES OF INSURANCE AND INVESTMENT PRODUCTS
Q GENERAL CONTRACTOR LLC,"INTERIOR AND EXTERIOR REMODELING OF PROPERTY, NEW CONSTRUCTION, AND ANY O"
Q GLOBAL CORPORATION,CONSTRUCTION MATERIAL AND FINISHING INSTALLATION
"Q H DONUTS, L.L.C.",RETAIL TRADE-FOOD AND BEVERAGE
"Q INTERNATIONAL COURIER, INC.",MESSENGER SERVICES
"Q & J RENTAL, LLC",RESIDENTIAL RENTAL
"Q INTERNATIONAL COURIER, LLC",GLOBAL LOGISTICS SOLUTIONS
HELLO MOBILE TELECOM LLC,TELECOMMUICATIONS
Q LINK WIRELESS LLC,PROVIDER OF TELECOMMUNICATION SERVICES
"Q LUBE, INC.",FAST LUBES; OWNS JIFFY LUBE STORES
Q MARK INCORPORATED,MEDICAL DATA ABSTRACTION SOFTWARE AND SERVICE
"Q MARKETING, INC.",DBA BURKE & ASSOCIATES
Q MART INC,OWN AND OPERATE DOLLAR STORE
Q MEDICAL LLC,BEAUTY & COSMETIC TREATMENTS
"Q & L PROPERTIES, LLC","ENGAGE IN REAL ESTATE MANAGEMENT AND INVESTMENT SERVICES, AND ENGAGE IN A"
"Q-NAILS & SPA, LLC","COSMETOLOGY SERVICES, SPA, AND SIMILAR SERVICES."
"Q OLD RIVER PROPERTY, LLC",GENERAL INVESTMENTS
Q OX LLC,RENTAL PROPERTY
"Q PAINTING, INC.",PAINTING SERVICES
"Q PHARMA, INC.",REGULATORY & COMPLINCE SERVICES FOR LIFE CYCLE CO.
Q PLAZA CORPORATION,REAL ESTATE MANAGEMENT
"Q PRODUCTIONS, LLC","CREATION, PERFORMING, PRODUCTION AND SALE OF MUSICAL COMPOSITIONS, ARRANG"
Q PROPERTIES LLC,THE PURPOSE OF THE LIMITED LIABILITY COMPANY IS TO OPERATE IN THE BUSINESS OF R
"Q & L, INC.",RESTAURANT
Q PUBS CORP.,RESTAURANT MANAGEMENT
Q REALTY TRUST LLC,REAL ESTATE
"Q RIVERSIDE PROPERTY, LLC",GENERAL INVESTMENTS
"Q ROBOTICS, LLC",THE COMPANY PLANS TO RESEARCH AND DEVELOP NOVEL COMMERCIAL PRODUCTS
"Q S M, INC.",IMPORT / EXPORT
"Q SHIPPING SOLUTIONS, LLC",CONSULTING AND SOFTWARE DEVELOPMENT FOR MARITIME TRANSPORTATION
"Q SMILE, PC",DENTAL OFFICE
"Q & M CHRISTY'S, INC.",DRINKING BAR
"Q SQUARED, INC.",LESSOR OF RESIDENTIAL PROPERTY
Q UROLOGICAL CORPORATION,MEDICAL DEVICES
Q YOU IN LLC,"BLOGGING, FREELANCE WRITING, AFFILIATE MARKETING"
"Q&L INVESTMENT, LLC",INVESTMENT IN THE AREA OF EDUCATION AND REAL ESTATE.
Q&P INVESTMENT LLC,REAL ESTATE INVESTMENT
Q&R LLC,"CONSULTING, SOFTWARE, CHEMICAL AND ENGINEERING"
O'B & A WELLSMERE RD LLC,"INVESTMENT IN, AND OWNERSHIP AND DEVELOPMENT OF, REAL ESTATE AND INTERESTS"
Q'SNUTS LLC,"FOOD AND BEVERAGE (MANUFACTURING) - SWEET, SAVORY AND EXOTIC ROASTED NUTS"
PPG QUEBBEC CORPORATION,INFORMATION TECHNOLOGY AND PROFESSIONAL COMMERCIAL
"Q-BIZ SOLUTIONS, LLC",DEVELOP SOFTWARE FOR PRIVATE EQUITY INDUSTRY AND PROVIDE RELATED SERVICES
"Q-CENTRIX, LLC","CLINICAL DATA ABSTRACTING, REPORTING, AND ANALYSIS SERVICES"
Q-CLINICS LLC,SUMMER SPORTS CAMPSAA
Q-EDGE CORPORATION,HARD DISK ASSEMBLY
"Q-EM, INC.",CONSULTING
"Q-EN COMPUTER TECHNOLOGIES, LLC","CONSULTING SERVICES REGARDING COMPUTER SYSTEMS, SOFTWARE, HARDWARE, AND"
Q-EYE INCORPORATION,INFORMATION TECHNOLOGY CONSULTANCY
Q-G II HOUSING INC.,AFFORDABLE HOUSING AND ECONOMIC DEVELOPMENT
Q-G II HOUSING LIMITED PARTNERSHIP,REAL ESTATE OWNERSHIP
"Q-HUTS, INC.",COMMERCIAL PROPERTY RENTAL
Q-K HOME REMODEL CORPORATION,HOME IMPROVEMENT
Q-LOK CORPORATION,DESIGN LOCKING DEVICES
Q-MATIC CORPORATION,CUSTOMER FLOW MANAGEMENT
"Q-MED, INC.",HEALTH CONSULTING SERVICES
"Q-METRICS, INC.",THERMAL ENGINEERING CONSULTING
"MADISON INTERNATIONAL OF LONDON, INC.",STRATEGIC ADVISORY & RISK MERGER ARBITRAGE
"Q-PEAK, INCORPORATED",CONTRACT RESEARCH AND DEVELOPMENT
"Q-RAY MEDIA, INC.",SOFTWARE AND SERVICES FOR MARKETING
"Q-RING, INC.",CANCER THERAPEUTICS
"Q-STATE BIOSCIENCES, INC.","Q-STATE HOLDINGS, INC."
"Q. B. D. SYSTEMS, INC.",DEVELOP AND SELL SOFTWARE AND RELATED SERVICES
"Q.C. DRILLING/ROUTING SERVICE, INC.",PRECISION MACHINERY PLASTIC FABRICATION SERVICES
"Q. H. CONSTRUCTION, INC.",CONSTRUCATION
Q. PERKINS REAL ESTATE MANAGEMENT LLC,REAL ESTATE HOLDING
Q. STREET REALTY LLC.,TO BUY SELL AND LEASE RESIDENTAL REAL ESTATE
Q.A. IV HOLDINGS LLC,THE GENERAL CHARACTER OF THE LLC IS TO INVEST IN REAL ESTATE DIRECTLY OR THRO
Q.A. IV LIMITED PARTNERSHIP,THE PURPOSE OF THE LIMITED PARTNERSHIP IS TO ENGAGE IN THE BUSINESS OF REAL EST
Q.A. V LIMITED PARTNERSHIP,THE PURPOSE OF THE LIMITED PARTNERSHIP IS TO ENGAGE IN THE BUSINESS OF REAL EST
"Q.C.F., INC.",LOUNGE LIQOUR PERMIT (BUSINESS INACTIVE)
"Q.C.I., INC.",PRECISION MACHINING
Q.E.D. ADVISORS LLC,"CONSULTATION SERVICES FOR EXPENSE REDUCTION, COST SAVINGS, TAX PREPARATION,"
"Q.E.D. SYSTEMS, INC.",INFORMATION TECHNOLOGY SERVICES
Q.E.I. INCORPORATED,RESELLER
"Q.R.W., INC.",PERIODICAL PUBLISHING
Q.V.C.C. INC.,OPERATES GRILLE AREA OF GOLF CLUB HOUSE
"Q/P MANAGEMENT GROUP, INC.",MANAGEMENT CONSULTING
"Q2 SOFTWARE, INC.",SOFTWARE AND SERVICE FOR FINANCIAL INSTITUTIONS
"Q3 TECHNOLOGIES, INC.",COMPUTER SOFWARE SERVICES
"Q3 VENDING, LLC","Q3 VENDING, LLC WILL PROVIDE VENDING SERVICES TO LOCAL BUSINESSES IN THE METR"
"Q4CALM, INC.",MEDICAL SOFTWARE AND SERVICES
"Q5, LLC",PRECONSTRUCTION AND CONSTRUCTION PROFESSIONAL SERVICES
"Q6 INTEGRATION, INC.",ELECTRO/MECHANICAL ASSEMBLY
Q7 INVESTMENTS LLC,GENERAL INVESTMENT AND REAL ESTATE DEVELOPMENT; SALES AND RENTAL.
"QACI, INC.",CONSULTANT
"DOUBLING PARTNERS, INC.",TECHNICAL RECRUITING
"QA SYSTEMS NORTH AMERICA, INC.",SOFTWARE TESTING AND ANY OTHER LAWFUL BUSINESS
"QA TEST ASSOCIATES, INC.",SOFTWARE TESTING
"QA YOUR WAY, INC.",CONSULTING
QA3 FINANCIAL INSURANCE AGENCY,INSURANCE SALES
QAAGILITY TECHNOLOGIES LLC,SOFTWARE DEVELOPMENT AND TRAINING
"QAC CATERING, INC.",CATERING
QAC CONSULTING LLC,PHARMACEUTICAL AND MEDICAL DEVICE CONSULTING SERVICES
QAD INC.,INTEGRATED BUSINESS SOFTWARE & SERVICES
"QADEER & SONS, INC.",CONVENIENCE STORE
QAG HOLDINGS LLC,THE GENERAL CHARACTER OF THE BUSINESS IS TO INVEST IN REAL ESTATE DIRECTLY OR
"QAM SALES, LLC",CONTRACT SALES CONSULTING SERVICES FOR MANUFACTURERS OF SEMICONDUCTOR- I
QAMAR INC.,REAL ESTATE
QAMBIO INC.,FINANCIAL AID TO NEEDY FAMILIES
QANOPY COLLECTIONS LLC,"ONLINE SALES OF PRODUCTS (HAIR, BODY AND TEA ETC)"
QANTIFLIX LLC,SOFTWARE DEVELOPMENT
QANTUM COMMUNICATIONS CORPORATION,RADIO BROADCASTING
QAPERE LLC,"IT, HR, PAYROLL, FINANCE, AND LAND USE & PHYSICAL SPACE PLANNING AND DESIGN C"
"QAR, INC.",AUTOMOTIVE SRV. CENTER & MA ST. INSPEC. STATION
QARA BIO-PHARMACEUTICAL SOLUTIONS LLC,CONSULTING AND MEDICAL WRITING SERVICES FOR THE PHARMACUTICAL INDUSTRY
QARA MEDICAL LLC,CONSULTING HEALTH CARE SERVICES AND SOCIAL ASSISTANCE
JUBA EXPRESS GROUP LLC,WE ARE A REMITTANCE COMPANY SERVING MIGRANT COMMUNITY SENDING MONEY BA
QARR'S PAINTING CORPORATION,HOUSE PAINTING
"QARSAM, INC.",CONVENIENCE STORE
QAS LIMITED,"DEVELOPE, DESIGN, INSTALL MARKET SOFTWARE APPS"
"QASIGNATURE.COM, INC.",QUALITY ASSURANCE TESTING SERVICES
"QASSIM'S SMOKE SHOP, INC",SMOKE SHOP
QASWA CORP.,OPERATION OF CONVENIENCE STORE
QATAR AIRWAYS,INTERNATIONAL AIRLINE
"QAZI, INC.",CONVENIENCE STORE
"QB AUTOMOTIVE SERVICES, LLC",AUTOMOTIVE SERVICES
QB ENTERTAINMENT LLC,"ESCAPE ROOMS, BOARD GAMES CLUB"
"QB FOCUS, LLC",PERSONAL TRAINING
"NXSTAGE MEDICAL, INC.",MEDICAL DEVICE MANUFACTURER
"QB REALTY, LLC",RENTAL REAL ESTATE
QB SERVICES LLC,LANDSCAPE SUPPLIES AND SERVICES
QB SOLUTIONS LLC,THE COMPANY SHALL PROVIDE CUSTOMER CARE SOLUTIONS TO IT'S CLIENTS.
"QB SOLUTIONS, INC.",TO PROVIDE CUSTOMER CARE ADVICE TO ITS CLIENTS
QB3 LLC,TO CONDUCT AN INVESTMENT BUSINESS INCLUDING WITHOUT LIMITATION THE ACQUISI
QBA LLC,"TO ENGAGE IN ANY LAWFUL BUSINESS IN THE COMMONWEALTH OF MASSACHUSETTS, I"
"QBASE, LLC",INFORMATION TECHNOLOGY SERVICES AND SOFTWARE
QBD & PV SOLUTIONS LLC,PROVIDE CONSULTATION AND TRAINING SERVICES IN QUALITY-BY-DESIGN & PROCESS V
"QBD STRATEGIES, LLC",THE PRINCIPAL BUSINESS ACTIVITY AND PURPOSES OF THE LLC SHALL BE AS FOLLOWS:
"QBE A&H, LLC",INSURANCE
"QBE ADMINISTRATION SERVICES, INC.",VEHICLE SERVICE CONTRACT PROVIDER
"QBE AMERICAS, INC.",SHARED SERVICES
"QBE FIRST ENTERPRISES, LLC",INSURANCE SALES AND CALL CENTER
"NGLS INSURANCE SERVICES, INC.",INSURANCE PROPERTY AND CASUALTY SALES AND SERVICE
"S. I. U., LLC",INSURANCE AGENCY
QBEAST SOFTWARE INCORPORATED,SOFTWARE DEVELOPMENT AND SUPPORT
"QBI HOMES, INC.",CONSTRUCTION / BUILDER
"QBJ LAND DEVELOPMENT, LLC","THE GENERAL CHARACTER OF THE BUSINESS OF THE LLC IS TO OWN, OPERATE, DEVELOP,"
QBJKL LLC,OWNS REAL PROPERTY.
"QBOOKS TRAINING AND EDUCATION, LLC",THE BUSINESS PROVIDES TRAINING AND EDUCATION ON THE USE OF ACCOUNTING SOFT
QBRE LLC,THE GENERAL CHARACTER OF THE LIMITED LIABILITY COMPANY'S BUSINESS IS TO INVES
"QBS, INC.",BEHAVIORAL TRAINING AND CONSULTATION
QBW LLC,CONSTRUCTION
"QC AVIONIX, LLC","DESIGN, MANUFACTURE AND SELL ELECTRONIC ACCESSORIES."
"QC ENERGY RESOURCES, INC.",CUSTOMER SERVICE AND BROKER BULK FREIGHT
"QC INDUSTRIES, INC.",MANUFACTURING OF BUILDERS SCAFFOLDING SYSTEMS.
"QC INVESTMENTS, L.L.C.",TO ENGAGE IN THE LAWFUL BUSINESS OF A SOCIAL CLUB AND RESTAURANT.
QCENTIVE LLC,HEALTHCARE CONTRACT SOLUTIONS
"QCENTIVE MANAGEMENT HOLDINGS, LLC",HEALTHCARE CONTRACT SOLUTIONS
"QCI REALTY, INC.",REAL ESTATE
"QCMETRIX, INC.",COMPILATION OF MEDIACL STATISTICS VIA COMPUTER
"QCO VENTURE, CORP.",HAIR SALON
"QD CONSULTING, LLC",THE GENERAL CHARACTER OF THE BUSINESS IS A CONSULTING AND PERSONNEL AGENC
"QD ENTERPRISES,LLC",TO PRODUCE EDUCATIONAL MATERIALS RELATING TO THE PRACTICE OF MEDICINE AND
"QD VISION, INC.",NANOMATERIALS PRODUCT COMPANY
"LAND PLANNING, INC.",CONSTRUCTION ENGINEERING
QDEXCYMA TECHNOLOGIES LLC,"HOME APPLIANCE SALES, SERVICE (INSTALL, REPAIR, MOVING) FOR RESIDENTIAL. MACHI"
QDISCOVERY LLC,IT CONSULTING
"QDM INSURANCE AGENCY, INC.",THE GUARANTEE COMPANY OF NORTH AMERICA USA
QDOBA RESTAURANT CORPORATION,FAST CASUAL MEXICAN RESTAURANT
QDROEASE LLC,THE GENERAL CHARACTER OF THE BUSINESS OF THE LLC IS TO ASSIST INDIVIDUALS WITH
QE ENTERPRISES LLC,ELECTRICAL CONTRACTING COMPANY
JCI ENERGY LLC,"OWN, OPERATE AND INVEST IN ENERGY PROJECTS AND ANY OTHER ACTIVITIES INCIDEN"
QE2 LLC,DEVELOP MERCHANDISE ANCILLARY REVENUE
"QEAT NAVY, LLC",EQUIPMENT LEASING
QED CAPITAL LIMITED PARTNERSHIP,INVESTMENT PARTNERSHIP
"QED CONSULTING, INC.",MANAGEMENT CONSULTING
"QED LABS, INC.",LABORATORY
QED SOLUTIONS LLC,ECOMMERCE
"QEEPSAKE, INC.","QEEPSAKE IS A DIGITAL, WEB-BASED, BABY JOURNAL."
"QERNIL, LLC",ENTERPRISE SOFTWARE APPLICATION DEVELOPMENT
"QESTEC, INC.",WHOLESALE COMPUTER SALES
"QEW MEDIA, LLC",THE GENERAL CHARACTER OF THE BUSINESS OF THE LLC IS TO CREATE AND ENGAGE IN
"QF, INC.",CONVENIENCE STORE
QFLIX USA INC.,A 501 (C)(3) NONPROFIT CORPORATION
"QFORMA, INC.",CUSTOM SOFTWARE DEVELOPMENT
QFRED LLC,PROPERTY DEVELOPMENT
QFW CONSULTING LLC,CONSULTING FOR THE EDUCATION AND TECHNOLOGY INDUSTRIES. MEDICAL DEVICE AN
QG PRINTING II CORP,COMMERCIAL PRINTING OR MANUFACTURING
QG PRINTING II LLC,COMMERCIAL PRINTING OR MANUFACTURING
"QG, LLC",COMMERCIAL PRINTING SERVICES
"QGEN (USA), INC.",PROJECT MGMT & TECHNOLOGY DEVELOPMENT OF RENEWABLE
"QHI HOUSING, INC.",REAL ESTATE
"QHII HOUSING, INC.",REAL ESTATE
"QHOG, INC.",FULL SERVICE RESTAURANT
"QHR INTENSIVE RESOURCES, LLC",HEALTHCARE MANAGEMENT
"QI FARM, INC.",TRAINING
IQ INSPIRATIONS LLC,"ONLINE SALES OF SELECT CONSUMER PRODUCTS, INCLUDING DIETARY SUPPLEMENTS; O"
QI-ACUPUNCTURE LLC,WE PROVIDE A HIGH QUALITY HOLISTIC HEALTH CARE THROUGH ORIENTAL MEDICINE OF
"QIAGEN BEVERLY, INC.",BIOTECHNOLOGY
"QIAGEN BEVERLY, LLC",BIOTECHNOLOGY PRODUCTS
QIAGEN INC.,SALES BIOTECHNOLOGY
"QIAGEN NORTH AMERICAN HOLDINGS, INC.",HOLDING COMPANY MANAGEMENT SERVICES
"QIAGEN, LLC",SALES DISTRIBUTION OF QIAGEN PRODUCTS
QIAN ZHENG LUCKY LLC,LIMITED LIABILITY COMPANY (LLC)
QIAN.FAN.CHEN.YU-HJ CORPORATION,"CONSULTING, ADVERTISING, ART, FILM,NOVEL BUSINESS"
"QIANLONG USBOSTON, LLC",OPERATE A REAL ESTATE DEVELOPMENT AND GOLF COURSE MANAGEMENT BUSINESS
"QIANLONG BROADWAY, LLC",REAL ESTATE DEVELOPMENT AND REAL ESTATE INVESTMENT
"QIANLONG CLIFFSIDE, LLC","THE GENERAL CHARACTER OF THE BUSINESS OF THE LLC IS TO ACQUIRE AND OWN, OR D"
"QIANLONG CORNERSTONE, LLC",REAL ESTATE DEVELOPMENT AND REAL ESTATE INVESTMENT
"QIANLONG CRITERION VENTURES, LLC",TO DEVELOP AND OWN REAL ESTATE PROPERTY
"QIANLONG HUNTINGTON, LLC",REAL ESTATE DEVELOPMENT AND INVESTMENT
QIANLONG LAGRANGE LLC,REAL ESTATE DEVELOPMENT AND REAL ESTATE INVESTMENT
"QIANLONG MANAGEMENT, LLC","TO ACQUIRE AND OWN, OR DEVELOP, USE, HOLD, LEASE, SELL, MANAGE, IMPROVE, CONV"
"QIANLONG MORRISSEY, LLC",THE GENERAL CHARACTER OF ITS BUSINESS OF LLC IS TO INVEST DIRECTLY OR INDIRECT
"QIANLONG PROPERTY DEVELOPMENT, LLC",(1)TO HOLD INVESTMENTS AND INVEST IN REAL PROPERTY EITHER DIRECTLY OR INDIREC
FOUR TREES MANAGEMENT LLC,"MANAGEMENT, CONSULTING AND ADVISORY SERVICES."
"QIC CORPORATE MANAGEMENT, INC.",PROVISION OF CORPORATE SERVICES
"QICHAO OF NORTH AMERICA, INC.",TO OWN AND OPERATE A CONSTRUCTION BUSINESS.
"QIEF MANAGEMENT, LLC","THE COMPANY’S PURPOSE IS TO ACT AS A GENERAL PARTNER, MANAGER OR IN ANY"
QIG FITNESS WALTHAM LLC,BOUTIQUE FITNESS
QIG FITNESS NATICK LLC,MARKETING AND SALES COMPANY PROVIDING EXERCISE AS A SERVICE.
QIGONG ACUPUNCTURE LLC,"ACUPUNCTURE FOR HEALTH CARE, BUT WON'T PRESCRIBE DRUGS."
"QIKSLV, INC.",RETAIL
"QIMING U.S. VENTURES MANAGEMENT, LLC",MANAGEMENT OF VENTURE CAPITAL INVESTMENTS
QINETIQ INC.,DEFENSE CONTRACTOR
QINETIQ NORTH AMERICA OPERATIONS LLC,COMPUTER ENGINEERING AND TECHNOLOGY SERVICES
PERSPECTA SERVICES & SOLUTIONS INC.,MANAGEMENT AND TECHNICAL CONSULTING
"QINETIQ US HOLDINGS, INC.",HOLDING COMPANY
"QING MEI, INC.",RESTAURANT
"QING MING, LLC",FULL SERVICE RESTAURANT
QING STUDIOS LLC,ONLINE CLOTHES RETAILER
QINGDAO HAI ZHI SHENG BIOENGINEERING CORP.,SALES OF HEALTH RELATED PRODUCTS AND OTHERS
QINGPING MEDIA LLC,"CREATION, MANAGEMENT AND PRODUCTION OF FILM, DIGITAL AND PRINT MEDIA"
QINGYI RIVER CAPITAL LLC,INVESTMENT & TRADING
QINNERVISIONCONCEPTS LLC.,GENERAL CONTRACTING AND BUILDING CODE CONSULTING
"QIPENG, CORP",ASIAN RESTAURANT
QIPGP LLC,INVESTING
QIPO CORPORATION,PLATFORM-AS-A-SERVICE INTEGRATING COLLABORATION TO
"QIPWORKS, LLC",INTELLECTUAL PROPERTY CONSULTANTS
"QIRICI, INC.",COFFEE SHOP AND FAST FOOD RESTAURANT
"QIRJAZI PROPERTY, LLC","(A) TO OWN AND DEVELOP REAL ESTATE AND INTERESTS THEREIN, INCLUDING BUYING, A"
"DSM INSURANCE SERVICES, INC.",OPERATES BUSINESS RELATING TO DENTAL SERVICES
"QITTITUT CONSULTING, LLC","MANAGEMENT CONSULTING SERVICES, SPECIFICALLY GROWTH STRATEGY CONSULTING"
QIU ENTERPRISES LLC,REAL ESTATE RENTAL
QIU JIAN INC.,FOOD SERVICE
QIVIUT CAPITAL FUNDS LP,INVESTING
QIVIUT CAPITAL LP,INVESTMENT MANAGEMENT
QIVIUT GP LLC,INVESTING
"GREENBERG ASSOCIATES, INC.",SALES - MANUFACTURERS REPRESENTATIVE
"QIXAS GROUP US, INC.",IT & BUSINESS CONSULTING
"QIZUUM, INC.",INTERACTIVE PUBLICATION
"MTI-MILLIREN TECHNOLOGIES, INC.",MANUFACTURING
"QK4, INC.",QK4 INC. - ENGINEERING CONSULTING
"QL GROUP, LLC",THE COMPANY MAY ENGAGE IN ANY LAWFUL BUSINESS PERMITTED BY THE MASSACHUS
"QLARANT INTEGRITY SOLUTIONS, LLC",MEDICARE/MEDICAID FRAUD INVESTIGATIONS
"QLARANT QUALITY SOLUTIONS, INC.",HEALTH CARE IMPROVEMENT PROGRAMS
QLARCHITECT LLC,ARCHITECTURAL DESIGN
"QLB BIOTHERAPEUTICS, INC.",BIOTHERAPEUTICS R&D
QLEANAIR SCANDINAVIA INC.,FILTER TECHNOLOGY & CLEANROOM SOLUTIONS
QLIENTOLOGY INC.,DIGITAL MARKETING AGENCY
QLIKTECH INC.,ELECTRONIC DELIVERY OF SOFTWARE
QLIQ LABS LLC,"TO PROVIDE SOFTWARE AND RELATED SERVICES, AND TO ENGAGE IN ANY OTHER LAWFU"
QLOGIC CORPORATION,COMPUTER HARDWARE
"QLOGIC SWITCH PRODUCTS, INC.",COMPUTER EQUIPMENT & PERIPHERALS
"HAMPDEN TECHNOLOGIES, INC.",COMPUTER SOFTWARE
"QLOGIX, INC.","DESIGN, DEVELOP AND MARKET A WEB BASED SYSTEM"
"QLR, LLC",REAL ESTATE DEVELOPMENT AND ALL OTHER LAWFUL PURPOSES
"QLS LOGISTIC SERVICES, LLC",INTERMODAL TRANSPORTATION
"QLS, INC.",TRANSPORTATION
"QLT CONSUMER LEASE SERVICES, INC.",LEASING OF TELEPHONE PRODUCTS
"QLT OPHTHALMICS, INC.",TO COMMERCIALIZE PHARMACEUTICAL & DEVICE PRODUCTS
QLUCORE INC.,CONSULTING
QM BUSINESS CENTER LLC,REAL ESTATE
"QM INTERNATIONAL, INC.",CONSULTING
QM MANAGER LLC,REAL ESTATE
QM POWER INC.,"ELECTRIC MOTORS, GENERATORS AND ACTUATORS"
QM REALTY LLC,REAL ESTATE
"QMED RESOURCES, LLC",PROFESSIONAL CONSULTING AND EDUCATIONAL SERVICES IN HEALTH CARE QUALITY
"QMEDRX, INC.",PARENT COMPANY TO A SPECIALTY COMPOUNDING PHARMACY
QMG HUNTINGTON LIMITED PARTNERSHIP,"INCLUDING, BUT NOT LIMITED TO, ACQUIRING, DEVELOPING, OWNING, HOLDING, SELLIN"
"QMG HUNTINGTON, LLC",TO (I) OWN AN INTEREST IN AND ACT AS MANAGER FOR QMG HUNTINGTON LIMITED PAR
"QMG LAGRANGE, LLC","TO OWN, DEVELOP, INVEST IN REAL PROPERTY OR ANY OTHER MATTER ALLOWED BY LA"
QMH REALTY LLC,REAL ESTATE SALES AND RENTAL
QMI CAPITAL MANAGEMENT LLC,THE COMPANY IS ORGANIZED TO ENGAGE IN ANY LAWFUL ACT OR ACTIVITY FOR WHICH
"QMI, LLC",THE GENERAL CHARACTER OF THE BUSINESS OF THE LLC IS TO ENGAGE IN INVESTMENT I
"QMOCHA, INCORPORATED",HOCHEISER CPA
QMOTION INCORPORATED,WE MANUFACTURE WINDOW SHADES AND SELL TO RETAILERS
"QMS SOFTWARE, INC.",CONSULTING SERVICES
"QMSOLUTIONS CONSULTING, LLC",PROVIDE IT COMPLIANCE AND QUALITY MANAGEMENT CONSULTING TO COMPANIES IN
QMT ASSOCIATES INC.,INTERNET RETAIL SALES
"QMX INVESTMENT HOLDINGS USA, INC.",TECHNICAL CONSULTING FOR THE FINANCIAL INDUSTRY
QNA DX LLC,GENETIC SEQUENCING CLIA CERTIFIED LABORATORY WHICH PROVIDES SEQUENCING SE
SPECIALTY INGREDIENT MANAGEMENT LLC,"THE TRADE OF INGREDIENTS AND PRODUCTS RELATED IN FOOD, FEED, AND PHARMACEU"
QNB FOODS INCORPORATED,RETAIL SALES
QNECT LLC,QNECT HAS DEVELOPED A SOFTWARE SERVICE THAT AUTOMATES STRUCTURAL STEEL C
"QNL GROUP, LLC",REAL ESTATE - RESIDENTIAL REAL ESTATE - RENTING OR LEASING PROPERTY I OWN
QNN LLC,TO OWN AND OPERATE A FOOD AND ICE CREAM BUSINESS AND ANY OTHER RELATED AC
"QNX SOFTWARE SYSTEMS, INC.",OPERATING SYSTEM PROGRAM
QOG INVESTMENTS LLC,"TO INVEST IN, HOLD AND MANAGE INCOME-PRODUCING REAL ESTATE WHICH IS IMPROV"
"QOGNIFY, INC.",SOFTWARE SECURITY PRODUCT AND EQUIPMENT
GENOA HEALTHCARE LLC,PHARMACIES
"QOMMUNITY, LLC",A SOCIAL NETWORKING SITE AND ONE-STOP ONLINE RESOURCE FOR THE LGBTQ COMM
"QOMPLX, INC.",CYBERSECURITY; DATA ANALYTICS
QOPY LLC,CONTENT MARKETING FIRM THAT HELPS LEADING TECHNOLOGY COMPANIES PUBLISH HI
QORAX ENERGY LLC,RENEWABLE ENERGY PRODUCTION
"QORM, LLC",THE PRINCIPAL BUSINESS ACTIVITY AND PURPOSES OF THE LLC SHALL INITIALLY BE TO P
"QORVO TEXAS, LLC","DESIGN, DEVELOP AND MANUFACTURE RADIO FREQUENCY PRODUCT SOLUTIONS"
"QORVO US, INC.",RADIO FREQ. INTEGRATED CIRCUIT MANUFACTURE & SALE
"QP 591, LLC","REAL ESTATE MANAGEMENT, CONSULTING, LEASING"
"QP 595, LLC","REAL ESTATE MANAGEMENT, CONSULTING & LEASING"
"QP 607, LLC","REAL ESTATE MANAGEMENT, CONSULTING & LEASING"
"QP CONSTRUCTION COMPANY, INC.",CONSTRUCTION AND BUILDING
"QP HOLDINGS, LLC","REAL ESTATE MANAGEMENT, CONSULTING & LEASING"
"QP INNOVATIONS, LLC","INVESTMENT & CONSULTING. 1. INVESTING ON EQUITIES, REAL ESTATE, & COMPANIES 2."
QP MEDIA INC.,TRADE PUBLISHER MOTION PICTURE AND TELEVISION
QP PARTNERS CORPORATION,MANUFACTURING
QPAIR INC.,DIGITAL TRANSFORMATION TOOLS AND PRODUCTS
"AMDOCS QPASS, INC.",COMPUTER SOFTWARE SERVICES
"INCOMM AGENT SOLUTIONS, INC.",BILL PAYMENT & RELATED PROCESSING SVCS
QPC CORPORATION,REAL ESTATE RENTAL
QPD MANAGEMENT CORPORATION,RETAIL & WHOLESALE ORIENTAL RUG SALES
QPHARMETRA LLC,QPHARMETRA LLC PROVIDES PHARMACOMETRIC CONSULTING SERVICES TO THE PHARM
"QPID HEALTH, INC.",COMPUTER SOFTWARE
"QPID HEALTH, LLC",COMPUTER SOFTWARE
"QPM, INCORPORATED",PROPERTY MANGEMENT
"QPN, LLC",DEVELOPMENT AND MARKETING OF SOFTWARE APPLICATIONS FOR THE FOCUS GROUP I
"FEEDBACK MEDIA, LLC",FEEDBACK MEDIA PROVIDES VOICE OF THE CUSTOMER PROGRAMS AND CAPTURES CUST
"QPS #2 - EASTHAM, INC.",PACKAGING & SHIPPING OF ALL TYPES OF MERCHANDISE
"QPS #3 - HYANNIS, INC.",PACKAGING & SHIPPING OF ALL TYPES OF MERCHANDISE
"QPS ENGINEERING, LLC",SPECIALTY CONTRACTOR PROVIDING TURNKEY PROJECT-BASED SOLUTIONS.
"QPS MASSACHUSETTS HOLDINGS, LLC",OPERATE AN INVESTMENT HOLDING COMPANY. TO ENGAGE IN ANY LAWFUL ACT OR AC
"QPS, LLC",REAL ESTATE
"QPSI MASS, LLC",CONTRACT PACKAGING
"QPX, INC.",EXPLORATION OF NATURAL RESOURCES
QQ BUS LINE CORPORATION,QQ BUS LINE CORPORATION
QQ ENTERPRISE LLC,REAL ESTATE RENTAL
QQ HONG FOOT MASSAGE AND BODY WORK INC,BODY WORK PERSONAL SERVICES
QQ INTERNATIONAL INC,BUS CHARTERS
QQ SPA CORP,GENERAL BODYWORK SERVICE
QQ TRAVEL INC.,VACATIONS AND TOURISM
QQEST SOFTWARE SYSTEMS INC.,PAYROLL AND HUMAN CAPITAL MANAGEMENT SERVICES
"QR DEVELOPMENT, LLC",REAL ESTATE DEVELOPMENT
"QR LENDING, INC.",1-4 FAMILY RESIDENTIAL FIRST MORTGAGE LENDING
"QR PROPERTIES, LLC",THE GENERAL CHARACTER OF THE BUSINESS OF THE COMPANY IS REAL ESTATE DEVELOP
"QRATIV HOLDINGS, LLC",BIO-TECHNOLOGY DEVELOPMENT
"QRATIV, INC.",DRUG RE-PURPOSING
QRB GREEN CLEANING INC,CLEANING SERVICES
QRC GUIDANCE LLC,QRC GUIDANCE LLC PURSUES VARIOUS LAWFUL BUSINESS ENDEAVORS INCLUDING BUT
"QRF, LLC",SITE IMPROVEMENTS AND GENERAL CONSTRUCTION
"QRI INERNATIONAL, LLC",OPERATING ENTITY
QROO INC.,MASSAGE THERAPY
QRS EQUIPMENT CORP.,EQUIPMENT RENTAL CORPORATION
"QRS FINANCING, LLC",REAL ESTATE
"QRS-ARBORETUM, INC.",REAL ESTATE
"QRS-BOND, INC.",REAL ESTATE
"QRXPHARMA, INC.",HUMAN DRUG DEVELOPMENT
"QS BATTERYMARCH FINANCIAL MANAGEMENT, INC.",INVESTMENT ADVISER
"QS CONSULTING, LLC","CONSULTING AND SUCH OTHER RELATED ACTIVITIES, AS WELL AS TO CARRY ON ANY LA"
"QS FORBES BOULEVARD, LLC",REAL ESTATE HOLDING COMPANY
QS HOULDING LLC,CONVENIENCE STORE
"QS INFORMATION SERVICES, INC.",IT AND SOFTWARE SOLUTIONS FOR BOOK PUBLISHERS
"QS INVESTORS, LLC",INVESTMENT MANAGEMENT
"QS PRIVATE LENDING FUND I, LLC",REAL ESTATE
"QS PRIVATE LENDING FUND II, LLC",REAL ESTATE
QS PRIVATE LENDING FUND LLC,INVESTMENT MANAGEMENT
QS PRIVATE LENDING GP LLC,INVESTMENT MANAGEMENT
"QS PRIVATE LENDING, LLC",THE GENERAL CHARACTER OF THE BUSINESS OF THE LLC SHALL INITIALLY BE THE LENDI
QS QUACQUARELLI SYMONDS (USA) LIMITED,EDUCATION AND RECRUITMENT MEDIA
QS REALTY LLC,REAL ESTATE HOLDING COMPANY
QS2 FINANCIAL LLC,INSURANCE
"QSA GLOBAL, INC.",ILLINOIS TOOL WORK INC
QSC GROUP LLC,"CONSULTING - QUALITY, MANAGEMENT, ENVIRONMENT"
"QSC RESTAURANT MANAGEMENT GROUP, INC.",RESTAURANT
"QSHORE, INC.",SALES OF ALCOHOLIC BEVERAGES
"QUADRANT SOFTWARE, LLC",SOFTWARE SALES
"QUALITY SYSTEMS INTEGRATION (QSI), LLC","IS TO ENGAGE IN ACTIVITIES RELATED TO QUALITY, REGULATORY, ENGINEERING, VALIDA"
"QSI CONSULTING, INC.",CONSULTING SERVICES
"QSI ENVIRONMENTAL & INDUSTRIAL FABRICATORS, INC.",STEEL FABRICATION
QSI TESTING AND CERTIFICATION LLC,SERVICE TO PERFORM TESTING AND CERTIFICATION OF HEPA FILTERS AND CLEAN ROOM
QSIS SRC LLC,PROFESSIONAL SERVICES RELATED TO CONSULTING IN PRODUCT REALIZATION AND ASS
QSL CORPORATION,DESIGN AND WHOLESALE OF CRAFT PRODUCTS
QSLS AVIATION INC.,"AIRCRAFT LEASING AND SALES, SPARE PARTS SALES"
"QSM ASSOCIATES, INC.",COMPUTER SOFTWARE CONSULTING
QSM DIAGNOSTICS INC.,MEDICAL DEVICES
QSOFT CONSULTING L.L.C.,• STRATEGIC QA CONSULTING • INDEPENDENT VERIFICATION AND VALIDATION • QA PRO
QSOFT SYSTEMS INC.,"SOFTWARE SYSTEMS DEVELOPMENT, CONSULTING, TRAINING"
QSR AUTOMATION INC,SOFTWARE AND HARDWARE SALES
QSR INTERNATIONAL (AMERICAS) INC.,SOFTWARE DEVELOPMENT AND SALES
"QSR STEEL CORPORATION, LLC",STRUCTURAL STEEL & MISCELLANEOUS METALS FABRICATION & INSTALLATION
"QST INDUSTRIES, INC.",POCKETING DISTRIBUTORS TO THE APPAREL INDUSTRY
"QSTREAM, INC.",MICROLEARNING ONLINE SOFTWARE APPLICATION
"PACKATLANTIC, INC.",REINSURANCE BUSINESS
QT FOOD AND FUEL LLC,TO OPERATE A BUSINESS FOR THE DISTRIBUTION AND SALE OF GASOLINE AND OTHER PE
QT HOLDINGS CORP.,DEVELOP CELL SEPARATION PROTEIN PURIFICATION TOOLS
QT SPECIAL MEMBER LLC,"THE GENERAL CHARACTER OF THE LLC'S BUSINESS IS TO ACQUIRE (BY PURCHASE, LEASE,"
"QT2 SYSTEMS, LLC","PROFESSIONAL COACHING AND NUTRITION SERVICES IN THE FIELD OF TRIATHLON, SWI"
QTA PARENT LLC,THE GENERAL CHARACTER OF THE BUSINESS IS TO INVEST IN REAL ESTATE DIRECTLY OR
"QTC MEDICAL GROUP, INC., A MEDICAL CORPORATION",MEDICAL/DISABILITY EVALUATIONS
QTC REALTY CORP.,REAL ESTATE COMPANY
"QTD TEMPORARY LABOR SERVICE, INC.",TEMP TO HIRE LABOR SERVICE
"QTEC ANALYTICS, LLC",PROVIDING SERVICES IN THE AREA OF INVESTIGATION AND DUE DILLIGENCE
QTEC SERVICES INC.,PROVISION OF SPECIALIST CONSULTING SERVICES
"QTEC SOLUTIONS, INC.",OUSIDE SALESPERSON WORKING OUT OF HIS HOME.
"QTECH USA, LLC",TO ENGAGE IN THE CONTRACT WORK FOR ENGINEERING DESIGN AND SUPPLY OF ELECTR
