"QUALITY PLAN ADMINISTRATORS, INC.",THIRD PARTY ADMINISTRATOR - HEALTH
QUALITY PLANT GROWERS LLC,"ENGAGED IN THE GROWING, DEVELOPMENT & SALE OF PLANTS AND PRODUCTS"
QUALITY PLUMBING SERVICES INC.,PLUMBING
"QUALITY PLUMBING, INC.",PLUMBING AND HVAC
"QUALITY PLUS PRECISION BUILDERS, INC.",RESIDENTIAL REMODELING & CONSTRUCTION
QUALITY POOLS OF CAPE COD INC,POOL CONSTRUCTION
QUALITY PREFERRED PAINTING AND WALLPAPERING,PAINTING & DECORATING
"QUALITY PRESS OF BEVERLY INC, THE",COMMERCIAL PRINTING
"QUALITY PRINTING COMPANY, INC.",PRINTING COMPANY
QUALITY PRO PAINTING INC,COMMERCIAL & RESIDENTIAL PAINTING
"QUALITY PRODUCE, LLC",VEGETABLE DELIVERY
"QUALITY PROJECT MANAGEMENT, LLC","INSPECTION, TESTING AND CERTIFICATION"
"QUALITY PROPERTIES, LLC","TO ENGAGE IN INVESTMENT IN, AND OWNERSHIP AND DEVELOPMENT OF REAL ESTATE A"
"QUALITY PROPERTY MANAGEMENT SERVICES,","PROPERTY MANAGEMENT, RESIDENTIAL RENTALS"
"QUALITY PROPERTY MANAGEMENT, LLC","QUALITY PROPERTY MANAGEMENT, LLC OFFERS PROPERTY MANAGEMENT SERVICES"
QUALITY PROVINCE LLC,"MANAGE, PURCHASE, SELL, LEASE, AND INVEST IN REAL ESTATE AND TO ENGAGE IN ANY"
QUALITY PUMP & SUPPLY LLC,"RETAIL SUPPLY OF PUMPS, FILTERS AND ASSOCIATED SUPPLIES."
QUALITY QUEST TECH INC.,CONSULTING SERVICES
"QUALITY QUORUM, INC.",PROVIDING SOFTWARE DEVELOPMENT ON CONTRACT BASIS
"QUALITY RADON MITIGATION, LLC",RADON MITIGATION
"QUALITY REHABILITATION SERVICES, LLC",QUALITY REHABILITATION SERVICES PROVIDES PROFESSIONAL SERVICES SUCH AS BUT N
QUALITY RENOVATED HOMES LLC,"BUYING,FIXING UP AND SELLING HOUSES.RESIDENTIAL REMODELING."
QUALITY REPAIR AND DEMOLITION INC,RESIDENTIAL AND COMMERCIAL REPAIR AND DEMOLITION
"PROFESSIONAL VEHICLE CORPORATION, INC.",PROFESSIONAL VEHICLE CORP.
"QUALITY RESIDENCES AND PROPERTIES, LLC",THE GENERAL CHARACTER OF THE BUSINESS OF THE LLC IS TO ACT AS A REAL ESTATE BR
QUALITY RESIDENTIALS CORP.,PROPPERTY MANAGEMENT
QUALITY RESOURCE MANAGEMENT LLC,TO PROVIDE ENGINEERING CONSULTING SERVICES
"QUALITY RESPITE SERVICES, INC.",PROVIDING RESPITE SERVICE
"QUALITY RESTAURANTS, INC.",TO OWN AND OPERATE A BAR AND RESTAURANT
"QUALITY ROOFING SYSTEMS, INC.",ROOFING CONTRACTOR
QUALITY REVIEW ASSOCIATES INC.,THIRD PARTY ADMINISTRATOR
QUALITY REVIEW SERVICES LLC,QUALITY ASSURANCE REVIEW FOR CONSISTENCY AND ACCURACY OF REPORTS.
"QUALITY RISK MANAGEMENT, LLC",THE PRIMARY PURPOSE OF THIS LLC IS TRADING FINANCIAL INSTRUMENTS SUCH AS EQU
"QUALITY ROADSTERS, INC.",ASSEMBLE CUSTOM AUTOMOBILES & AUTOMOTIVE COMPONENT
QUALITY RX PHARMACY INC.,PHARMACY
"QUALITY SEARCH, INC.",SEARCH & PLACEMENT FIRM/EMPLOYMENT AGENCY
"QUALITY SENIORCARE, INC.",SENIOR/ELDER CARE
"QUALITY SEPTIC AND SITE WORK, INC.",SEPTIC AND SITE WORK
QUALITY SERVICES CLEANING INC,GENERAL CLEANING
"QUALITY SERVICES, INC.",JANITORIAL SERVICES
"QUALITY SIDING AND REMODELING, INC.","REMODELING, CARPENTRY, SIDING INSTALLATION"
"QUALITY SLEEP DIAGNOSTICS, INC.",SLEEP DIAGNOSTICS
QUALITY SMILE LLC.,THE GENERAL CHARACTER OF THE BUSINESS: DENTAL CARE PROVIDER. NAME IF MEMBE
QUALITY SNACK FOODS LLC,SNACKS
CFM INC.,SOFTWARE DEVELOPMENT & SALES
"QUALITY SOLUTIONS, INC.",IT AND SOFTWARE SOLUTIONS FOR BOOK PUBLISHERS
"QUALITY STAFFING OF AMERICA, INC.",TEMPORARY STAFFING SERVICES
QUALITY STAFFING TEMP AGENCY INC,STAFFING AGENCY
"QUALITY STAFFING, INC.",EMPLOYMENT SERVICE
QUALITY STEVEDORING SERVICES LLC,TEMPORARY HELP SERVICES
QUALITY STONE MARBLE INC.,MARBLE AND GRANITE BUSINESS
"QUALITY STONE OF BOSTON, INC.",WHOLESALE/RETAIL GRANITE AND MARBLE SUPPLY
"QUALITY STONE VENEER NWP, LLC",INSTALLATION OF MANUFACTURED STONE VENEER.
"QUALITY STONE VENEER, INC.",MASONRY AND STONE VENEER
"AVON QUALITY STORAGE, LLC",THE BUSINESS ACTIVITY AND PURPOSE OF THE LLC SHALL INITIALLY BE THE MANAGEME
"QUALITY SUPPLIES AND MORE, LLC",RETAIL STORE - INTERNET SALES (INCLUDING INDEPENDENT SALES ON AN AUCTION SIT
"QUALITY SUPPORT GROUP, INC.",CONSULTING AND TRAINING
"QUALITY SYSTEM SOLUTIONS, LLC",CONSULTING SERVICES - QUALITY SYSTEM ADVICE FOR MEDICAL DEVICE AND PHARMAC
"QUALITY SYSTEMS AND COMPLIANCE, INC.",CONSULTING
"QUALITY SYSTEMS CONSULTANTS, INC.",CONSULTING
"QUALITY SYSTEMS CONSULTING SERVICES, INC.",ASTA LLC
"QUALITY SYSTEMS EXPORT, INC.","SALE, DISTRIBUTION & EXPORT OF SOFTWARE PRODUCTS"
"QUALITY SYSTEMS WORLDWIDE, LLC",CONSULTING AND RESOLUTION OF QUALITY SYSTEM ISSUES
"NEXTGEN HEALTHCARE, INC.","SALE OF COMPUTER HARDWARE, SOFTWARE, AND SERVICES"
BAE SYSTEMS INFORMATION SOLUTIONS INC.,A FULL-SERVICE INFORMATION TECHNOLOGY (IT) SOLUTIO
"QUALITY TAX & BOOKKEEPING SERVICES, INC.","TAX PREP, ACCOUNTING, BUDGETING, ESTATE WORK"
QUALITY TAX AND BUSINESS PARTNERS MEDFORD INC,"PROVIDING TAX, FINANCIAL AND RELATED SERVICES"
QUALITY TAX AND BUSINESS PARTNERS OF MA INC,QUALITY TAX AND BUSINESS PARTNERS
"QUALITY TAX AND BUSINESS PARTNERS, LLC","TAX RETURN PREPARATION AND BUSINESS SERVICES, WHICH INCLUDE BOOKKEEPING, FI"
"QUALITY TECH WELDING, LLC",MICROSCOPIC WELDING
QUALITY TELEPHONE INC.,TELECOMMUNICATIONS
"QUALITY TELESERVICES MANAGEMENT, INC.",TELE COMMUNICATIONS
"QUALITY TEMP SERVICE, INC.",TEMPORARY EMPLOYMENT AGENCY
"QUALITY TEMPS,INC.",EMPLOYMENT AGENCY
"QUALITY TITLE & ABSTRACT AGENCY, INC.",THE JORDAN REAL ESTATE GROUP
"QUALITY TOOL COMPANY , INCORPORATED",MACHINE SHOP
"QUALITY TOOL, INC.",THE COMPANY MANUFACTURES DISPLAY ITEMS
"QUALITY TOWING & RECOVERY, INC.",TOWING AND TRANSPORTING VEHICLES
"QUALITY TRAINING RESOURCES, INC.",COMPUTER TRAINING SERVICES
QUALITY TRANSMISSION INC.,TRANSMISSION AND AUTO REPAIRS
"QUALITY TREE AND LANDSCAPING, LLC",ALL ASPECTS OF TREE WORK AND LANDSCAPING.
"QUALITY TREE WORK AND LANDSCAPE, INC.",LANDSCAPE
ALAMO BUILDER COMPANY INC,CONSTRUCTION SERVICES
QUALITY VAKUUM PRODUCTS INC.,MANUFACTURER OF WOODWORKING EQUIPMENT
QUALITY VALUATION SERVICES LLC,APPRAISAL MANAGEMENT SERVICES
"QUALITY VAN SALES, INC.",VAN CONVERSIONS
"QUALITY VAULT & CASKET, INC.",SELLING OF BURIAL VAULTS AND CASKETS
"QUALITY VISION INTERNATIONAL, INC.",MANUFACTURER OF PRECISION METROLOGY EQUIPMENT
"QUALITY WHOLESALE DOOR, INC.",DOOR ASSEMBLY
"QUALITY WHOLESALER & DISTRIBUTOR, INC.",WHOLESALE & DISTRIBUTION
QUALITY WINDOW AND DOOR INC.,SELL HOME IMPROVEMENT PRODUCTS
"QUALITY WIRE WORKS, INC.",WIRE MANUFACTURER
"QUALITY WOOD PRODUCTS, INC.",FLOORING SALES & INSTALLATION
QUALITY WOODWORKS LLC,CARPENTER
"QUALITY WOODWORKS, INC.",BUILDING COMPANY
"QUALITY WORK & SERVICES, INC.","LANDSCAPING, HYDROSEEDING, FENCE INSTALLTION"
QUALITY WORKS CONTRACTING LLC,GENERAL CONTRACTING COMPANY
QUALITYBUILT CONSTRUCTION INC,CONSTRUCTION
"OPTUMINSIGHT LIFE SCIENCES, INC.",HEALTHCARE DATA MANAGEMENT SERVICES
QUALITYPARK US LLC,TO ENGAGE IN THE BUSINESS OF COMPUTER CONSULTING SERVICES AND ANY OTHER LA
"QUALITYWORKS, L.L.C.",HEALTH CARE RECRUITMENT AND INTERIM HEALTH CARE MANAGEMENT AND RECORD R
"QUALLABY NORTH AMERICA, INC.",SOFTWARE
QUALLY SERVICES CORPORATION,JANITORIAL CLEANING SERVICES
"KAVIDAL PAINTING, INC",PAINTING SERVICES
QUALMED SOLUTIONS LLC,THE GENERAL CHARACTER OF THE BUSINESS OF THE LLC IS TO ENGAGE IN ANY ACTIVITY
QUALTECH INC.,CONSULTING SERVICES
SOCIAL WEBFORCE INC,WEB 2.0 SOFTWARE
"QUALTRA CONSULTING, INC.",CONSULTING BUSINESS
"QUALTRE, INC.",DESIGN AND SALE OF SEMICONDUCTOR COMPONENTS
"WORLDWIDE TECHSERVICES, LLC",TECHNOLOGY SERVICES AND SUPPORT
"PCC SPECIALTY PRODUCTS, INC.",MANUFACTURING
QUAMPA LLC,SELL AFTERMARKET AUTOMOTIVE PARTS
"QUAN 113, INC.",RESTAURANT
"QUAN AM MARKET, LLC",LIQUOR AND CONVENIENT STORE
"QUAN CHINESE KITCHEN, INC.",CHINESE RESTAURANT
"QUAN'S ENTERPRISES, INC.",CHINESE RESTAURANT
"QUAN'S ENTERPRISES, LLC","THE GENERAL CHARACTER OF THE BUSINESS OF THE LLC IS TO ACQUIRE, MANAGE AND O"
QUAN'S KITCHEN OF HANOVER INC.,CHINESE RESTAURANT
"QUAN'S KITCHEN, INC.",CHINESE RESTAURANT
"QUANDT HOLDINGS, LLC","TO BUY, SELL, LEASE, OR OTHERWISE INVEST IN RESIDENTIAL AND COMMERCIAL REAL ES"
"QUANG'S KITCHEN, INC.",OWN AND OPERATE A RESTAURANT BUSINESS
QUANNAPOWITT 591 LIMITED PARTNERSHIP,REAL ESTATE
QUANNAPOWITT 595 LIMITED PARTNERSHIP,REAL ESTATE
QUANNAPOWITT 607 LIMITED PARTNERSHIP,REAL ESTATE
"QUANNAPOWITT ENTERPRISES, LLC",INVESTMENTS
QUANNAPOWITT SECURITIES CORP.,SECURITY CORPORATION
"QUANOMICA, LLC",REAL ESTATE
QUANQIO INVESTMENT CORPORATION,IMPORT AND EXPORT
QUANSET ENTERPRISES LLC,GLASS REPAIR AND INSTALLATION
"QUANSET POND PROPERTY, LLC",THE OWNERSHIP AND MAINTENANCE OF RESIDENTIAL REAL ESTATE IN BARNSTABLE CO
"QUANSETT ASSOCIATES, INC.",FINANCIAL CONSULTING AND OTHER ADVISING
"QUANSETT NURSERIES, INC.","QUANSETT NURSERIES, INC."
QUANT VEST CONSULTING GROUP INC.,CONSULTING IN THE FIELDS OF FINANCE AND TECHNOLOGY
"QUANTA DEVELOPMENT, LLC",REAL ESTATE DEVELOPMENT AND OFFICE MANAGEMENT
"QUANTA ELECTRIC POWER CONSTRUCTION MANAGEMENT,",COMMERCIAL AND INDUSTRY BUILDING CONSTRUCTION
"QUANTA ENERGIZED SERVICES U.S., LLC",SPECIALTY CONTRACTOR PROVIDING SERVICES RELATED TO ELECTRIC INFRASTRUCTUR
"QUANTA FINANCE, LLC",COMMERCIAL LENDING
"QUANTA IMAGING, LLC",PRECLINICAL IMAGING CONTRACT RESEARCH ORGANIZATION
QUANTA MANAGEMENT LLC,QUANTA MANAGEMENT LLC WILL PROVIDE MANAGEMENT CONSULTING SERVICES TO C
"QUANTA POWER GENERATION, INC.",PROVIDE A COMPLETE SCOPE OF SERVICES TO POWER INDU
"QUANTA RESEARCH CAMBRIDGE, INC.",R&D
QUANTA SEED LLC,ELECTRONIC AND SOFTWARE ENGINEERING AND DESIGN.
"QUANTA SUBSURFACE, LLC",TO PROVIDE ENGINEERING SERVICES AND VALUE ENGINEERING CONSULTING FOR BOTH
"QUANTA TELECOMMUNICATION SERVICES,",TELECOMMUNICATION SERVICES
"QUANTA UTILITY ENGINEERING SERVICES, INC.",PROVIDES A NUMBER OF UTILITY ASSET MANAGEMENT SERV
"SPECTRUM WIRELESS SOLUTIONS, INC.",UTILITY CONSTRUCTION
"QUANTABUS, INC.","DESIGN, PRODUCTION AND SOFTWARE SERVICES"
QUANTAC INC.,BIOSENSOR DEVELOPMENT
"QUANTACE, INC.",MARKETING AND SALES OF BIOCHEMICAL PRODUCTS
"QUANTAPIX, INC.",SOFTWARE DEVELOPMENT AND CONSULTING
"QUANTAQ, INC.",WE ASSEMBLE AND SELL LOW-COST AIR QUALITY SENSORS
"QUANTCO, INC.",DATA ANALYTICS SOLUTIONS & SERVICES
QUANTECH SERVICES INC.,CONSULTING SERVICES
"QUANTEK INSTRUMENTS, INC.",OXYGEN AND CARBON DIOXIDE ANALYSIS EQUIPMENT
"QUANTEK, LLC.",IT SERVICES
"QUANTEM AVIATION SERVICES, LLC",AIR CARGO AND POSTAL HANDLING
QUANTERIX CORPORATION,BIOTECHNOLOGY - DIAGNOSTICS
QUANTERIX SECURITY CORPORATION,INVESTMENT ACTIVITIES ON ITS OWN BEHALF
"QUANTERRA, INC.",MANUFACTURING SEISMOLOGICAL INSTRUMENTS
"QUANTIA, INC.",MANAGE AND DEVELOP ONLINE COMMUNITY FOR PHYSICIANS
"QUVOZA INTERNATIONAL, LLC (QUVOSA)",ADMINISTRATING THE ORGANIZATION AND DEVELOPMENT OF VISUAL ARTS TO KINDLE F
"QUANTICAE US, INC.","CONSULTING, SALES SUPPORT"
QUANTICATE INC.,CONTRACT RESEARCH SERVICES
QUANTICO WAY LLC,THE GENERAL CHARACTER OF THE BUSINESS OF THE LLC IS TO ENGAGE IN INVESTMENT
"QUANTICS, INC.",HOSPITALITY DESIGN
"QUANTIFIED CONSULTING, LLC",TO PROVIDE OR FACILITATE THE PROVISION OF CONSULTATION SERVICES ON DATA ANA
"QUANTIPHI, INC.","AI, DECISION SCIENCE AND DATA ANALYTICS SERVICES"
QUANTIS INC.,Address (no PO Box)
"QUANTISIS RESEARCH, INC.",CONSULTING
"QUANTITATIVE ECONOMIC SOLUTIONS, LLC",MICROECONOMIC CONSULTING
"QUANTITATIVE ENHANCED DECISIONS FUND, L.P.","ANY LAWFUL ACT OR ACTIVITY, INCLUDING BUT NOT LIMITED TO THE BUSINES SOF INVE"
"QUANTITATIVE ENVIRONMENTAL ANALYSIS, LLC",ENVIRONMENTAL CONSULTING
"QUANTITATIVE FOCUS, INC.",QUANTITATIVE MODELING AND ANALYSIS CONSULTING
QUANTITATIVE IMAGING SOLUTIONS LLC,SOFTWARE DEVELOPMENT
"PEAR TREE ADVISORS, INC.",MANAGEMENT ADVISORY FEE
"QUANTITATIVE RESEARCH SERVICES, INC.",QUANTITATIVE RESEARCH SERVICES
"QUANTITATIVE SECURITIES RESEARCH, INC.",SECURITES RESEARCH PUBLIC EQUITIES
"QUANTITATIVE SOLUTIONS, INC.",BUSINESS ANALYTICS.
"SCALED OUTCOMES, LLC",SOFTWARE DEVELOPMENT CONSULTING
"QUANTIVLY, INC.",EMPOWERING RADIOLOGY TO ACHIEVE MORE
QUANTIX CORP.,SOFTWARE DEVELOPMENT AND CONSULTING
QUANTIZER INC,SOFTWARE
"QUANTLAB MA, INC.",SOFTWARE DEVELOPMENT
QUANTO PROPERTIES LLC,REAL ESTATE INVESTMENT AND ALL OTHER LAWFUL PURPOSES.
QUANTOMETRIX INC.,MANUFACTURE OF INTERCOM SYSTEMS
"QUANTOPIAN (GP), LLC","TO ENGAGE IN ANY LAWFUL ACTIVITIES, INCLUDING BUT NOT LIMITED TO BUSINESS OF I"
QUANTOPIAN INC.,TOOLS & INFRASTRUCTURE FOR ALGORITHMIC STRATEGIES
"QUANTOPIAN MANAGEMENT (GP), LLC",TO ENGAGE IN ANY LAWFUL ACTIVITIES INCLUDING BUT NOT LIMITED TO THE BUSINESS
"QUANTOPIAN MANAGEMENT, LP","TO ENGAGE IN ANY LAWFUL ACTIVITIES, INCLUDING BUT NOT LIMITED TO THE BUSINESS"
"QUANTORI, LLC",CONSULTING SERVICES AND ALL OTHER BUSINESS ALLOWED BY LAW.
"QUANTRIVER SYSTEMS, LLC",CONSULTING SERVICES AND CUSTOM SOFTWARE DEVELOPMENT
"QUANTRONIX, INC.",IT SERVICES FIRM
"QUANTROS, INC.",SOFTWARE SALES AND SUPPORT
QUANTTUS SECURITES CORPORATION,HOLDING COMPANY
"QUANTTUS, INC.",DEVELOPING PERSONAL MONITORING DEVICE
"QUANTUM APPLIED SCIENCES, LLC",TECHNOLOGY STARTUP
"QUANTUM ASSOCIATES, INC.",MANAGEMENT CONSULTING SERVICES
"QUANTUM AUTO GROUP, LLC",SALES FINANCE
"QUANTUM BEHAVIORAL CONSULTING, LLC",WE PROVIDE BEHAVIOR ANALYTIC CONSULTING SERVICES TO SCHOOLS AND FAMILIES F
"QUANTUM BOOKS, INC.",BOOKSALES
"QUANTUM BRIDGE COMMUNICATIONS, INC.","DEVELOPMENT, MANUFACTURE, MARKETING AND SALES OF T"
"QUANTUM CARE NETWORK, INC.",PROVIDER OF HOME HEALTH
"QUANTUM CATALYTICS, LLC",RESEARCH & DEVELOPMENT ON MATERIALS
MILLENNIUM PETROCHEMICALS INC.,MANUFACTURE AND SALE OF ACETIC ACID
"QUANTUM CONSTRUCTION CONSULTANTS,",A UNIQUE FIRM SPECIALIZING IN THE BRIDGE AND ROADWAY INFRASTRUCTURE NEEDS O
QUANTUM CORPORATION,SALE OF COMPUTER DATA STORAGE EQUIPMENT
QUANTUM DATA SPACE LLC.,THE CORE OF ALL OF QUANTUM DATA SPACE'S SERVICES IS THE NETWORK OF SSAE 16 TY
"QUANTUM DESIGNS, LLC",INNOVATIVE FOOD AND BEVERAGE PRODUCT DEVELOPMENT
QUANTUM DEVELOPMENT LLC,REAL ESTATE DEVELOPMENT
"QUANTUM DIAMOND TECHNOLOGIES, INC.",DEVELOPMENT OF NANOTECHNOLOGY
QUANTUM DYNAMICS INTERNATIONAL LLC,COMPUTER CONSULTING
QUANTUM DYNAMICS LLC,CONSUMER ELECTRONICS PRODUCT DESIGN AND DEVELOPMENT
"QUANTUM ELECTRIC, INC.",CONSTRUCTION - ELECTRICAL
"QUANTUM ENERGY HOLDINGS, LLC","MANAGEMENT SERVICES, ENERGY INDUSTRY."
"QUANTUM ENGINEERING, INC.",ENGINEERING
QUANTUM GLOBAL TECHNOLOGY LLC,ASSISTING SMALL COMPANIES IN THEIR DEVELOPMENT
QUANTUM HEDGE LLC,"THE GENERAL CHARACTER OF THE BUSINESS OF THE LLC IS TO PURCHASE, OWN, MANAG"
QUANTUM HELIOS INC.,"COMPUTER SOFTWARE , IT CONSULTING"
QUANTUM INNOVATION CORPORATION,"CONSULTING, TRAINING AND ALL LAWFUL BUSINESS"
"QUANTUM INSTALLATION GROUP, LLC","RETAIL MERCHANDISING, RESETS, AND LIGHT CONSTRUCTION"
"QUANTUM INSURANCE DESIGN, LLC",BROKER DEALER
"QUANTUM LEAP ENGINEERING, INC.",ENGINEERING
"QUANTUM LEAP MARKETING, INC.",ADVERTISING / MARKETING- MARKETING SERVICES
"QUANTUM LEAP PACKAGING, INC.",HIGH PERFORMANCE MATERIALS FOR THE ELECTRONICS IND
"QUANTUM LEARNING, INC.",SOFTWARE SALES
QUANTUM LOTUS LLC,THIRD PARTY LOGISTICS
QUANTUM MANAGEMENT LLC,FINANCIAL AND PERSONNEL SERVICES
"QUANTUM MECHANICS, INC.",AUTOMOBILE SERVICE AND REPAIR
"QUANTUM MEDICAL IMAGING, L.L.C.",MEDICAL DEVICE MANUFACTURING
QUANTUM MERCHANDISING LLC,ELECTRONIC RETAIL
"QUANTUM MICROWAVE COMPONENTS, LLC",ELECTRONIC COMPONENT DISTRIBUTION
"QUANTUM MOTION, LLC",THE GENERAL CHARACTER OF THE BUSINESS OF THE LLC IS THE MANUFACTURING AND S
QUANTUM MSP LLC,INFORMATION TECHNOLOGY SERVICES AND SALES
"QUANTUM PATHOLOGY, LLC",PATHOLOGY LAB
"QUANTUM PLUS, INC.",BOOK SALES
QUANTUM PREP LLC,"ACADEMIC TUTORING, STANDARDIZED TEST PREPARATION, COLLEGE ADMISSIONS AND G"
"QUANTUM PROJECT PARTNERS, INC.",CONSULTING SERVICES
QUANTUM REALTY CORP.,REAL ESTATE COMPANY
"QUANTUM RELOCATION SERVICES, LLC",RELOCATION SERVICES
"QUANTUM RETAIL TECHNOLOGY, INC.",SOFTWARE SERVICES
"QUANTUM SEMICONDUCTOR ALGORITHMS, INC.",CONSULTING AND SOFTWARE FOR RESEARCH IN PHYSICS
QUANTUM SERVICING CORPORATION,LOAN MITIGATION & WORKOUT SERVICES
"QUANTUM SIMULATION TECHNOLOGIES, INC.","IT SERVICE, SOFTWARE DEVELOPMENT"
"QUANTUM SPATIAL, INC.",GEOSPATIAL SOLUTIONS
"QUANTUM STRATEGIC ADVISORS, INC.",MANAGEMENT CONSULTING AND OTHER BUSINESS SERVICES
"QUANTUM STRATEGIC ADVISORS, LLC",MANAGEMENT CONSULTING AND OTHER PROFESSIONAL SERVICES
QUANTUM TRANSPORTATION LLC,MEDICAL TRANSPORTATION
QUANTUM TRIANGLE LLC,"THE RESEARCH, EXPLORATION AND DEVELOPMENT OF QUANTUM TECHNOLOGIES AS THE"
"QUANTUM WELLNESS CONCEPTS, INC.",CLINICAL COUNSELING AND LIFE COACH SERVICES
QUANTUM WELLNESS LLC,NUTRITIONAL CONSULTANT
QUANTUMID TECHNOLOGIES INC.,COMPUTER TECHNOLOGY
"QUANTUMPLATE, LLC",THE PURPOSE OF THE LIMITED LIABILITY COMPANY IS TO PROVIDE BUSINESS CONSULTIN
"QUANTUMSHIFT COMMUNICATIONS, INC.",TELECOMMUNICATIONS EXPENSE MANAGEMENT FIRM
"QUANTUMSOFT, INC","SOFTWARE DEVELOPMENT & CONSULTING, GRAPHICS DESIGN"
"QUANTUNIVERSITY, LLC",TECHNOLOGY TRAINING AND CONSULTING
"QUARANTE, LTD.",CLOTHING RETAILER
"QUARANTELLO INSURANCE AGENCY, INC.",INSURANCE AGENCY
QUARAS LLC,QUICK BASE USER AND REALM ADMINISTRATION SERVICES
"SQAREG, INC.",CONSULTING - QUALITY AND REGULATORY
QUARIUS INC.,CONSULTING
QUARK HOLDINGS LLC,"TO PURCHASE, IMPROVE, DEVELOP, LEASE, EXCHANGED, SELL, DISPOSE OF, AND OTHERW"
"QUARK IMAGING SOLUTIONS, LLC",IMAGING PROCESSING AND SEGMENTATION; IMAGING ANALYTICS AND REPORT GENERA
QUARK VENTURE (US) INC.,VENTURE CAPITAL INVESTMENT IN BIO/PHARMA INDUSTY
"HOCKANUM ROAD, LLC",RESIDENTIAL LAND DEVELOPMENT AND SALES
"QUARRY BROTHERS, INC.",SALES LANDSCAPING PRODUCTS
"QUARRY CAPITAL GROUP, LTD.",FINANCIAL CONSULTING
"QUARRY CAPITAL MANAGEMENT, LLC",PRIVATE EQUITY FIRM
"QUARRY CAPITAL PARTNERS, LLC",THE PURPOSE OF THE COMPANY IS TO OPERATE REAL ESTATE INVESTMENT FUNDS AND
QUARRY CORP.,HOLDS REAL ESTATE
"QUARRY DEVELOPMENT, LLC",TO ENGAGE IN GENERAL CONSTRUCTION AND REAL ESTATE HOLDING AND DEVELOPMEN
QUARRY ENERGY CORPORATION,RENEWABLE POWER GENERATOR
QUARRY FOUR LAND CORP.,PROPERTY MANAGEMENT
"QUARRY HILLS ASSOCIATES, INC.",GOLF COURSE
"QUARRY HILLS ASSOCIATES, LIMITED",GOLF COURSE OPERATIONS
"QUARRY HILL DEVELOPMENT CO., INC.",EXCAVATING SERVICES
QUARRY HILLS ANIMAL HOSPITAL LLC,ANIMAL HOSPITAL
QUARRY HILLS INVESTOR LLC,THE GENERAL CHARACTER OF THE BUSINESS OF THE LLC IS TO INVEST IN REAL ESTATE EI
QUARRY HILLS LLC,OWNERSHIP AND OPERATION OF REAL ESTATE
QUARRY HILLS MANAGER LLC,THE GENERAL CHARACTER OF THE BUSINESS OF THE LLC IS TO INVEST IN REAL ESTATE EI
"QUARRY HILLS PLUMBING & HVAC , INC.",QUARRY HILLS PLUMBING & HVAC INC
QUARRY HILLS RESIDENTIAL HOLDINGS LLC,OWNERSHIP AND OPERATION OF REAL ESTATE AND RELATED ACTIVITIES.
"QUARRY INDUSTRIES, INC.",TO SELL MARBLE AND GRANITE FOR INSTALLATION
QUARRY LIMITED PARTNERSHIP,TO OWN REAL ESTATE
QUARRY ONE LAND CORP.,PROPERTY MANAGEMENT
QUARRY PLACE ONE LLC,THE LLC IS ENGAGED IN PROVIDING A FULL RANGE OF REAL ESTATE SERVICES.
QUARRY PLACE TWO LLC,THE LLC IS ENGAGED IN PROVIDING A FULL RANGE OF REAL ESTATE SERVICES.
"QUARRY RECLAMATION, INC.",FILLING AND RESTORATION OF ROCK QUARRY
QUARRY ROAD CORP.,REAL ESTATE MANAGEMENT
"QUARRY SQUARE REALTY, LLC",REAL ESTATE DEVELOPMENT
"QUARRY STONE, LLC","TO ENGAGE IN THE INVESTMENT IN, OWNERSHIP IN AND DEVELOPMENT OF REAL ESTATE"
QUARRY STREET - BRYANT HILL FARMS,SOLAR PROJECT DEVELOPER
QUARRY STREET MANAGEMENT CO LLC,MANAGE RESIDENTIAL REAL PROPERTY.
QUARRY STREET REALTY CORP.,REAL ESTATE RENTAL
QUARRY THREE LAND CORP.,PROPERTY MANAGEMENT
"QUARRY TRUCK CO., INC.",TRUCKING
QUARRY TWO LAND CORP.,PROPERTY MANAGEMENT
QUARRY VIEW CONSTRUCTION LLC,GENERAL CONTRACTING
QUARRY VIEW REALTY LLC,THE GENERAL CHARACTER OF THE BUSINESS OF THE LLC IS TO ENGAGE IN THE OWNERSH
"QUARRYSTONE BOARD, LLC",CONDO TRUSTEE
QUARRYTEK LLC,TECHNICAL CONSULTING FOR QUARRY APPLICATION.
"QUARTER CENTURY WIRELESS ASSOCIATION, INC.","PROMOTE AMATEUR RADIO, AWARD SCHOLARSHIPS"
QUARTER HORSE LLC,INACTIVE (REAL ESTATE)
"QUARTER LINE DRESSAGE UNLIMITED, LLC",HORSE BOARDING AND TRAINING
QUARTER MOON FLORAL LIMITED PARTNERSHIP,FLORAL DESIGN FOR WEDDINGS & EVENTS.
"QUARTER MOON, INC.",CORPORATE TRANSPORTATION
QUARTER NOTE CORPORATION,"MUSIC LESSONS, RETAIL"
"QUARTER WASH, INC.",COMMERCIAL LAUNDROMAT
"QUARTER, LLC","INVESTMENT IN, AND OWNERSHIP AND DEVELOPMENT OF, REAL ESTATE AND INTERESTS"
LONTANO REAL ESTATE LLC,REAL ESTATE SERVICES
"QUARTERLINE CONSULTING SERVICES, LLC",GOV CONTRACTOR MED SERVICES AND IT
"QUARTERMOON, LLC","REAL ESTATE TRANSACTIONS INCLUDING: INVESTMENT, SALE, PURCHASE, RENTAL, MAIN"
"QUARTERPOINT, INC.","SOFTWARE SALES, MAINTENANCE AND SUPPORT"
"QUARTERS DESIGN+BUILD, LLC",DESIGN AND BUILDING OF SINGLE FAMILY RESIDENTIAL HOUSES
"QUARTERS HARDWARE, INC.","QUARTERS HARDWARE, INC."
QUARTET CORPORATION,PRODUCT DEVELOPMENT & PROTOTYPING
"QUARTET MEDICINE, INC.",DRUG DISCOVERY
"QUARTICA, INC.",CONSULTING AND SOFTWARE DEVELOPMENT
"QUARTICA, LLC","CONSULTING, SOFTWARE DEVELOPMENT AND ANY OTHER RELATED ACTIVITY."
"QUARTIX, INC.",VEHICLE TRACKING/WEB BASED DATA MANAGEMENT
"QUARTULLI AND ASSOCIATES, INC.",PROVIDE REHAB STAFFING
"QUARTUS STRATEGIES, LLC","PUBLIC AFFAIRS, COMMUNICATIONS"
"QUARTX FLEET MANAGEMENT, INC.",CAR RENTAL SERVICES
"QUARTZ & GRANITE PRO, INC",NATURAL STONE INSTALLATION/FABRICATION
QUARTZ AND RAFFIO LLC,TO PURCHASE AND RENT REAL ESTATE AND OTHER PROPERTY.
"QUARTZ ASSOCIATES, INC.","TECHNICAL WRITING, CONSULTING & DEVELOPMENT"
"QUARTZ ENTERPRISES, LLC",EARN COMMISSIONS FROM SALES AND CONSULTING SERVICE
QUARTZ LABS LLC,THE GENERAL CHARACTER OF THE BUSINESS OF THE COMPANY INCLUDES BUT IS NOT LI
QUARTZ REALTY CORP.,REAL ESTATE COMPANY
"QUARTZITE PROCESSING, INC.",MANUFACTURING CERAMIC PARTS
QUASAR GROUP LLC,PROVIDE CLIENTS WITH ADVERTISING AND MARKETING NEEDS
QUASAR SERVICES INC.,COMPUTER SOFTWARE SERVICES
QUASARAY INC.,IT CONSULTING
QUASEM ENTERPRISES LLC,"THIS IS A FAMILY STYLE RESTAURANT SERVING WINGS, STEAK TIPS, RIBS, BURGERS AND"
"QUASHNET VALLEY, LLC",REAL ESTATE MANAGEMENT
QUASON LLC,TO OWN AND INVEST IN ONE OR MORE ENTITIES ENGAGED IN MANUFACTURING OR DIST
QUATERNARY LLC,THE GENERAL CHARACTER OF THE BUSINESS OF THE LLC IS TO ENGAGE IN THE INVESTME
QUATERNION RISK MANAGEMENT U.S. INC.,RISK SOFTWARE DEVELOPMENT
"QUATRO AMIGOS, INC.",FULL SERVICE RESTAURANT
QUATRRO F&A SOLUTIONS INC.,ACCOUNTING
"QUATTRO FIGLI, LLC","THE GENERAL CHARACTER OF THE BUSINESS OF THE LLC IS TO DEVELOP, MANAGE, OPER"
"QUATTRO HOLDINGS, LLC","ACQUIRE, DEVELOP, INVEST AND MANAGE REAL ESTATE."
"QUATTRO WIRELESS, INC.",HOLDING COMPANY
QUATTROCCHI OLD WESTMOOR FARM LLC,"TO TAKE, BUY, PURCHASE, EXCHANGE, HIRE, LEASE OR OTHERWISE ACQUIRE REAL ESTAT"
"QUATTRUCCI CONSTRUCTION SERVICES, INC.",CONSTRUCTION
"QUAVO, INC.",SOFTWARE DEVELOPMENT
QUAY REALTY ASSOCIATES LIMITED PARTNERSHIP,REAL ESTATE OWNERSHIP AND RENTAL
QUAZO INTERNATIONAL LLC,"AN OVERALL ENTERTAINMENT COMPANY, CONCERT PROMOTIONS, CLUB PROMOTIONS,"
"QUBETIC, LLC",THE GENERAL CHARACTER OF THE BUSINESS IS TO OFFER ARCHITECTURAL SERVICES AN
"QUBICAAMF WORLDWIDE, LLC",MANUFACTURE AND PRODUCTION OF BOWLING EQUIPMENT
"QUBIQ, LLC",SOFTWARE ENGINEERING SERVICES
QUBITRONIC LLC,THE GENERAL CHARACTER OF THE LIMITED LIABILITY COMPANY IS TO ENGAGE IN ANY L
"QUDSIA S., P.C.",PHYSICIAN
"QUE T. DINH, D.M.D., PLLC","DENTAL OFFICE THE FOLLOWING MEMBER, QUE T. DINH, DMD PROVIDES THE PROFESSIO"
"QUEALLY CONSULTING ASSOCIATES, INC.",CONSULTING & FINANCE BROKER COMMERCIAL REAL ESTATE
"QUEALY FUNERAL HOME, INC.",FUNERAL HOME SERVICES
"QUEBEC-LABRADOR FOUNDATION, INC., THE",NONPROFIT ENVIRONMENTAL ORGANIZATION
"WORLD COLOR HALLIDAY, INC.",COMMERCIAL PRINTING
QUEBECOR WORLD NORTHEAST GRAPHICS INC.,COMMERCIAL PRINTING SERVICES
"QUECHEE HOUSE, LLC","THE GENERAL CHARACTER OF THE BUSINESS OF THE LLC IS TO PURCHASE, DEVELOP, MA"
"QUECHEE MAIN, LLC","THE COMPANY WILL ACQUIRE, SELL, FINANCE, OPERATE AND MANAGE REAL ESTATE AN"
"QUECHEE PARTNERS, LLC","(I) TO MAKE INVESTMENTS IN EQUITY, DEBT OR EQUITY-LIKE SECURITIES OF"
QUECHEE REALTY TRUST LLC,"THE GENERAL CHARACTER OF THE BUSINESS IS TO BUY, SELL, LEASE, RENT, PLEDGE, MOR"
"QUECHEE WEBSTER, LLC",THE PRINCIPAL BUSINESS ACTIVITY AND PURPOSES OF THE LLC SHALL INITIALLY BE TO A
QUECON INC.,CLERICAL AND CONSULTING SUPPORT FOR THE FAA
"QUEEN ANNE ACCESSORIES, LLC",SELL PROMOTIONAL PRODUCTS
"QUEEN ANNE AUTO REPAIR, INC.",AUTO REPAIR SHOP
QUEEN ANNE II INVESTMENT LIMITED,THE PURPOSE OF THE LIMITED PARTNERSHIP IS TO ENGAGE IN THE BUSINESS OF REAL EST
"QUEEN ANNE INN, INC.",OPERATION OF INN.
QUEEN ANNE LLC,"TO ENGAGE IN THE INVESTMENT IN, AND OWNERSHIP AND DEVELOPMENT OF, REAL ESTA"
"QUEEN ANNE NURSING HOME, INC.",ELDER HEALTHCARE - NURSING HOME
QUEEN ANNE ROAD BARN LLC,"THE PURPOSE OF THE LLC IS TO OWN, PURCHASE, HOLD, SELL AND MANAGE REAL PROPE"
QUEEN ANNE'S GATE APARTMENTS COMPANY,THE PURPOSE OF THE LIMITED PARTNERSHIP IS TO ENGAGE IN THE BUSINESS OF REAL EST
QUEEN ANNE'S GATE APARTMENTS COMPANY II,THE PURPOSE OF THE LIMITED PARTNERSHIP IS TO ENGAGE IN THE BUSINESS OF REAL EST
"QUEEN ANNE'S RESTAURANT & CATERING, INC.",RESTAURANT AND CATERING BUSINESS
"QUEEN ASSOCIATES, INC.",FOOD SERVICE
QUEEN B BOUTIQUE LLC,RETAIL STORE
"QUEEN B BOUTIQUE, INC.",RETAIL STORE
QUEEN BEAN COFFEE COMPANY,ONLINE ROASTED COFFEE SALES
"QUEEN BEAT PRODUCTIONS, INC.",ENTERTAINMENT SERVICES
"QUEEN BEAUTY, INC.",BEAUTY SALON
"QUEEN BEE BEAUTY, INC.",NAIL SALON
QUEEN BEE CUPCAKERY INC.,BAKERY
"QUEEN BEE FITNESS, LLC",WOMAN'S HEALTH AND FITNESS CENTER
"QUEEN BEE VINEYARD, INC.",VINEYARD/WINERY
"QUEEN CITY RAILROAD CONSTRUCTION, INC.",RAILROAD CONSTRUCTION AND REHABILITATION
"QUEEN CLEANERS, INC",DRY CLEANING RELATED BUSINESS
TERRAMAR ESSENTIALS LLC,WHOLESALE.
QUEEN GOURMET INC,RESTAURANT
