"QTF PROPERTY SOLUTIONS, LLC",REAL ESTATE - RENTING OR LEASING PROPERTY I OWN - RESIDENTIAL REAL ESTATE.
"QTG SERVICES, INC.",VENDING EQUIPMENT SUPPLIER
"QTI HUMAN RESOURCES, INC.",QTI HUMAN RESOURCES
"RAVELER, INC.",SUPPLY CHAIN TECHNOLOGY AND ALL OTHER ACTIVITIES
"QTS ENGINEERING, INC.",MANUFACTURING
"QTX TRANSPORTATION, INC.",TRANSPORTATION/ TRUCKING
QUAADGRAS CONSULTING LLC,MANAGEMENT CONSULTING SERVICES
"BARGE CEMENTS, INC.",DISTRIBUTOR OF ADHESIVES AND ABRASIVES
"QUABAUG VIBRAM INNOVATION, LLC","QUABAUG VIBRAM INNOVATION, LLC IS A MANUFACTURER AND DISTRIBUTOR OF RUBBE"
"QUABBIN ACM, LLC",REAL ESTATE LLC
"QUABBIN ANALYTICAL LABORATORY, INC.",AJE FINANCIAL SERVICES
"QUABBIN ANIMAL HOSPITAL, INC.",VETERINARY SERVICES
"QUABBIN CAPITAL, INC.",INVESTMENT MANAGEMENT
"QUABBIN CONTROLS, INC.",HVAC REPAIRS & MAINTENANCE
QUABBIN ENGINEERING LLC,"PROFESSIONAL CIVIL ENGINEERING SERVICES, SEPTIC SYSTEM DESIGNS, AND TITLE V"
"QUABBIN ESTATES, LLC",RESIDENTIAL APARTMENT RENTALS
QUABBIN FOREST PRODUCTS INC.,EXCAVATOR
"QUABBIN GLASS WORKS, INC.",GLAZIER AND GLASS FABRICATION
"QUABBIN HEALTHCARE CONSULTING, INC.","DISASTER MANAGEMENT, TRAINING , EXERCISE DEVELOPE"
"QUABBIN LABOR POOL, INC.",MISCELLANEOUS TRANSPORTATION.
QUABBIN SALES AND ENGINEERING LLC,THE GENERAL CHARACTER OF THE BUSINESS OF THE LLC IS TO ENGAGE IN ALL SERVICES
"QUABBIN SERVICE CENTER, INC.",COMMERCIAL REAL ESTATE RENTAL
QUABBIN SOLAR L.L.C.,PRODUCTION OF ELECTRICITY THROUGH SOLAR PANELS
"QUABBIN TIMBER, INC.",LUMBER SALES
"QUABBIN VALLEY CONVALESCENT CENTER, INC.",CONVALESCENT CENTER
"QUABBIN VALLEY DENTAL, LLC",THE PRACTICE OF DENTISTRY AND TO ENGAGE IN ANY ACTIVITIES DIRECTLY AND INDIRE
"QUABBIN VALLEY DRYWALL, INC.",DRYWALL INSTALLATION
"QUABBIN VALLEY KITCHENS, INC.",KITCHEN RENOVATION/REMODELING
QUABBIN VALLEY LLC,THE GENERAL CHARACTER OF THE BUSINESS OF THE LIMITED LIABILITY COMPANY IS THE
"QUABBIN VILLAGE, LLC","REAL ESTATE OWNERSHIP, DEVELOPMENT & INVESTMENT"
"QUABBIN WELL & PUMP SERVICE, INC.",SELL AND SERVICE WATER WELLS AND WATER PUMPS.
"QUABBIN WELL DRILLING, INC.",WATER WELL DRILLING
"QUABBIN WIND, LLC",PRODUCE CLEAN ENERGY USING SOLAR PANELS
"QUABBIN WIRE & CABLE CO., INC.",MANUFACTURING
QUABOAG CONSTRUCTION CORP.,GENERAL AND HOME CONSTRUCTION
"QUABOAG CONSTRUCTION, LLC",GENERAL CONSTRUCTION AND HOME BUILDING
QUABOAG EAST LLC,"TO OWN, IMPROVE, LEASE, OPERATE, SELL AND DEAL IN REAL PROPERTY."
QUABOAG EQUIPMENT INC.,SMALL POWER EQUIPMENT RETAIL AND REPAIR
"QUABOAG FINANCIAL, LLC","THE PURPOSES OF THE COMPANY ARE (I) TO ACQUIRE, OWN, SELL, FORECLOSE UPON AND"
"QUABOAG PROPERTY, LLC","THE PURPOSE OF THE LIMITED LIABILITY COMPANY IS TO OWN, RENT, LEASE, MORTGAG"
"QUABOAG REAL ESTATE, LLC",REAL ESTATE COMPANY
QUABOAG VALLEY COOPERATIVE CORPORATION,MOBILE HOME COOPERATIVE
"QUABOAG VALLEY DENTAL FAMILY, LLC",THIS LIMITED LIABILITY COMPANY OPERATING AGREEMENT OF QUABOAG VALLEY DENT
QUABOAG VALLEY LANDSCAPES INC.,LANDSCAPING
QUABOAG VALLEY LEGAL SERVICES INC.,LEGAL SERVICES TO THE GENERAL PUBLIC
"QUABOAG VALLEY PROPERTY MANAGEMENT,",SAME AS SPECIFIED IN THE CERTIFICATE OF ORGANIZATION BUY AND SELL REAL ESTATE
QUABOAG VILLAGE CORP.,REAL ESTATE CONSTRUCTION AND RENTAL
"QUABOG BROADCAST HOLDINGS, INCORPORATED",LAND HOLD COMPANY
QUACH & TRAN INC,VT SERVICE INC
QUACH HOME INVESTMENTS LLC,REAL ESTATE INVESTMENT COMPANY.
QUACH HON LLC,TO ENGAGE IN THE GENERAL SERVICES OF A NAIL AND BEAUTY SALON AND TO RENDER
"QUACH, INC.",REAL ESTATE INVESTMENT
"QUACKADILLY DAY CARE, INC.",DAY CARE
"QUACKING FROG PRODUCTIONS, LLC",DEVELOPER OF INTERACTIVE ENTERTAINMENT PRODUCTS
QUACKTAX LLC,"(I) SOFTWARE DEVELOPMENT, II) SOFTWARE APPLICATION SALE AND DISTRIBUTION, III) A"
"QUAD 10 WILSON ROAD, LLC",REAL ESTATE
"QUAD 40 SMITH PLACE, LLC",REAL ESTATE
QUAD 75 MOULTON STREET & 20 WILSON,REAL ESTATE
"QUAD 75 SMITH PLACE, LLC",REAL ESTATE
"QUAD GRAPHICS, INC.",COMMERCIAL PRINTING SUPPORT SERVICES
"QUAD INVESTORS MANAGER, LLC",REAL ESTATE
"QUAD INVESTORS, LLC",REAL ESTATE
QUAD PLUS LLC,WE ARE A DRIVE SYSTEM INTEGRATOR.
QUAD REAL ESTATE LLC,RESIDENTIAL REAL ESTATE LESSOR
QUAD RINK LIMITED PARTNERSHIP,COMMERCIAL REAL ESTATE
"QUAD SPECIAL, LLC",THE PURPOSE AND BUSINESS OF THE COMPANY SHALL BE TO DEAL IN AND WITH REAL PR
"QUAD/GRAPHICS COMMERCIAL & SPECIALTY,",MANUFACTURING
"QUAD/GRAPHICS MARKETING, LLC",COMMERCIAL PRINTING SERVICES
QUAD/GRAPHICS PRINTING CORP.,COMMERCIAL PRINTING
"QUAD2MEDIA, LLC",ADVERTISING AND MARKETING
"QUADAX, INC.",THIRD PARTY MEDICAL BILLING
"QUADCOM CARTING, INC.",RESIDENTIAL AND COMMERCIAL WASTE COLLECTION.
"QUADCOPTERDIGITAL, LLC",DRONE-BASED AERIAL MAPPING AND PHOTOGRAPHY
QUADEL CONSULTING AND TRAINING LLC,ADMINISTRATIVE MANAGEMENT AND GENERAL MANAGEMENT CONSULTING SERVICES
"QUADEX LINING SYSTEMS, LLC","SPIN-CAST PIPE LINING (PIPES, CULVERTS, AND TUNNELS, MANHOLES, BOXES AND MOR"
QUADGEN WIRELESS SOLUTIONS INC.,SERVICES TO INTEGRATE & OPTIMIZE CELL PHONE TECH
QUADIENT USA INC.,SALES AND DISTRIBUTIONS OF SOFTWARE LICENSES
"QUADMED MEDICAL CLINICS OF WISCONSIN, S.C.",HEALTHCARE SERVICES
QUADOPTICS LLC,SALES REPRESENTATION OF MANUFACTURER'S IN THE FIBER OPTIC INDUSTRY.
QUADRA CHEMICALS INC.,CHEMICAL PRODUCTS FOR REFINING
"QUADRA COUNSELING ASSOCIATES, LLC",PSYCHOTHERAPY SERVICES.
"QUADRAGON GROUP, INC.",PUBLISHING CONSULTING
QUADRAMED AFFINITY CORPORATION,HEALTHCARE IT PRODUCTS AND SERVICES
QUADRAMED CORPORATION,HEALTHCARE SOFTWARE CONSULTING
QUADRAMED QUANTIM CORPORATION,HEALTHCARE INFORMATION TECHNOLOGY SOFTWARE & SERVI
QUADRANGLE COURT LIMITED PARTNERSHIP,OPERATION OF AFFORDABLE HOUSING
"QUADRANGLE COURT, INC.",Address (no PO Box)
"QUADRANGLE PARTNERS, LLC",THE GENERAL CHARACTER OF THE BUSINESS OF THE COMPANY IS TO ENGAGE IN BUYIN
"QUADRANT 365, INC.",OCCUPATIONAL HEALTH
PROSENSING INC.,SYSTEM ENGINEERG FOR ENVIRONMENTAL REMOTE SENSING
"QUADRANT HAVERHILL REAL ESTATE, LLC",REAL ESTATE INVESTMENT
"QUADRANT HEALTH STRATEGIES, INC.",HEALTH CARE MANAGEMENT STRATEGIES
QUADRANT INSURANCE WEALTH,LIFE & HEALTH INSURANCE
"QUADRANT REAL ESTATE, INC.","QUADRANT REAL ESTATE, LLC"
"QUADRANT SOFTWARE RT, LLC",REAL ESTATE HOLDING COMPANY
"QUADRANT SYSTEMS, INC.",R & D AND LICENSE ELECTRIC MOTOR PATENTS
"QUADRATA, INC.",SERVICES ED.
QUADRI ASSOCIATES,REAL ESTATE
QUADRILLE ASSOCIATES LIMITED PARTNERSHIP,REAL ESTATE INVESTMENT
QUADROLOGICS INC,"COMPUTER SOFTWARE SOLUTIONS, IT CONSULTING"
"QUADRUM DESIGN, INC.",RETAIL SALE OF ARTIST JEWELRY
"QUADRUPED SYSTEMS, INC.",SOFTWARE CONSULTING
"QUADRUPLE ANG, LLC",FOOD AND BEVERAGE (SERVICE) - BUBBLE TEA SHOP
"QUADRUPLE CROWN, LLC",CHILDREN'S FITNESS
"QUADTECH, INC.",MANUFACTURER OF TEST AND MEASUREMENT EQUIPMENT
QUAERO 3 LLC,SOFTWARE AND SERVICES
QUAESTOR SOFTWARE CORPORATION,SOFTWARE DEVELOPMENT
"QUAEVER ENGINEERING, LLC",ENGINEERING DESIGN AND CONSULTING
"QUAGENT SYSTEMS, INC.",HUMAN RESOURCES
QUAGGA CORPORATION,TELECOMMUNICATIONS EQUIPMENT SALES
"QUAGLIA, INC.",SANDWICH SHOP
"QUAHOG ELECTRIC CO., INC.",ELECTRICAL CONTRACTOR
QUAHOG ENTERTAINMENT LLC,(I) TO DEVELOP AND LICENSE ENTERTAINMENT MEDIA PRODUCTS AND SERVICES AND (II)
"QUAHOG REAL ESTATE PARTNERS, LLC","THE PRINCIPLE PURPOSE OF THE COMPANY IS TO PURCHASE, OWN, OPERATE AND LEASE"
QUAHOG REPUBLIC INC.,RETAIL STORE
"QUAHOG RESEARCH GROUP, LLC","CONDUCT REGIONAL, NATIONAL, AND INTERNATIONAL RESEARCH PROJECTS, INCLUDIN"
"QUAI, INCORPORATED",COMPUTER CONSULTING AND PROJECT MANAGEMENT
QUAIL SERVICES INC,HVAC - PLUMBING
"QUAIL HOLLOW INVESTORS, L.L.C.",PROPERTY OWNER - BUILDING LEASED TO THE POSTAL SERVICE.
"QUAIL RIDGE ASSOCIATES, LLC",REAL ESTATE DEVELOPMENT
"QUAIL ROAD, L.L.C.",REAL ESTATE ACQUISITION AND INVESTMENT PURPOSES. THE L.L.C. MAY ALSO CARRY ON
QUAIL RUN SALES LLC,INTERNET SALES (INCLUDING INDEPENDENT SALES ON AN AUCTION SITE)
"QUAIL WALK, LLC",PARTNERSHIP TO MANAGE REAL ESTATE
QUAINTEX LLC,THE PURPOSE OF THE COMPANY IS TO PROVIDE BOTH ENTERTAINMENT AND EDUCATION
"QUAISEY CORNER, LLC","ACQUIRE, OWN, DEVELOP, CONSTRUCT, REHABILITATE, RENOVATE, IMPROVE, MAINTAIN,"
QUAKER AGENCY INC.,WHOLESALE INSURANCE AGENCY
"GEBK COLUMBIANA ACQUISITION, LLC","THE GENERAL CHARACTER OF THE BUSINESS OF GEBK COLUMBIANA ACQUISITION, LLC I"
QUAKER DELI AND CONVENIENCE INC,CONVENIENCE STORE
"QUAKER DELI REAL ESTATE, INC.","REAL ESTATE FOR QUAKER DELI INC, COLLECT RENT"
"QUAKER DELI REAL ESTATE, LLC",THE GENERAL CHARACTER OF THE BUSINESS OF THE LLC IS TO ENGAGE IN THE INVESTME
"QUAKER DELI, INC.","C-STORE, DELI"
"QUAKER ENTERPRISES,INC.",COMMERCIAL RENTAL
"QUAKER GRINNELL ACQUISITION, LLC","THE GENERAL CHARACTER OF THE BUSINESS OF QUAKER GRINNELL ACQUISITION, LLC IS"
QUAKER HIGHWAY REALTY LLC,"INDUSTRIAL, COMMERCIAL AND RESIDENTIAL REAL ESTATE ACQUISTION, OWNERSHIP, D"
"QUAKER HIGHWAY, LLC",SEPTIC PUMPING CO
QUAKER HILL LIMITED PARTNERSHIP,"INVESTMENT IN MARKET, AFFORDABLE, ELDERLY AND FAMILY APARTMENT RENTALS"
QUAKER HOMES CORPORATION,RESIDENTIAL CONSTRUCTION
QUAKER HOOPS LLC,REAL ESTATE HOLDINGS.
"QUAKER INDUSTRIAL PARK, INC.",INDUSTRIAL PROPERTY DEVELOPMENT AND MANAGEMENT
"QUAKER INVESTORS, INC.",ACQUISITION AND SALE OF VARIOUS SECURITIES
QUAKER LAKE LLC,REAL ESTATE INVESTMENT
QUAKER LANE - SIMPSON SOLAR LLC,SOLAR PHOTOVOLTAIC DEVELOPMENT
QUAKER LANE CAPITAL LLC,"GENERAL INVESTMENTS, AND OWNING AND/OR OPERATING REAL ESTATE"
QUAKER MEADOWS APARTMENTS COMPANY,THE PURPOSE OF THE LIMITED PARTNERSHIP IS TO ENGAGE IN THE BUSINESS OF REAL EST
"QUAKER PLAZA, INC.","RETAIL SALES OF BEER, LIQUOR AND WINE"
"QUAKER QUARRY, LLC","THE GENERAL CHARACTER OF THE BUSINESS OF QUAKER QUARRY, LLC IS (A) TO ACT AS"
QUAKER RUN CRANBERRIES LLC,"FARMING INCLUDING, WITHOUT LIMITATION, THE RAISING AND MARKETING OF CRANBE"
"QUAKER SALES & DISTRIBUTION, INC.",SELLER OF TPP
QUAKER WINDOW PRODUCTS CO.,MANUFACTURE AND SELL WINDOWS AND DOORS
"QUAKER/MENDON, LLC",REAL ESTATE DEVELOPMENT
QUAKING ASPEN LLC,"QUAKING ASPEN, LLC WILL OFFER SUSTAINABILITY CONSULTING SERVICES AND OTHER"
"GOROCKET GROUP, INC.",ONLINE QUALATATIVE DATA PLATFORM
"GROWTHHACKERS, INC.",TOOLS FOR MARKETERS
"QUALBRIDGE INSTITUTE, LLC","HEALTH CARE CONSULTING, AND ALL OTHER LAWFUL ACTIVITIES."
"QUALCARE, INC.",THIRD-PARTY ADMINISTRATOR
"QUALCOMM ATHEROS, INC.",SEMICONDUCTOR SALES
"QUALCOMM CONNECTED EXPERIENCES, INC.",WIRELESS TELECOMMUNICATIONS
"QUALCOMM DATACENTER TECHNOLOGIES, INC.",DATA SERVER TECHNOLOGY
QUALCOMM INCORPORATED,WIRELESS TELECOMMUNICATIONS
"QUALCOMM TECHNOLOGIES, INC.",TELECOMMUNICATIONS
"QUALCORE TECHNOLOGIES, LLC","TRAINING, STAFFING, CONSULTING"
"SPERRY RAIL, INC.",RAIL FLAW DETECTION
"QUALED, INC.",CHILDCARE
"QUALERANCE, INC.",SOFTWARE TESTING
QUALEX INC.,THEME PARK PHOTOGRAPHY
QUALFON CORPORATION,BUSINESS PROCESS OUTSOURCING
"QUALGUARD, INC.",INTERNET TRANSMITTAL DIGITAL PHOTOGRAPHY.
"QUALIA, INC.",TECHNOLOGY DEVELOPMENT
QUALICARE HEALTH LLC,"HOME HEALTHCARE SERVICES, SKILLED AND SKILLED NURSING AND ANY RELATED SERV"
QUALITY COLORS PAINTING INC,PAINTING SERVICES
"QUALIFIED BURNER TECHNICIANS, INC.","OIL BURNER, HVAC SERVICE AND INSTALLATION."
QUALIFIED CLEANING SERVICES INC.,CONTRACT CLEANING SERVICE
"QUALIFIED CONTRACTORS, INC.",LABOR SOURCING AFFIL FOR POWER GENERATION BUSINESS
QUALIFIED MORTGAGE INC.,BANKER
QUALIFIED OPPORTUNITY ZONE,"REAL ESTATE DEVELOPMENT, OPERATIONS, AND OWNERSHIP OF REAL PROPERTY"
"QUALIFIED PENSION SERVICES,INC.",THIRD PARTY ADMINISTRATOR FOR QUALIFIED PLANS
"QUALIFIED PLAN CONSULTANTS, INC.",PENSION PLANNING
"MONROE STAFFING SERVICES, LLC",TO PROVIDE LABOR AND SERVICES
"QUALIMAX COLLISION, INC",AUTO BODY REPAIR SHOP
"QUALINK, INC.","HEALTHCARE RCVBLE, MANAGEMENT OUTSOURCING"
COMAGINE HEALTH,PUBLIC BENEFIT NONPROFIT CORPORATION
QUALISYSTEMS USA INC.,SELLING SOFTWARE
"QUALITAS ASSOCIATES, LLC","CONSULTING SERVICES TO PRIVATE INVESTMENT FIRMS, TYPICALLY IN THE VENTURE CA"
QUALITAS MANUFACTURING INCORPORATED,MANUFACTURER OF SECURITY AND HURRICANE SHUTTERS.
"QUALITAS PARTNERS, INC.",BUSINESS ADVISORY SERVICES
"QUALITATIVE DATA ANALYSIS SERVICES, LLC",TO PROVIDE SUPPORT AND FACILITATION OF INDIVIDUALS AND GROUPS USING SOFTWA
"QUALITATIVE MANAGEMENT, LLC",INVESTMENTS
"QUALITATIVE OUTLOOK, LLC",MARKET RESEARCH
QUALITROL COMPANY LLC,MANUFACTURER-QUALITROL PROVIDES SMART UTILITY ASSET CONDITION BASED MONI
"QUALITY & PRODUCTIVITY SOLUTIONS, INC.",CONSULTING & TRAINING
"QUALITY ABATEMENT CONTRACTORS, LLC",GENERAL CONSTRUCTION
"QUALITY ABSTRACT, INC.",TITLE EXAMINATION
"QUALITY ACOUSTICS, INC.",CEILING INSTALLATION
"QUALITY AGENTS, LLC",CONTRACT VALIDATION CONSULTING
QUALITY AIR CARE LLC,AIR DUCT CLEANING & DRYER VENT CLEANING
"QUALITY AIR HVAC, LLC","SHEET METAL, HVAC, DUCT CLEANING"
"QUALITY AIR METALS, INC.",SHEET METAL CONTRACTOR
"QUALITY AIR SYSTEMS, INC.",INSTALL HVAC SYSTEMS
QUALITY AIRCRAFT ACCESSORIES ACQUISITION,HOLDING COMPANY
QUALITY AIRCRAFT ACCESSORIES,INVESTMENTS IN SECURITIES AND BUSINESS.
QUALITY AIRCRAFT ACCESSORIES HOLDING CORPORATION,HOLDING COMPANY
QUALITY AND COMPLIANCE CONSULTING INC.,PHARMACUETICAL QA CONSULTING
QUALITY AND PERFECTION INC,"CARPENTRY, PAINTING AND JANITORIAL SERVICE"
"QUALITY ANESTHESIA, P.C.","ANESTHESIOLOGY, MEDICAL PRACTICE"
"QUALITY ASSURANCE MANAGEMENT, INC.","QUALITY ASSURANCE, QUALITY CONTROL SERVICES"
"QUALITY ASSURANCE TECHNI-ARTS, INC.","TECHNOLOGY: INTERNET (ECOMMERCE, WEBSITE)"
"QUALITY ASSURANCE TRANSPORTATION, INC",TRANSPORTATION SERVICES
"QUALITY ASSURED SERVICES, INC.",HEALTHCARE
"QUALITY AUTO BODY & REPAIR, INC.","AUTOMOTIVE REPAIRS, SERVICE, AND SALES"
"QUALITY AUTO BODY, INC. OF WEBSTER",AUTO BODY REPAIR
"QUALITY AUTO BODY,INC. OF PITTSFIELD",AUTO BODY REPAIRS
"QUALITY AUTO CENTER, INC.",GAS STATION & AUTO REPAIR
QUALITY AUTO LLC,"TO ENGAGE IN THE BUSINESS OF THE REPAIR, REBUILDING AND/OR RETAIL OF NEW AND"
CHARLES BECKFORD REALTY CORP.,INVESTMENTS
QUALITY AUTO SALES INCORPORATED,USED AUTO SALES
QUALITY AUTO SERVICE CENTER INC,AUTOMOBILE REPAIR AND MAINTENANCE SERVICE
"QUALITY AUTO SERVICE, INC.",AUTO REPAIR/RESALE
QUALITY AUTO TRANS INC,TRANSPORTATION
QUALITY AUTOMATIC SPRINKLER CORP.,"SPRINKLER SYSTEM INSTALLATION, INSPECTIONS & MAINT"
"QUALITY AUTOMOTIVE ACCESSORYS, INC.",MANUFACTURER AND SALES OF AUTOMOTIVE ACCESSORIES
"QUALITY BATH RENOVATIONS OF NEW ENGLAND, INC.",SALE AND INSTALLATION OF BATHROOM FIXTURES
QUALITY BEVERAGE LIMITED PARTNERSHIP,TO ENGAGE IN THE BUSINESS OF WHOLESALE DISTRIBUTION OF BEVERAGE AND OTHER C
"QUALITY BEVERAGE PROPERTIES, LLC","TO ACQUIRE, OWN, OPERATE, IMPROVE, LEASE, ENCUMBER AND OTHERWISE DEAL WITH"
"QUALITY BILLING AND CONSULTING SERVICES, INC.",PIONEER SPINE AND SPORTS PHYSICIANS
"QUALITY BRANDS LIQUOR MART, INC.",LIQUOR STORE
"QUALITY BUILD AND RESTORATION, LLC","THE CONSTRUCTION, RENOVATION, PURCHASE, SALE, RENT AND LEASE OF COMMERCIAL"
QUALITY BUILDERS & DEVELOPMENT LLC,"BUILDING, CONSTRUCTION, AND REAL ESTATE DEVELOPMENT"
QUALITY BUILDERS INC.,CONSTRUCTION
QUALITY BUILDING PRODUCTS INC,BUILDING PRODUCTS WHOLESALE
"QUALITY BUILDING RENTALS, LLC",RENT TO OWN STORAGE BUILDINGS
"QUALITY BUILT, LLC",3RD PARTY QA CONSULTING SERVICES
"QUALITY BUSINESS ENTERPRISES, LLC",PROVIDING OFFICE SPACE FOR RENT
"QUALITY GRAPHICS, INC.","BUSINESS FORMS, GRAPHIC DESIGNS"
"QUALITY BUSINESS MANAGEMENT, INC.",MANAGEMENT COMPANY.
QUALITY BUSINESS OFFICE INSTALLATION INC,BUSINESS OFFICE CUBICLE INSTALLATION
"QUALITY CAB, INC.",TRANSPORTATION
QUALITY CAR WASH CORP.,CAR WASH
"QUALITY CARE AUTO REPAIR, LLC",TO PROVIDE PUBLIC VEHICLE REPAIR SERVICES AND SALES AND TOWING
"QUALITY CARE EDUCATION, LLC",EDUCATIONAL INSERVICE
"QUALITY CARE HEALTH CONSULTING, LLC","CONSULT/ASSIST PARTIES TO ACCESS HEALTHCARE SERVICES IN THE US, AND OTHER LA"
QUALITY CARE NURSE STAFFING AGENCY INC.,TEMPORARY NURSE STAFFING AGENCY
QUALITY CARE ON WHEELS LLC,NON EMERGENCY TRANSPORTATION
QUALITY CARE PROVIDERS LLC,"THE GROUP ADULT FOSTER CARE (GAFC) PROGRAM HELPS ELDERLY, LOW- INCOME MASS"
"QUALITY CARE SOLUTIONS, INC.",INFORMATION TECHNOLOGY FOR HEALTHCARE INDUSTRY
"QUALITY CARE TRANSPORTATION, LLC",PROVIDE PRIVATE TRANSPORTATION SERVICES; TO ENTER CONTRACTUAL OR OTHER
"QUALITY CARE, INC",HEALTHCARE
QUALITY CARPENTRY & REMODELING LLC,CARPENTRY AND REMODELING.
"QUALITY CARRIERS, INC.",INTERSTATE BULK TRANSPORTATION
"QUALITY CARS OF QUINCY, INC.",USED CARS DEALERSHIP
"QUALITY CARTON & CONVERTING, LLC",MANUFACTURING
"BOSTON BAY ENTERPRISES, INC.",RENTAL CENTER
"CHILD'S MERCANTILE, INC.",SELLER OF CHILDREN'S PRODUCTS.
"QUALITY CHAIRVAN SERVICE, INC.",TRANSPORTATION SERVICES
QUALITY CHIROPRACTIC CARE LLC,THE GENERAL CHARACTER OF THE BUSINESS OF THE LLC IS TO ENGAGE IN PROVIDING CH
"QUALITY CHOICE PAINTING, INC.",PAINTING SERVICES
QUALITY CLAIMS MANAGEMENT CORPORATION,PUBLIC ADJUSTING FIRM
"QUALITY CLAIMS PROCESSING, INC.",WARRANTY CLAIMS PROCESSING
QUALITY CLEANERS INCORPORATED,DRY CLEANER
QUALITY CLEANING MA INC,CLEANING SERVICES
QUALITY CLEANING SERVICES INC.,JANITORIAL SERVICES FOR RESIDENTIAL HOUSES AND COM
"QUALITY COATING & HOME SOLUTIONS, INC.",FEDERAL CONTRACTING
QUALITY COMFORT SOLUTIONS LLC,THE GENERAL CHARACTER OF THE BUSINESS OF THE LLC SHALL BE HEATING VENTILATIO
"QUALITY CONNECTIONS, INC.","TRAVEL AGENCY, PHONE SYSTEM SERVICE"
"QUALITY CONSTRUCTION & DEVELOPMENT, INC.",CONSTRUCTION AND DEVELOPMENT OF REAL ESTATE
"QUALITY CONSTRUCTION & REMODELING, INC.",CONSTRUCTION
QUALITY CONSTRUCTION AND DESIGN INC.,CONSTRUCTION
QUALITY CONSTRUCTION DIVISIONS INC.,CONSTRUCTION SERVICES
"QUALITY CONSTRUCTION GROUP, INC.",CONSTRUCTION
"QUALITY CONSTRUCTION SERVICES, INC.",CONSTRUCTION
QUALITY CONSTRUCTION SPECIALTY INC.,MILLWORK INSTALLERS
"QUALITY CONSTRUCTION/MAINTENANCE, INC.",DEMOLITION
QUALITY CONSULTING GROUP INC,IT SOLUTIONS
"QUALITY CONTRACTING, INC.",CONSTRUCTION
"QUALITY CONTROL SOLUTIONS AND ASSOCIATES, INC.",CONSULTING SERVICES
"QUALITY CONVERTING PRODUCTS, INC.",RESELLER OF MANUFACTURED SPARE PARTS
"QUALITY CRAFTED RESIDENCES, LLC","TO ENGAGE IN THE ACQUISITION AND DEVELOPMENT OF REAL ESTATE, AND TO CARRY O"
"QUALITY CUSTODIAL SERVICES,INC.",COMMERCIAL CLEANING SERVICES
"QUALITY CUSTOM PACKING, INC.",QUALITY CUSTOM PACKING INC WE CUSTOM PACK SEAFOOD
"QUALITY CUTS HAIR SALON, INC.",BEAUTY SALON
"QUALITY DENTAL LAB, LLC",TO PROVIDE QUALITY DENTAL SERVICES (DENTURES) TO CONSUMERS AND DENTISTS
"QUALITY DESIGN NOR'EASTER SWIMMING POOLS, INC.",BUILD AND SERVICE INGROUND SWIMMING POOLS
"OPEN ROAD TECHNOLOGIES, INC.",SALE OF TIRE RELATED SOFTWARE
"QUALITY DETAILING, INC.",CAR DETAILING
QUALITY DIE CUTTING INC.,VARIOUS MATERIALS TO BE DIE CUT OR FABRICATED
"QUALITY DRIVER SOLUTIONS, LLC",PROVIDING TRANSPORTATION LOGISTICS SERVICES
"QUALITY DRYWALL SERVICES, INC.",DRYWALL SERVICES
QUALITY EATS LLC,TO RUN A FOOD SERVICE FACILITY AND ALL OTHER PURPOSES RELATED THERETO OR INC
QUALITY ELECTRIC & CONTROLS LLC,INSTALLATION OF ELECTRICAL EQUIPMENT AND CONTROLS IN
QUALITY EMERGENCY VEHICLES INC.,RESELLER OF NEW AND USED AMBULANCES
"QUALITY EMS EDUCATORS, INC.",HEALTH CARE
"QUALITY ENDOSCOPY RESOURCES, INC.",BROKER REPAIRS OF MEDICAL INSTRUMENT
"QUALITY ENGINEERING ASSOCIATES, INC.",TEST INSTRUMENTS SALES
QUALITY ENTERPRISE INC.,PROVIDE BUSINESS SERVICES
QUALITY FENCE AND TREE SERVICE LLC,"FENCE REMOVAL, REPAIR, AND INSTALLATION TREE REMOVAL, ELEVATING, PRUNING, TR"
"QUALITY FINANCIAL GROUP INSURANCE AGENCY, INC.",SALES SERVICE OF INSURANCE
"QUALITY FIRE PROTECTION, INC.",FIRE EQUIPMENT
QUALITY FIRST CONSULTING INC.,CONSULTING
"QUALITY FIRST, LLC",VENDING MACHINES
"QUALITY FISHERIES, INC.",COMMERCIAL FISHERIES
"QUALITY FIVE, INC.",PROPERTY MANAGEMENT
"QUALITY FLEET SERVICE, INC.",MOBILE REPAIR SERVICE
"QUALITY FLOOR SUPPLY, INC.",FLOORING SALES & INSTALLATION
"QUALITY FLOORS DIRECT, INC.",FLOORING SALES & INSTALLATION
"QUALITY FOCUSED PT, LLC",THE GENERAL CHARACTER OF BUSINESS IS PHYSICAL THERAPY SERVICES. THE MANAGER
"QUALITY FOOD DISTRIBUTION, INC.",FOOD DISTRIBUTION
QUALITY FOOD SERVICES INC.,RESTAURANT
QUALITY FORENSIC AND INVESTIGATIVE,THE GENERAL CHARACTER OF THE BUSINESS IS PROVIDING CONSULTATION REGARDING
"QUALITY FRAMING CONTRACTOR, INC.",FRAMING CONTRACTOR
"QUALITY FUR CLEANING, INC.",FUR CLEANING
"QUALITY GAS, INC.",GASOLINE STATION
QUALITY GENERAL SERVICES CORP,GENERAL CONSTRUCTION
"CREATIVE FRAGRANCE CONCEPTS, INC.",DISTRIBUTOR OF HOME DECOR GIFTWARE
"QUALITY GLASS COMPANY, INC.",GLASS INSTALLATION
"QUALITY GREEN HOMES, LLC","TO INVEST IN REAL ESTATE; TO BUY, SELL, DEVELOP, MORTGAGE OR LEASE ANY PORTION"
"QUALITY GREETING CARD DISTRIBUTING COMPANY, INC.",GREETING CARD DISTRIBUTOR (INACTIVE)
"EMBED, INC.",CONSULTANT COMPANY FOR EMBEDDED CODING
"QUALITY HANDYMAN SERVICES, LLC",HANDYMAN SERVICES
"PUOPOLO HARDWARE CO. OF WESTON, INC.",RETAIL HARDWARE
QUALITY HEALTH CENTER INC,BODY WORK
"QUALITY HEALTH IDEAS, INC.",SOFTWARE/SUPPORT SERVICES FOR HEALTHCARE PROVIDERS
QUALITY HEALTHCARE RECRUITING INC.,NURSE RECRUITING BUSINESS
"KAVIDA HEALTHCARE, INC.","STAFFING AGENCY, NON-MEDICAL NURSING CARE, CPR"
"QUALITY HEALTHCARE SERVICES, INC.",HEALTHCARE
"QUALITY HEARING INSTRUMENTS, LLC",RETAIL HEARING AID SALES AND SERVICES.
"QUALITY HOME AND OFFICE CLEANING, LLC",HOME & OFFICE CLEANING SERVICES
"QUALITY HOME CARE SERVICES, INC.",QUALITY HOME CARE SERVICES INC
QUALITY HOME DESIGN INC,CARPENTRY
QUALITY HOME HEATING INC.,OIL BURNER SERVICING AND INSTALLATIONS OF HEATING
QUALITY HOME IMPROVEMENT INC,QUALITY HOME IMPROVEMENT INC.
"QUALITY HOME IMPROVEMENT PRODUCTS, INC.",SELL HOME IMPROVEMENTS
"ON THE LEVEL HOME IMPROVEMENTS, INC.",HOME IMPROVEMENTS
"QUALITY HOME MAINTENANCE, LLC","TO ENGAGE IN THE BUSINESS OF HOME MAINTENANCE, IMPROVEMENTS AND CONSTRUC"
"QUALITY HOME SOLUTIONS, LLC",KITCHEN AND BATH SHOWROOM
"QUALITY HOMES REAL ESTATE, INC.",REAL ESTATE SALES
"QUALITY HOMES, INC.",QUALITY HOME INC
"G. C. CONSTRUCTION & ENERGY EFFICIENCY, INC.","CONSTRUCTION, BUILD NEW HOUSES, REMODELING OLD"
QUALITY IMPROVEMENT AND PAINTING INC,1967
ELITE ROOFING & RESTORATION LLC,COMMERCIAL ROOFING CONTRACTORS
"QUALITY IN REAL TIME, INC.",QUALITY IN REAL TIME
"QUALITY INCENSE, INC.",MYCORPORATION
QUALITY INDUSTRIAL SUPPLY LLC,"WHOLESALE DISTRIBUTION OF JANITORIAL, MAINTENANCE AND SHIPPING SUPPLIES"
"CHOICE HOTELS INTERNATIONAL, INC.",CHOICE HOTELS INTERNATIONAL SERVICES CORP
"QUALITY INSTALLATIONS, INC.",INSTALLATION OF OFFICE SYSTEMS
"QUALITY INTEGRATED SERVICES, INC.",PIPELINE & FIBER OPTIC INSPECTION
"QUALITY INTERACTIONS, INC.",TRAINING PROGRAMS
"QUALITY INTERIOR FINISHING, INC.",INTERIOR FINISHING
"QUALITY INVESTMENTS, LLC",THE GENERAL CHARACTER OF THE BUSINESS OF THE LLC IS TO LOAN MONEY ON CREDIT
"QUALITY KIDS KARE, P.C.",PEDIATRIC OFFICE
"QUALITY KITCHEN & BATH CENTRE, INC.",KITCHEN & BATH REMODELING
"QUALITY LACROSSE, LLC",TO ORGANIZE AND RUN LACROSSE CAMPS AND TO ENGAGE IN ANY OTHER BUSINESS AC
QUALITY LANDSCAPE INC.,LANDSCAPING
"QUALITY LANDSCAPE MAINTENANCE CO., INC.",LANDSCAPING
"QUALITY LEASING CO., INC.",VEHICLE AND EQUIPMENT LEASING/FINANCING
"QUALITY LEASING SERVICE, INC.",LEASING TRUCK DRIVERS
QUALITY LEATHER LLC,MANUFACTURING
QUALITY LED LIGHTING LLC,"SALES OF LED LIGHTING PRODUCTS, INCLUDING LIGHTING AND OTHER ELECTRICAL PRO"
QUALITY LIFE LAWRENCE LLC,"THE GENERAL CHARACTER OF THE BUSINESS OF THE LLC IS TO BUY, OWN, DEVELOP, SEL"
"QUALITY LIGHTING OF MASS., INC.",SALE OF LIGHTING PRODUCTS
"QUALITY LIQUORS, INC.",PACKAGE STORE
"QUALITY LOAM & SAND, INC.",EXCAVATION AND TRUCKING
"QUALITY LOCK SERVICE, INC.",LOCKSMITH
QUALITY MACHINE SERVICES INC.,MACHINE SERVICING
QUALITY MAINFRAME CONSULTING INCORPORATED,COMPUTER CONSULTING
"QUALITY MANAGEMENT CONSULTING, LLC",CONSULTING SERVICES FOR THE CONTINUAL IMPROVEMENT OF QUALITY MANAGEMENT
"QUALITY MANAGEMENT SOLUTIONS, INC.",COMPUTER SOFTWARE CONSULTING SERVICES
"QUALITY MANAGEMENT SPECIALISTS, INC.",DOCUMENTATION CONSULTING
"QUALITY MANAGEMENT SYSTEMS CONSULTING, INC.",CONSULTING
"QUALITY MARINE SERVICE, INC.",SALE AND REPAIRS OF MOORINGS
"QUALITY MARK, INC.",GENERAL BUSINESS/CONSULTING
"QUALITY MART, INC.",GROCERIES STORE
"QUALITY MASONRY, INC.",SALE OF MASONRY BUILDING SUPPLIES
"QUALITY MATRIX, INC.",SOFTWARE TESTING SERVICES AND IT CONSULTING
"QUALITY MEASUREMENT COMPANY, THE",MARKET RESEARCH
"QUALITY MEDICAL EVALUATIONS, INC.",MEDICAL REPORTING
"QUALITY MEDICAL PRODUCTS, LLC","DME SUPPLIER, DIABETIC SUPPLY ETC"
"QUALITY MEDICAL RESOURCES, INC.",MEDICAL BILLING AUDIT
"QUALITY METAL FINISHING, INC.",MANUFACTURER CHURCH GOODS
"QUALITY METALCRAFT, INC.",METAL FABRICATION
"QUALITY MILK, INC.",REAL ESTATE RENTAL
"QUALITY MOBILE ORAL HEALTH SERVICES,PC",DENTAL SERVICES
"QUALITY MUFFLER & BRAKE, INC.",MUFFLER AND BRAKE SHOP
"QUALITY OIL CO., INC.",OIL AND OIL PRODUCTS
"QUALITY ONE HOUR PHOTO, INC.",TO OWN AND OPERATE A PHOTO DEVELOPING BUSINESS.
"QUALITY PACKAGING AND GRAPHICS, INC.",FOLDING BOX MANUFACTURING
"QUALITY PACKAGING CO., INC.",LABOR SERVICE
QUALITY PACKAGING SPECIALISTS,PAPERBOARD MANUFACTURER
"QUALITY PAINTERS OF SOUTH DARTMOUTH, INC.",HOUSE PAINTING AND GENERAL PAINTING
"QUALITY PAINTING SERVICES, L.L.C.",INTERIOR AND EXTERIOR PREPARATION AND PAINTING
"QUALITY PAINTING, INC.",PAINTING SERVICES
"QUALITY PAVEMENT MARKINGS, INC.",PAVEMENT & MARKINGS
"QUALITY PAYROLL SERVICES, INC.",PAYROLL SERVICES
"QUALITY PETRO SERVICES, LLC",SUPPLYING AND SERVICING PETROLEUM DISPENSING EQUIPMENT AT GASOLINE RETAIL S
"QUALITY PETS,INC.",RETAIL PETS AND SUPPLIES
QUALITY PHARMACY CORP,COMMUNITY PHARMACY
