"ULTRA FILTRONICS, INC.",PROVIDE ULTRA PURE WATER FILTERING SYSTEMS
"ULTRA FINISH PAINTING, INC.",PAIN.
"ULTRA FOOTWEAR ACCELERATOR, LLC",SALES AND CONSULTING AND ANY OTHER LEGAL BUSINESS
"ULTRA HEALTH CONNECTIONS, LLC",SALE OF PRODUCTS THAT CONTAIN CELL SHIELDS THAT AID IN PROTECTING TECHNOLOG
"ULTRA HEATING AND AIR CONDITIONING, INC.",ULTRAHEATING & AIR CONDITIONING INC.
ULTRA JET SOFTWARE CORPORATION,SOFTWARE DEVELOPMENT AND IT CONSULTING
"ULTRA KITCHEN & BATH DESIGN, INC.","KITCHEN & BATH DESIGN, SALES, INSTALLATION"
"ULTRA MAX CLEANING, INC.",CLEANING SERVICES
"ULTRA MORTGAGE, LLC",MORTGAGE BROKER
"ULTRA RISK ADVISORS, INC.",PROGRAM ADMINISTRATOR NICHE INSURANCE WHOLESALER
"ULTRA SAFE PEST MANAGEMENT, INC.",PEST / WILDLIFE MANAGEMENT
"ULTRA SERVICES, INC.",HVAC INSTALLATION AND SERVICE
ULTRA SHINING CLEANING CORP,CLEANING SERVICES
ULTRA SIGNS CORP,SIGNS AND ADVERTISING MANUFACTURE
"ULTRA TRAVEL SERVICE, INC.",FULL SERVICE RETAIL TRAVEL AGENCY
ULTRA VISION CORP.,TO OPEN AN OPTICAL OFFICE
"ULTRA-CARE FLOOR SYSEMS, INC.",FLOOR CARE
ULTRABAIT INC.,DISTRIBUTION OF PEST CONTROL PRODUCTS
"ULTRABENEFITS, INC.",ADMINISTRATION OF SELF FUNDED HEALTH PLANS
"ULTRACELL INSULATION, LLC",MANUFACTURE AND INSTALLATION OF CELLULOSE INSULATION
ULTRACLAD CORPORATION,MNAUFACTURING OF POWDER METALLURGY PARTS
ULTRACLIFF WIRELESS LLC,"CONTRACTOR, TRADE/RETAIL"
"ULTRACONDUCTIVE COPPER COMPANY, INC.",DEVELOPING COPPER PROCESS
"ULTRADIAGNOSTICS, INC.",MEDICAL IMAGING RESEARCH AND DEVELOPMENT.
ULTRAFLOTE CORPORATION,INSTALLATION OF FLOATING ROOFS & DOMES
ULTRAFLOTE L.L.C.,"TO PROMOTE THE COMPANY AND ATTAIN PROFITABLE SALES OF ALUMINUM COVERS, IN"
"ULTRAFLOW MEMBRANE CO., INC.",FILTER MANUFACTURER
ULTRAGENYX PHARMACEUTICAL INC.,PHARMACEUTICAL DISTRIBUTION
"BL SYSTEMS, INC.",SECURITY SYSTEMS
ULTRAHAPTICS NORTH AMERICA INC.,ULTRASONIC ENGINEERING.
ULTRAIMAGING LABS LLC,"DIAGNOSTIC IMAGING: ULTRASOUND, CT SCAN, AND MRI"
ULTRAMAR ENERGY INC.,MARKETING OF PETROLEUM PRODUCTS
"ULTRAMAR TRAVEL MANAGEMENT, INC.",TRAVEL MANAGEMENT
"ULTRAMART CONVENIENCE STORES, LLC",RETAIL AND GASOLINE
VITAMIN PORTFOLIO LLC,"RESELLER OF VITAMINS, SUPPLEMENTS AND OTHER HEALTH IMPROVEMENT MATERIALS."
"ULTRAPURE SERVICES, INC.",CONSTRUCTION CONTRACTOR
"ULTRAPURE SYSTEMS NORTH AMERICA, LLC",PROCESS EQUIPMENT FABRICATION FOR BIO-PHARM INDUSTRY
ULTRASALON INC.,BEAUTY SALON
ULTRASONIC ENERGY EFFICIENCY SOLUTIONS,UEES LLC IS AN ADVANCED BATTERY TECHNOLOGY LICENSING COMPANY
"ULTRASONIC PRODUCTIONS, LLC",THE PRODUCTION OF AUDIO AND VISUAL MEDIA AND LIVE SHOWS. THE LLC MAY ALSO
"ULTRASONIC SOLUTIONS, INC.",DISTRIBUTOR OF VARIOUS MUNICIPAL WATERWORKS SUPPLY
"ULTRASONIC SYSTEMS, INC.",MANUFACTURE OF PRECISION INDUSTRIAL COATING SYSTEM
"ULTRASOUND DYNAMICS, INC.",RESEARCH AND DEVELOPMENT
"ULTRASOUND IMAGES, INC.",ULTRASOUND IMAGING PROSTATE BIOPSY SPECIALIST
"ULTRASOUND RESOURCES ON-CALL, INC.",MEDICAL IMAGING STAFFING
"ULTRASOUND TECHNICAL SERVICES, INC.",EDUCATIONAL SERVICES
"ULTRASOUND TECHNICAL SPECIALISTS, INC.",MEDICAL ULTRASOUNDS
ULTRATEC LLC,FRAMING CONTRACTOR
"ULTRATECH , INC.",SALE AND SERVICE OF SEMICONDUCTOR MFG EQUIPMENT
ULTRAWELLNESS LLC,INFORMATION PRODUCT SALES
"ULTRAZA CONSTRUCTION, INC.",CONSTRUCTION
"ULTROMICS, INC.",AI TECHNOLOGY TO SUPPORT CLINICIANS
ULURU AUSTRALIAN CAFE LLC,RESTAURANT
ULV AMERICAS INC.,"REAL ESTATE INVESTMENT, DEVELOPMENT AND CONSULTING"
"ULVAC TECHNOLOGIES, INC.",MANUFACTURER AND DISTRIBUTOR FOR CAPITAL EQUIPMENT
"ULX PARTNERS, LLC","FINANCE, HR, IT SERVICES"
"ULYSSES ASSET SUB I, LLC",TELECOMMUNICATIONS
"ULYSSES ASSET SUB II, LLC",TELECOMMUNICATIONS
"ULYSSES CONSULTING, LLC",EXECUTIVE COACHING AND CONSULTING.
"ULYSSES HOLDINGS, INC.",SHAREHOLDER HOLDING COMPANY
"ULYSSES INVESTMENTS, LLC",PRIVATE INVESTMENT COMPANY
UM CLIENT MANAGEMENT SERVICES INC,FINANCIAL CONSULTING + CLIENT MANAGEMENT SERVICES
"UM CONSULTANTS, LLC",CONSULTING SERVICES
"UMA COMPUTER SOFTWARE GROUP, INC.",SOFTWARE CONSULTING
"UMA CONVENIENCE, INC.","CONVENIENCE STORE WITH BEER, WINE AND LOTTERY"
UMA CORPORATION,PACKAGE STORE
"UMA DINORA, LLC",BUSINESS LENDING
"UMA HEALTH, INC",IN-HOME HEALTH CARE SERVICES
"UMA LIQUORS, INC.",LIQUOR STORE
UMA LOUCURA LLC,FOOD SERVICE SALES
"UMA, INC.",OWN AND OPERATE REAL ESTATE BUSINESS
"UMACO, INC.",WHOLESALES SALES OF CEMENT BASED PRODUCTS
UMAGEN LLC,BIOTECH CONSULTING SERVICES
"UMAGINATION LABS, LIMITED PARTNERSHIP",PRODUCT DEVELOPMENT
"UMAGINATION LABS, LLC",MANAGEMENT SERVICES
UMAIR ASSOCIATES LLC,CONVENIENCE STORE
"UMAIR, INC.",CONVENIENCE STORE
"UMAIZA, INC.",GASOLINE AND CONVENIENCE STORE
UMAJIN INC.,SOFTWARE DEVELOPMENT AND SALES
"UMAMI, INC.",RESTAURANT
UMANA LAW LLC,DESCRIPTION OF THE PROFESSIONAL SERVICES IN WHICH THE LLC IS ENGAGED: THE PRA
UMANA TRUCKING INC,TRUCKING SERVICES
"UMANA-FISHER REALTY GROUP, LLC",TO ENGAGE IN PURCHASING OF REAL STATE AND SALE OF REAL STATE AND
"UMANG, INC.",RETAIL CONVENIENCE STORE
"UMANO AIR SYSTEMS, LLC.",HVAC INSTALLATION AND REPAIR
UMANO MEDICAL INC.,WE MANUFACTURE AND SOLD HOSPITAL BEDS
UMANZOR PAINTING INC.,PAINTING
UMAPATI LLC,THE GENERAL CHARACTER OF THE BUSINESS OF THE LLC IS TO ENGAGE IN THE INVESTME
"UMAR AND BILAL TAXI, INC.",TAXI CAB
"UMASS CLUB MANAGEMENT, INC.",PRIVATE CLUB BUSINESS - INACTIVE
"UMASS CLUB MANAGEMENT, LLC",PRIVATE CLUB MANAGEMENT
UMASS MEMORIAL HEALTHALLIANCE MRI,"TO ACQUIRE, OWN AND INVEST IN MAGNETIC RESONANCE IMAGING EQUIPMENT; TO OW"
"UMASS MEMORIAL MRI & IMAGING CENTER,",TO ENGAGE IN ANY LAWFUL ACTIVITIES FOR WHICH LIMITED LIABILITY COMPANIES MAY
"UMASS MEMORIAL MRI - MARLBOROUGH,","TO ACQUIRE, OWN AND INVEST IN MAGNETIC RESONANCE IMAGING EQUIPMENT; TO OW"
"UMASS MEMORIAL SHIELDS PHARMACY, LLC",TO ENGAGE IN ANY OR ALL LAWFUL ACTIVITIES FOR WHICH LIMITED LIABILITY COMPAN
"UMASS SPORTS PROPERTIES, LLC",SPORTS MARKETING
"UMAVISION, INC.","AFFILIATE MKT. - IT FAILED, I NEED TO CLOSE CORP."
"UMB INSURANCE, INC.",PROVIDES INSURANCE PRODUCTS TO CLIENTS
UMBELINA REALTY LLC,"TO ACQUIRE, PURCHASE, HOLD, IMPROVE, SELL, CONVEY, ASSIGN, RELEASE, MORTGAGE,"
UMBER CORPORATION,CONVENIENCE STORE
"UMBER SYSTEMS, INC.",SOFTWARE DEVELOPMENT
"UMBERTO DIGIOIA AND ASSOCIATES, INC.",SALES
UMBERTO TILE COMPANY LLC,"TO ENGAGE IN, TRANSACT AND CARRY ON THE BUSINESS OF TILE INSTALLATIONS AND P"
"UMBLE AVIATION ENTERPRISES, LLC","TO OWN AND OPERATE AIRPLANES FOR CHARTER OR OTHERWISE, AND ANY BUSINESS"
UMBRA MANAGEMENT LTD.,MANAGEMENT CONSULTING
"UMBRELLA HEALTH IT, LLC",CONSULTING - ELECTRONIC HEALTH SYSTEMS (EHR)
UMBRELLA IT SOLUTIONS INC.,IT CONSULTING AND SERVICES
"UMBRELLA MANAGEMENT ASSOCIATES, INC.",PROFESSIONAL SERVICE COMPANY
UMBRELLA REALTY LLC,"THE GENERAL CHARACTER OF THE BUSINESS OF THE LLC IS BUYING, ACQUIRING, OWNIN"
UMBRELLA SMILE CORP.,MANUFACTURES KEEPSAKE ART PIECES AND JEWELERY
"UMBRELLA, LLC",REAL ESTATE
"UMBRELLASHOP, LLC","THE GENERAL CHARACTER OF THE BUSINESS IS TO ENGAGE IN INVESTMENT IN, AND OW"
"L.B.E., INC.",RESTAURANT
UMBRO & SONS CONSTRUCTION CORP.,UNDER GROUND CONSTRUCTION
UMBULIZER LLC,BUILDING MEDICAL DEVICES FOR RESOURCE CONSTRAINED MARKETS
UMC GROUP(USA),SEMICONDUCTOR FOUNDRY
"UMCHK, INC.",RETAIL SALES OF MUSICAL INSTRUMENTS AND RELATED AC
"UXBRIDGE MULTI FAMILY REALTY, LLC",REAL ESTATE DEVELOPMENT
"UMG TECHNOLOGIES, INC.",MACHINE MANUFACTURING
"UMHOLTZ PLUMBING AND HEATING, INC.","PLUMBING WORK, HVAC SERVICES AND GAS PIPING"
UMI OF SAUGUS. INC.,TO OWN AND OPERATE A RESTAURANT BUSINESS.
"UMI PRODUCTS, INC.",BEAUTY PRODUCT SALES
"UMI RESTAURANT, INC.",RESTAURANT
"UMIAK LABS, LLC",TO DEVELOP AND MARKET SOFTWARE AND TO ENGAGE IN ANY OTHER LAWFUL ACTIVITY.
UMICORE ELECTRICAL MATERIALS USA INC.,MFG. SILVER-CONTAINING ELECTRICAL CONTACT MATERIAL
UMICORE PRECIOUS METALS USA INC.,SALES AND DISTRIBUTION OFFICE
UMICORE USA INC.,USA PARENT PROVIDING REGIONAL SUPPORT FUNCTIONS.
UMIYA CORPORATION,CONVENIENCE STORE
UMIYA MATAJI CORP.,CONVENIENCE STORE
UMIYAKRUPA CORP.,PACKAGE STORE
"UMLAUT COMMUNICATIONS, INC.",CONSULTING AND ENGINEERING SERVICES
"UMM HAULING, INC.",OPERATION OF A WASTE DISPOSAL BUSINESS
UMMAH HALAL FOOD INC.,ETHNIC HALAL MEAT AND GROCERIES STORE
"UMME, LLC",REAL ESTATE.
UMMO LLC,GRAPHIC DESIGN AND BRANDING SERVICES
"UMNV 123 NEWBURY, LLC","TO ACQUIRE, DEVELOP, IMPROVE, LEASE, MAINTAIN, OWN, OPERATE, MANAGE, MORTGA"
"UMNV 125 NEWBURY, LLC","TO ACQUIRE, DEVELOP, IMPROVE, LEASE, MAINTAIN, OWN, OPERATE, MANAGE, MORTGA"
"UMNV 126 NEWBURY, LLC","TO ACQUIRE, DEVELOP, IMPROVE, LEASE, MAINTAIN, OWN, OPERATE, MANAGE, MORTGA"
"UMNV 166 NEWBURY, LLC","TO ACQUIRE, DEVELOP, IMPROVE, LEASE, MAINTAIN, OWN, OPERATE, MANAGE, MORTGA"
"UMNV 175 NEWBURY, LLC","TO ACQUIRE, DEVELOP, IMPROVE, LEASE, MAINTAIN, OWN, OPERATE, MANAGE, MORTGA"
"UMNV 205 NEWBURY, LLC","TO ACQUIRE, DEVELOP, IMPROVE, LEASE, MAINTAIN, OWN, OPERATE, MANAGE, MORTGA"
"UMNV 205-207 NEWBURY, LLC","TO ACQUIRE, DEVELOP, IMPROVE, LEASE, MAINTAIN, OWN, OPERATE, MANAGE, MORTGA"
"UMNV 207 NEWBURY, LLC","TO ACQUIRE, DEVELOP, IMPROVE, LEASE, MAINTAIN, OWN, OPERATE, MANAGE, MORTGA"
"UMNV 211 NEWBURY, LLC","TO ACQUIRE, DEVELOP, IMPROVE, LEASE, MAINTAIN, OWN, OPERATE, MANAGE, MORTGA"
"UMNV 240A NEWBURY, LLC","TO ACQUIRE, DEVELOP, IMPROVE, LEASE, MAINTAIN, OWN, OPERATE, MANAGE, MORTGA"
"UMNV 344 NEWBURY, LLC","TO ACQUIRE, DEVELOP, IMPROVE, LEASE, MAINTAIN, OWN, OPERATE, MANAGE, MORTGA"
"UMNV 346 NEWBURY, LLC","TO ACQUIRE, DEVELOP, IMPROVE, LEASE, MAINTAIN, OWN, OPERATE, MANAGE, MORTGA"
"UMNV 7 NEWBURY, LLC","TO ACQUIRE, DEVELOP, IMPROVE, LEASE, MAINTAIN, OWN, OPERATE, MANAGE, MORTGA"
"UMNV 79 NEWBURY, LLC","TO ACQUIRE, DEVELOP, IMPROVE, LEASE, MAINTAIN, OWN, OPERATE, MANAGE, MORTGA"
"UMNV 8 NEWBURY, LLC","TO ACQUIRE, DEVELOP, IMPROVE, LEASE, MAINTAIN, OWN, OPERATE, MANAGE, MORTGA"
"UMNV INVESTOR, LLC","TO ACQUIRE, OWN, HOLD, MAINTAIN, MANAGE, OPERATE, FINANCE, PLEDGE, ENCUMBER,"
"UMNV MANAGEMENT, LLC",TO ENGAGE IN REAL ESTATE AND PROPERTY MANAGEMENT AND TO TRANSACT ANY AND
"UMNV NEWBURY STREET, LLC",TO BE THE GENERAL PARTNER AND/OR MANAGER OF VARIOUS LIMITED PARTNERSHIP AN
"UMNV PROMOTE, LLC","TO BE A LIMITED PARTNER OF BACK BAY RETAIL INVESTORS, LP AND TO ENGAGE IN ANY"
"UMNV SHOPPES DEVELOPER, LLC",TO ENGAGE IN REAL ESTATE AND PROPERTY MANAGEMENT AND TO TRANSACT ANY AND
"UMNV SHOPPES INVESTOR, LLC",TO ENGAGE IN REAL ESTATE AND PROPERTY MANAGEMENT AND TO TRANSACT ANY AND
"UMNV SHOPPES PROMOTE, LLC",TO ENGAGE IN REAL ESTATE AND PROPERTY MANAGEMENT AND TO TRANSACT ANY AND
"UMNV SHOPPES, LLC",TO ENGAGE IN REAL ESTATE AND PROPERTY MANAGEMENT AND TO TRANSACT ANY AND
UMOJA INVESTMENTS LLC,"REAL ESTATE - BUYING, SELLING, LEASING AND RENTING PROPERTY."
UMOYA CONSULTING LLC,INFORMATION TECHNOLOGY CONSULTING SERVICES
UMPACHENE CORP.,REAL ESTATE RENTALS
"UMPHREY ENGINEERING, LLC","HVAC, PROFESSIONAL ENGINEER"
UMPIRE PROPERTIES LLC,RENTAL PROPERTY MANAGEMENT
"UMR, INC.","EMPLOYEE BENEFIT PLAN ADMINISTRATOR, THIRD PARTY A"
"UMS ANDOVER SURGICAL MANAGEMENT, INC.",MANAGEMENT SERVICES
"UMS LITHOTRIPSY MANAGEMENT, LLC",MOBILE MEDICAL SERVICES
UMS LITHOTRIPSY SERVICES OF BRISTOL,MOBILE MEDICAL EQUIPMENT SERVICES
UMS LITHOTRIPSY SERVICES OF CENTRAL,MOBILE MEDICAL EQUIPMENT SERVICES
UMS LITHOTRIPSY SERVICES OF EASTERN,MOBILE MEDICAL SERVICES
UMS LITHOTRIPSY SERVICES OF ESSEX,MOBILE MEDICAL EQUIPMENT
UMS LITHOTRIPSY SERVICES OF,MOBILE MEDICAL EQUIPMENT
UMS LITHOTRIPSY SERVICES OF MERRIMACK,MOBILE MEDICAL SERVICES
UMS LITHOTRIPSY SERVICES OF THE PIONEER,MOBILE MEDICAL SERVICES
UMS LITHOTRIPSY SERVICES OF THE SOUTH,MOBILE MEDICAL EQUIPMENT
UMS LITHOTRIPSY SERVICES OF WESTERN,MOBILE MEDICAL EQUIPMENT
UMS LITHOTRIPSY SERVICES OF WORCESTER,PROVIDE MOBILE MEDICAL EQUIPMENT SERVICES
"UMS MR FUSION SERVICES OF NEW ENGLAND,",PROVISION OF MOBILE MEDICAL EQUIPMENT
UMS NEW ENGLAND LITHOTRIPSY LIMITED,MOBILE MEDICAL SERVICES
"PORTICUS TECHNOLOGY, INC.",BIOMETRIC SECURITY SOFTWARE
"UMTEC, INC.","SALES REP, LOGISTIC AND CONSULTATION SERVICE"
UMUJA LLC,"SERVICES, ENTERPRENEUR"
"UMUOJI IMPROVEMENT UNION, MASSACHUSETTS, INC.",PURSUING PROJECTS TO BETTER THE LOT OF UMUOJIANS
UMW INVESTMENT GROUP LLC,TO POOL RESOURCES FROM THE MEMBERS TO MAKE AN INVESTMENT INTO A PRIVATE B
"UMW, LLC",THE GENERAL CHARACTER OF THE BUSINESS OF THE LLC IS TO OWN AND MAINTAIN REA
NU ENGINEERING SOLUTIONS INC.,ENGINEERIING DESIGN CONSULTING
"UN POTATO, INC.",COMMUNITY WELLNESS
UN-GYVE LIMITED,DESIGN/PRODUCTION/PUBLISHING/MARKETING SERVICES
"UNADILLA, INC.",FULL SERVICE RESTAURANT
"UNAGI INVESTMENTS MANAGEMENT, INC.",REAL ESTATE
"UNAGI INVESTMENTS, LLC","OWNING, OPERATING AND MANAGING A RESTAURANT."
"UNAGI SERVERS, INC.",RESTAURANT
UNAM-USA,UNAM USA IS AN INSTITUTION OF HIGHER EDUCATION
INTERNATIONAL UNIVERSITY ALLIANCE,THE INTERNATIONAL UNIVERSITY ALLIANCE PROMOTES INTERNATIONAL EDUCATION
UNBORN MEDIA RECORDS LLC,RECORD LABEL: TO ENGAGE IN THE ACTIVE SEARCH AND DISCOVERY OF PUBLICLY
PUREVOLUME INC.,INTERNET AND MUSIC
"UNBOUND TECH, INC.",SECURITY SOFTWARE
"UNBOUNDED LEARNING, INC.",TO SUPPORT THE PRACTICE AND LEARNING OF EDUCATORS
UNBREAKABLE LOCK INC.,LOCKSMITH SERVICES
UNBRIDLED SPIRIT ARTWORK LLC,CREATION AND SALE OF ARTWORK.
"UNC PARTNERS, INC.",BUSINESS CONSULTING
UNC PROPERTIES LIMITED PARTNERSHIP,REAL ESTATE
"PANGEA BRANDS, LLC","MANUFACTURE AND SALE OF APPAREL, APPLIANCES AND ACCESSORIES"
"UNCAS INVESTMENTS, LLC",INVESTMENT
UNCATENA LLC,COMMERCIAL REAL ESTATE
"THE CATERED AFFAIR, INC.","FULL SERVICE, OFF PREMISE CATERING BUSINESS"
UNCHAINED LABS,PRODUCTION OF BIOLOGIC TOOLS
"UNCHAINED, LLC","TO OWN, LEASE, MANAGE, BUY, AND SELL REAL ESTATE; TO OWN MANAGE AND MORTGA"
UNCHARTED GALLERY & STUDIOS LLC,"ART GALLERY, CAFE (WITH BEER AND WINE), AND NON-RESIDENTIAL WORKSPACE FOR VI"
"DJE, INC.",ADMINISTRATION
UNCLAIMED PROPERTY RECOVERY AND,RECOVERY AND REPORTING OF UNCLAIMED PROPERTY
"UNCLE AL PRODUCTION SERVICES, INC.",ENTERTAINMENT PRODUCTION
"UNCLE AL'S CARPENTRY SERVICES, INC.",FINISH CARPENTRY/HANDYMAN SERVICES
"UNCLE BENZ, INC.",AUTO REPAIR
"LIFE STORAGE SOLUTIONS, LLC",TRUCK RENTAL AND STORAGE MERCHANDISE
"UNCLE EDDIE'S, INC.","BAR, DRINKING ESTABLISHMENT."
"UNCLE JAY'S ENTERPRISES, LLC",REAL ESTATE
"UNCLE JAY'S TWISTED FORK, INC.",RESTAURANT
"UNCLE KOSTAS, LLC",THE GENERAL CHARACTER OF THE BUSINESS OF THE LLC IS TO (A) ENGAGE IN THE
UNCLE LARRY'S TAVERN L.L.C.,BAR/TAVERN
"UNCLE NED'S FISH FACTORY, INC.",RETAIL
"UNCLE NINO'S RESTAURANT, INC.",SUBSHOP DELI
"CAB24, INC.",TAXI - DELIVERY SERVICE
UNCLE PETE'S HICKORY RIBS INC.,RESTAURANT
"UNCLE ROBERT'S STONE HOUSE, LLC",VACATION RESIDENTIAL RENTAL BUSINESS
"UNCLE SAM'S AUTO CENTER, INC.",AUTOMOBILE BODY REPAIR SHOP
"UNCLE SAM'S FAMILY, INC.",RESTAURANT
"UNCLE SAM'S PIZZA, INC.",RESTAURANT SERVING FOOD AND BEVERAGE
"UNCLE SAM'S PLUMBING HEATING, LLC",PLUMBING AND HEATING SERVICE.
"SPIRIT OF STONEY O'BRIEN, INC. THE",BAR AND RESTAURANT
"UNCME, LLC",REAL ESTATE DEVELOPMENT
UNCOMMON ADORNMENTS INC.,RETAIL SALES OF JEWERY
UNCOMMON BRANCH LLC,"TO PROVIDE CUSTOM SOFTWARE CONSULTING SERVICES, SALE OF SOFTWARE, ONLINE S"
"WICKED GOOD COOKIES, INC.",COOKIE FAVORS AND GIFTS
"UNCOMMON CATALYST, INC.","IT SERVICES, STRATEGY CONSULTING"
"UNCOMMON CLARITY, INC.",MANAGEMENT CONSULTING
"UNCOMMON COCOA, LLC","THE PURCHASE, PROCESSING, EXPORTING, IMPORTING, BROKERAGE AND SALE OF COCO"
"UNCOMMON CRAFTSMEN, INC.",HOME RENOVATION
UNCOMMON PRODUCTIONS LLC,INDEPENDENT FILM PRODUCTION COMPANY
"UNCOMMON SCHOOLS, INC.",EDCUCATION
UNCOMMON SCISSORS LLC,MANUFACTURE AND SALES OF NEEDLEWORK SCISSORS
"UNCORKED MARKETING, INC.",MARKETING COMPANY
UNCORKED PRODUCTIONS LLC,FILM PRODUCTION
"UNCOVER LEARNING, LLC",EDUCATIONAL CONSULTING SERVICES
"UNCOVR MEDIA, INC",MEDIA
"UNDA'S BUS SERVICE, INC.",CHARTER/BUS SERVICES
UNDEPET LLC,CLUB PROMOTIONS & MARKETING
UNDER ARMOUR INC.,WHOLESALE AND RETAIL SALES
"UNDER ARMOUR RETAIL OF MASSACHUSETTS,","RETAIL SALE OF ATHLETIC APPAREL, FOOTWEAR AND ACCESSORIES"
"UNDER ARMOUR RETAIL, INC.",RETAIL STORE MANAGEMENT
UNDER COVER ROOFING LABOR INC,ROOFING
"UNDER COVER, INC.",MANUFACTURER
"UNDERDOG MARKETING, INC.",MARKETING CONSULTING BUSINESS
"UNDER OAK ENTERPRISES, INC.","MANAGEMENT SERVICES, CONSULTING, & HOLDINGS"
"UNDER OAK NEEDHAM, LLC",TO OPERATE A MASSAGE THERAPY BUSINESS.
"UNDER ONE WOOF, LLC",RETAIL PET SUPPLY STORE
"UNDER PRESSURE, INC.",HOOD AND EXHAUST CLEANING
UNDER SKY HOME IMPROVEMENT INC,HOME IMPROVEMENT
"UNDER THE BRIDGE, LLC",EVENT SPACE
UNDER THE SKY PRODUCTIONS,ENTERTAINMENT SERVICES
UNDER THE SUN LLC.,GROWING AND SELLING AGRICULTURAL BASED PRODUCTS
UNDER THE SUN TREE SERVICE LLC,TREE SERVICE
1-800 BUSY DOG BASEMENT TECHNOLOGIES,DRY BASEMENT SYSTEMS
"UNDERCAR MANAGMENT , LLC",AUTO REPAIR
"UNDERCOVER TENT & PARTY, INC.",RENTALS OF TENT AND PARTY EQUIPMENT
"UNDERCOVER WINDOWS, INCORPORATED",HOME FURNISHINGS
"UNDERCOVERWEAR, INC.",HOME PARTY PLAN COMPANY
UNDERDOG CONSTRUCTION LLC,"BUYING, SELLING, CONSTRUTING, RENOVATING, LEASING OF REAL ESTATE"
"UNDERDOG CORPORATION, THE",BUY SELL REAL ESTATE MANAGE RENT
PAVE INSURANCE LLC,INSURANCE AGENCY
"UNDERDOG MOTORSPORTS, LLC",AUTOMOTIVE PERFORMANCE CONSULTATION
UNDERDOG SKATE SHOP LLC,RETAIL SALES OF SKATEBOARDING GOODS. WILL ALSO OFFER SKATEBOARDING LESSON
UNDERDOGS LOUNGE LLC,OWN AND OPERATE A PUB.
UNDERGROUND CONSTRUCTION EXPERTS INC.,UNDERGROUND CONSTRUCTION & CABLE INSTALLATIONS
"UNDERGROUND ENERGY, LLC","UNDERGROUND ENERGY PROVIDES GEOTHERMAL, HYDROGEOLOGIC AND ENVIRONMENT"
UNDERGROUND IMAGING TECHNOLOGIES,"DEVELOPING AND DISTRIBUTING UNDERGROUND IMAGING, OTHER SUBSURFACE DETECTI"
UNDERGROUND POWER CORP.,CONSULTING
"UNDERGROUND PRINTING - MASSACHUSETTS,",CUSTOM APPAREL
UNDERGROUND RAILROAD LLC,"TO INVEST IN AND MANAGE REAL ESTATE; TO BUY, SELL, LEASE, IMPROVE, AND CONSTR"
UNDERGROUND STUDIOS LLC,YOGA AND PERSONAL TRAINING SERVICE
"UNDERGROUND SUPPLY, INC.",UNDERGROUND SUPPLY INC.
"UNDERGROUND SURVEYING, LLC",GEOPHYSICAL SURVEYING & MAPPING SERVICES
"UNDERGROUND SYSTEMS, INC.",ELECTRICAL ENGINEERING AND MANUFACTURING
"UNDERGROUND TESTING & SERVICES, LLC",UNDERGROUND EXCAVATION UTILITY SUPPORT
"UNDERGROUND UTILITIES, INC.",INSTALLATION OF UTILITIES
UNDERGROUND UTILITY CONTRACTORS INC.,CONSTRUCTION
UNDERHILL INC.,GENERAL CONTRACTING
"UNDERPASS HOLDINGS, LLC",HOLDING REAL ESTATE
"UNDERPASS ROAD BICYCLE RENTALS, INC.",BIKE RENTAL & SALES
"UNDERPINNING & FOUNDATION SKANSKA, INC.",HEAVY CONSTRUCTION
"UNDERSCORE, VC MANAGEMENT COMPANY,",INVESTMENT ACTIVITIES
"UNDERSEA DIVERS, INC.",DIVE SHOP
UNDERSTANDING RECRUITMENT INC.,RECRUITMENT AND CONSULTANCY SERVICES
"UNDERSTORY, INC.",DEVELOPING WEATHER DETECTION TECHNOLOGY/SOLUTION
UNDERTOW SOFTWARE CORP.,SOFTWARE DEVELOPMENT
"UNDERTOW, LLC",MANUFACTURER/DISTRIBUTOR OF SUNSCREENS/MOISTURIEZERS
UNDERWATER CONSTRUCTION CORPORATION,MARINE CONSTRUCTION AND DIVE SERVICES
"UNDERWATER ENGINEERING SERVICES, INC.",INSPECTION AND DIVING SERVICES
UNDERWATER LLC,REAL ESTATE HOLDING COMPANY
"UNDERWATER POOL MASTERS, INC.",SERVICE OF POOLS & SPAS
"UNDERWATER SOLUTIONS, INC.",UNDERWATER SOLUTIONS INC
"UNDERWATER WORK DIVING SERVICES, INC.",UNDERWATER BOAT MAINTENANCE
UNDERWAY VENTURES LLC,"THE LLC PERFORMS REAL ESTATE DEVELOPMENT, MANAGEMENT, AND REAL ESTATE BRO"
"UNDERWOOD AUTO & BODY SERVICES, INC.",AUTO REPAIR & AUTO BODY SERVICES
"UNDERWOOD CATERING, INC.",FOOD SERVICE MANAGEMENT
"UNDERWOOD ESTATES, LLC",REAL ESTATE
"UNDERWOOD FARM OF WESTPORT, INC.","DEVELOP, PURCHASE, SELL AND MANAGE REAL ESTATE"
BELMONT ENGINEERING INC.,MECHANICAL CONTRACTOR
"UNDERWOOD GROUP, INC., THE",DISTRIBUTION OF ELECTRONIC PRODUCTS AND ASSEMBLIES
"UNDERWOOD HOLDINGS, LLC",THE LLC OWNS A RENTAL CONDOMINIUM
"UNDERWOOD PARTNERS, LLC","TO PROVIDE STRATEGY, CONSULTING SERVICES, LOYALTY AND REWARD PROGRAM AND"
UNDERWOOD PROPERTY CORPORATION,REAL ESTATE
"UNDERWOOD PROPERTY, MANAGEMENT, AND",REAL ESTATE
UNDERWOOD SALES CORP.,MANUFACTURER'S SALES REPRESENTATIVES
"UNDERWOOD STREET REALTY, LLC",REAL ESTATE
"UNDERWOOD THREE LOWELL STREET, CORP.",PROPERTY MANAGEMENT
"UNDERWOOD&BEACON, LLC","PROPERTY DESIGN, DEVELOPMENT & RENOVATION."
TDC NATIONAL ASSURANCE COMPANY,INSURANCE
"UNDERWRITERS AGENCY OF NEW ENGLAND, INC.",INSURANCE BROKERAGE
"UNDERWRITERS GROUP, INC., THE",SALE OF INSURANCE
"UNDERWRITERS INSURANCE BROKERAGE, INC.",INSURANCE BROKERAGE
"UNDERWRITERS LABORATORIES, INC.",TESTING FOR PUBLIC SAFETY
"UNDERWRITERS MARINE SERVICES, INC.",INSURANCE SERVICES
"UNDERWRITERS MARKETING SERVICE, INC.",INSURANCE GENERAL AGENCY
"UNDERWRITERS SAFETY AND CLAIMS, INC.",SALE OF INSURANCE
"UNDERWRITING MANAGEMENT EXPERTS, LLC",INSURANCE AGENCY SALES/MARKETING
"UNDERWRITING SERVICES OF AMERICA, INC.",INSURANCE BROKERAGE
UNDINE OYSTER COMPANY LLC,THE LLC IS ORGANIZED FOR THE PURPOSE OF PURCHASING OYSTER / SHELLFISH SEEDS A
UNDISPUTED REALTY LLC,"PURCHASE OR OTHERWISE ACQUIRE HOLD FOR INVESTMENT, DEVELOP, MORTGAGE OR"
UNDO INC.,SOFTWARE VENDOR
UNDO STUDIO LLC,TECHNOLOGY CONSULTING AND RELATED SERVICES
UNDUGU LLC,GENERAL TRADING COMPANY WORKING WITH DIFFERENT KINDS OF PRODUCTS WHICH
UNEARTHED LLC,UNEARTHED LLC WORKS WITH OTHERS TO TELL STORIES THROUGH PROVIDING SERVICE
"UNECO MANUFACTURING, INC.",MANUFACTURING JOB SHOP
"UNEEK SOURCING, LLC",SALES REPRESENTATION BROKERAGE RESALE
UCRC SMR CORPORATION,UNEMPLOYMENT COMPENSATION AGENT FOR EMPLOYERS
UNEMPLOYMENT SERVICES CORPORATION,PERSONNEL AND MANAGEMENT SERVICES
"UNEMPLOYMENT TAX CONTROL ASSOCIATES, INC.",PROFESSIONAL UNEMPLOYMENT TAX MANAGEMENT SERVICES
UNEMPLOYMENT TAX MANAGEMENT CORPORATION,MANAGEMENT SERVICES
UNEMPLOYMENT TAX MITIGATION LLC,"CONSULTATION, ADVICE AND MANAGEMENT OF UNEMPLOYMENT INSURANCE ACCOUN"
"UNERECTORS, INC.",FURNISH & INSTALL ARCHITECTURAL METAL
"UNEVA HEALTH, INC.",DEVELOP & MARKET CONSUMER HEALTH-RELATED PRODUCTS
"UNEVA PHARMACEUTICALS, LLC",THE GENERAL CHARACTER OF THE BUSINESS OF THE COMPANY IS TO (I) PROMOTE RESEA
"UNEXPECTED LOGIC, INC.",TECHNOLOGY CONSULTING
"UNFCU FINANCIAL SERVICES, LLC",FINANCIAL AND INSURANCE SERVICES
"UNFI TRANSPORT, LLC",TRANSPORTATION
"UNFINISHED BUSINESS OF CAPE COD, INC.",RETAIL FURNITURE
"UNFINISHED BUSINESS, INC.",RETAIL FURNITURE
UNFINISHED SYMPHONIES INC.,PERFORMANCE BASED MUSIC SCHOOL
"UNFINISHED SYMPHONIES, LLC",MUSIC INSTRUCTION.
UNFOLD AND FLOURISH LLC,PROVIDING REIKI AND ENERGY WORK FOR SUPPORTING PHYSICAL AND EMOTIONAL HEA
UNFOLDID LLC,THE GENERAL CHARACTER OF THE BUSINESS OF THE LLC IS TO PROVIDE PERSONAL WAR
"UNFORGETTABLE HAIR, INC.",HAIR SALON
"UNFORGETTABLE PROM FOUNDATION, INC.",ORGANIZING AN ANNUAL PROM FOR TEENS WITH CANCER
"UNFORS RAYSAFE, INC.","SALE, REPAIR AND SERVICING OF X-RAY TESTING DEVICE"
UNFUDDLE LLC,SOFTWARE DEVELOPER
"UNGER CONSTRUCTION, LLC",CONSTRUCTION AND RELATED SERVICES
UNGER ELECTRIC CORPORATION,ELECTRICAL WIRING
UNGER RIVERSIDE ENGINEERING SERVICES INC.,"ENGINEERING SERVICES, CONSULTING SERVICES,"
UNGERDOGS INC,PET CARE AND RETAIL
UNGES GROUP INC.,OWNERSHIP OF REAL PROPERTY
"UNGION, LLC",THE BUSINESS WILL FOCUS ON THE FOOD INDUSTRY.
UNGOVERNABLE FILMS LLC,FILM PRODUCTION
"UNGROWN PRODUCTIONS, LLC",PRODUCTION ENTITY AND COPYRIGHT HOLDER
"UNI AT LARGE, INC.",WIDE FORMAT PRINTING
UNI AUTO CENTER INC.,AUTO SALES AND SERVICE
UNI AUTO RENTAL INC.,CAR RENTAL AGENCY
"UNI COMP, INC.",SOFTWARE DEVELOPMENT
"UNI DENTAL LABORATORY, INC.",DENTURE LAB
"UNI JEWELRY, INC.",ANHTONY CROWE CPA
"UNI PRODUCTS, INC.",INJECTION MOLDING
UNIQ LASER CENTER LLC,THE PURPOSE OF THE LIMITED LIABILITY COMPANY IS (I) TO PROVIDE BEAUTY AND SKIN
UNI REALTY GROUP LLC,"TO ENGAGE IN THE PURCHASE, REHABILITATION, SALE AND LEASING OF RESIDENTIAL AN"
UNI SOLUTIONS LLC,DEVELOP CUSTOM SOLUTIONS FOR EXISTING SOFTWARE.
"UNI-ARCH, LLC",CONSULTING
"UNI-LINK, LLC","DBA CAFE CALYPSO SERVING TAKE OUT CARIBBEAN FOOD IN BOSTON, MA."
"UNI-PLY ROOFING, INC.",ROOFING
"UNI-SELECT USA, INC.",WHOLESALE/RETAIL - AUTOMOTIVE PARTS & SUPPLIES
"SPECIAL RISK SOLUTIONS, INC.",ACT AS INSURANCE AGENT OR BROKER
"UNI-TEL COMMUNICATIONS GROUP, INC.",RESELLER
"UNI-TRANS TRANSPORTATION, L.L.C.",PROVIDER OF TRANSPORTATION FOR COMMERICAL & NON-COMMERICAL FREIGHT. COM
"UNIBANK FISCAL ADVISORY SERVICES, INC.",PROVIDES FISCAL ADVICE TO MUNICIPALITIES
UNIBANK FOR SAVINGS,BANK
UNIBANK REALTY CORPORATION,INACTIVE
UNIBANK SECURITIES CORPORATION,PURCHASE AND HOLD INVESTMENT SECURITIES
UNIBAR INC.,SALE OF SOFTWARE
"ACS COMMERCIAL SOLUTIONS, INC.",BUSINESS PROCESS OUTSOURCING
UNIBOND EDUCATION LLC,PROVIDE EDUCATIONAL COUNSELING SERVICE FOR DOMESTIC AND INTERNATIONAL HIG
"UNIBRAINT, LLC","TO ENGAGE IN THE INVESTMENT, OWNERSHIP AND DEVELOPMENT OF REAL ESTATE"
UNIBRINC LLC,"TO ENGAGE IN THE INVESTMENT, OWNERSHIP AND DEVELOPMENT OF REAL ESTATE."
UNIBUL MERCHANT SERVICES LLC,CREDIT CARD PROCESSING SERVICES
UNICA CLEANING & SERVICES INC.,CLEANING SERVICES
UNICA CORPORATION,SOFTWARE SALES AND SERVICES
UNICAPITAL FUNDING CORPORATION,COMMERCIAL LEASING
UNICAPITAL TECHNOLOGY CORPORATION,COMMERCIAL LEASING
"UNICARE HUMAN SERVICES, INC.",HUMAN SERVICES
"UNICARE NATIONAL SERVICES, INC.",HOLDING CORPORATION
UNICCO FINANCE CORP.,FACILITIES MAINTENANCE
C & W GOVERNMENT SERVICES INC.,FACILITY SERVICES
"UNICCO SERVICE OF M.I., INC.",INTEGRATED FACILITY SERVICES
"UNICCO SERVICE OF N.J., INC.",FACILITIES MAINTENANCE
UNICE INTERNATIONAL GROUP LLC,TO PROVIDE MEDICAL TRANSPORTATION
UNICENA BOSTON LLC,"TO ENGAGE IN THE BUSINESS OF IMPORT, EXPORT AND DISTRIBUTE GENERAL PRODUCTS"
"UNICITY SOLUTIONS, INC.",IMPORT
