"UNITED MARBLE FABRICATORS, INC.",MARBLE AND TILE FABRICATORS
"UNITED MARTIAL ARTS CENTER, INC.",MARTIAL ARTS INSTRUCTION
"UNITED MARTIAL ARTS CENTER, LLC",MARTIAL ARTS INSTRUCTION
"UNITED MATERIAL MANAGEMENT OF HOLYOKE, INC.",CONSTRUCTION OF A WASTE TRANSFER STATION
UNITED MATERIAL MANAGEMENT OF,WASTE DISPOSAL SERVICES
UNITED MATERIAL MANAGEMENT,REFUSE HAULING
"UNITED MATERIAL MANAGEMENT, INC.",HOLDING COMPANY
UNITED MECHANICAL CONTRACTING INC.,HVAC SERVICING & INSTALLATION
"UNITED MECHANICAL, INC.",WELDING
"UNITED MEDICAL DESIGN BUILDERS, LLC",GENERAL CONTRACTOR
"UNITED MEDICAL SYSTEMS (DE), INC.",MOBILE MEDICAL SERVICES
UNITED MERCANTILE COMPANY OF PITTSBURGH,COMMERCIAL COLLECTIONS
UNITED METRO ENERGY CORP.,"WHOLESALER OF GASOLINE, DIESEL AND HEATING OIL"
"UNITED RENTAL GROUP, LLC",RENTAL VEHICLES
"LOW VA RATES, LLC",MORTGAGE LOAN ORIGINATION
UNITED MILLWORK OF NY INC.,MILLWORK
"UNITED MIRROR & PLATE GLASS, INC.",GLASS AND GLAZING
"UNITED MOBILE SOLUTION, INC.",MOBILE COMMUNICATION SERVICE
"UNITED MOLDMAKERS, INC.",MANUFACTURE MOLD
"UNITED MONOLITHIC SEMICONDUCTORS USA, INC.",HIGH-PRESSURE SALES
"UNITED MORTGAGE & LOAN INVESTMENT, LLC",DEBT COLLECTION AND MORTGAGE SERVICING
"UNITED MORTGAGE BROKERAGE, INC.",MORTGAGE BROKERAGE
"UNITED MORTGAGE EXPRESS, INC.",MORTGAGE BROKER
"UNITED MORTGAGE FINANCE GROUP, INC.",MORTGAGE BROKER
UNITED MOTORS INC,USED CAR SALES
UNITED MULTI FAMILY CORPORATION,REAL ESTATE BROKER
UNITED MULTI FAMILY LLC,REAL ESTATE
"UNITED NAILS, INC.",NAIL SALON
"UNITED NATION'S INSURANCE AGENCY, INCORPORATED",INSURANCE/SURETY LINES
"UNITED NATIONAL MAINTENANCE, INC.",TRADESHOW LABOR
"UNITED NATURAL FOODS, INC.",FOOD DISTRIBUTION
"UNITED NEGRO COLLEGE FUND, INC.",RAISE FUNDS FOR ASSISTANCE TO MEMBER INSTITUTIONS.
"UNITED WEALTH MANAGEMENT, INC.",BANK SUBSIDIARY
UNITED NORTHERN MORTGAGE BANKERS LIMITED,MORTGAGE BANKERS
"UNITED OFFSET PRINTING CO, INC.",OFFSET PRINTING COMPANY
"UNITED OIL PAINTINGS, INC.",UNITED OIL PAINTINGS INC
"UNITED OIL RECOVERY, INC.",TRANS & RECYCLING HAZARDOUS & NON-HAZ WASTE
UNITED PAINTING AND CLEANING INC.,PAINTING & CLEAINING
"UNITED PAINTING COMPANY, INC.",UNITED PAINTING COMPANY INC.
UNITED PAINTING SERVICES INC,UNITED PAINTING SERVICES INC
UNITED PARCEL SERVICE CO.,AIR-FREIGHT TRANSPORTATION
"UNITED PARCEL SERVICE, INC.",CONSOLIDATED PARCEL DELIVERY
"UNITED PARKING & HOSPITALITY, INC.",HOSPITALITY
UNITED PAVING & EXCAVATING LLC,TO RENDER PAVING AND EXCAVATING SERVICES
"UNITED PERSONNEL MANAGEMENT, LLC","TO PROVIDE MANAGEMENT SERVICES TO UNITED PERSONNEL SERVICES,INC."
"UNITED PET GROUP, INC.",SALE OF PET SUPPLIES
UPL NA INC.,SALE/MANUFACTURE OF CHEMICALS
"UNITED PHYSICAL THERAPY, INC.",HEALTHCARE SERVICES
UNITED PIPE AND STEEL CORP.,DISTRIBUTOR OF PIPES
UNITED PLANNERS' FINANCIAL SERVICES OF,INSURANCE AND FINANCIAL SERVICES
"FLUOR INDUSTRIAL SERVICES, INC.",PERFORMS PROJECT AGREEMENT MAINTENANCE SERVICES
"UNITED PLASTERING AND PAINTING, LLC",PLASTERING PAINTING
UNITED PLASTERING SERVICES INC.,CONSTRUCTION PLASTERING
"UNITED PLASTERING SYSTEMS, INC.",PLASTERING CONTRACTOR
"UNITED PLASTIC FABRICATING, INC.",MANUFACTURES PLASTIC WATER TANKS
UNITED PLUMBING & HEATING INC.,PLUMBING & HEATING CONTRACTOR
"UNITED PLUMBING AND GAS, INC.",ENGAGE IN THE GENERAL PLUMBING AND HEATING BUSINES
UNITED PLUMBING AND HEATING SUPPLY COMPANY INC.,OWNS REAL ESTATE IN MASSACHUSETTS
"UNITED PLUMBING SUPPLY, INC.",WHOLESALE PLUMBING SUPPLY AND FIXTURES
UNITED PLUS MAINTENANCE CORP,MAINTENANCE
"UNITED PORTFOLIO MANAGEMENT, INC.",BUSINESS TO BUSINESS COLLECTIONS
"UNITED POWER (USA), INC.",PROVIDING ENGINEERING SERVICES
"UNITED POWER CORPORATION ELECTRICAL CONTRACTORS,",ELECTRICAL CONTRACTOR
"UNITED POWER GROUP, INC.",ELECTRICAL TESTING AND MAINTENANCE
UNITED POWER SYSTEM INC,ALTERNATE POWER SUPPLY SERVICE
UNITED PRIME SERVICES INC,DRYWALL SERVICES
"UNITED PRINT PARTNERS, INC.",PRINTING BROKER
"UNITED PRISON EQUIPMENT COMPANY, INCORPORATED",DETENTION EQUIPMENT CONTRACTOR
"UNITED PRIVATE CAR, INC.",LIVERY TRANSPORTATION
UNITED PRO PAINTING INC,COMMERCIAL AND RESIDENTIAL PAINTING SERVICES
"UNITED PROCESS TECHNOLOGIES, LLC",TO OWN AND OPERATE A CONSULTING SERVICES BUSINESS AND TO ENGAGE IN ANY AN
UNITED PRODUCTIONS SERVICES INC.,THEATRICAL BOOKING AGENT
"UNITED PRODUCTS, LLC",MANUFACTURER OF ACRYLIC PRODUCTS
"UNITED PROFESSIONALS, INC.",INSURANCE SALES
"UNITED PROJECT & REPAIR, LLC",RETAIL MAINTENANCE
"UNITED PROPERTIES GROUP, INC.",RENTAL REAL ESTATE
"UNITED PROPERTIES, INC.",REAL ESTATE MANAGEMENT
"UNITED PROPERTY TRUST, LLC",THE GENERAL CHARACTER OF THE BUSINESS OF THE LLC IS TO ACQUIRE BY PURCHASE O
"UNITED PUBLIC SAFETY, INC.",PARKING HARDWARE AND SOFTWARE SOLUTIONS
"UNITED REAL ESTATE GROUP, LLC",REAL ESTATE
UNITED REAL ESTATE LLC,REAL ESTATE BROKERAGE COMPANY
UNITED REALTY CORP.,OWNS REAL PROPERTY IN MASS
UNITED REALTY CORP. OF WORCESTER,REAL ESTATE MANAGEMENT
"UNITED REALTY ENTERPRISES, LLC",COMMERCIAL REAL ESTATE DEVELOPMENT AND RENTAL
UNITED REALTY GROUP LLC.,REAL ESTATE AND MULTI-SERVICES.
UNITED REALTY MANAGEMENT INC.,REAL ESTATE MANAGEMENT
"ALLTRAN FINANCIAL, LP",COLLECTION AGENCY
"UNITED REFRIGERATION, INC.",WHOLESALE OF HVAC/R PRODUCTS
"UNITED REMODELING CONTRACTING, CORP.",GENERAL CONSTRUCTION SERVICES
UNITED REMODELING INC,CONSTRUCTION AREA
"UNITED RENEWABLE ENERGY, LLC",SOLAR INTEGRATOR
"UNITED RENTALS (NORTH AMERICA), INC.","EQUIPMENT RENTALS, SALES AND SERVICES"
"UNITED RENTALS ENGINEERING SERVICES, P.C.",PROFESSIONAL ENGINEERING
"HIGHWAY TECHNOLOGIES, INC.",HIGHWAY SAFETY SERVICES
"UNITED RENTALS, INC.","EQUIPMENT RENTALS, SALES & SERVICES"
REPRESENT.US EDUCATION FUND,EDUCATION ABOUT POLITICAL REFORM
REPRESENT.US,EDUCATION AND ADVOCACY REGARDING POLITICAL REFORM
"UNITED RESEARCH BUREAU, INC.",INSURANCE INVESTIGATIONS
"CAPGEMINI AMERICA, INC.",PROFESSIONAL CONSULTING BUSINESS
"UNITED RESOURCE NETWORKS, INC.",GENERAL BUSINESS & HEALTH CARE MANAGEMENT SERVICE
"UNITED RESOURCE SYSTEMS, INC.",COLLECTION AGENCY
"UNITED RESTAURANT EQUIPMENT CO., INC.",DEALER OF COMMERCIAL KITCHEN EQUIP AND SUPPLIES
"UNITED RESTORATION, LLC","DISASTER RESTORATION FOR HOUSES. MOLD, FIRE, WATER, ODOR"
UNITED RETAIL INCORPORATED,WOMEN'S CLOTHING AND ACCESSORIES RETAILER
UNITED RETEK CORP.,ENVIRONMENTAL SERVICES
UNITED RETEK CORPORATION,ENVIRONMENTAL CLEANUP OF CONTAMINATED SITES
"UNITED RETIREMENT, INC.",PROVISION OF THIRD-PARTY RETIREMENT SERVICES
"UNITED REVENUE SERVICE, INC.",TAX CONSULTING SERVICES
"UNITED RISK SOLUTIONS, INC.",NON-RESIDENT INSURANCE AGENCY
UNITED ROOFING CONTRACTORS LLC,THE GENERAL CHARACTER OF THE LLC IS TO ENGAGE IN OWNERSHIP AND OPERATION OF
"UNITED ROOFING SERVICES, INC.",ROOFING SERVICES CONTRACTOR
"UNITED RUGS AUCTIONEERS, INC.",SALE OF HANDMADE ORIENTAL RUGS AT WHOLESALE
UNITED S REALTY LLC,MANAGEMENT AND OWNERSHIP OF REAL ESTATE. TRANSACTION OF ALL LAWFUL BUSIN
UNITED S.A. CONSTRUCTION INC,1993
UNITED SAFETY LLC,CONSTRUCTION
"UNITED SAFETY NET, INC.",SAFETY TRAINING AND EDUCATION.
"ATLANTIC AMUSEMENTS, INC.",AMUSEMENT SERVICES
UNITED SALVAGE CORP. OF AMERICA,OTHER FABRICATED METAL MFG
"UNITED SCAPES OF AMERICA, INC.",WHOLESALE- -OTHER
"UNITED SCHOOLS ASSOCIATION, INC.",OPERATION OF BOARDING PROGRAMS AT HIGH SCHOOLS
"UNITED SCIENCES TESTING, INC.",COAL CLEANING TECHNOLOGY
UNITED SCREW MACHINE PRODUCTS CORPORATION,MANUFACTURING
UNITED SEALCOAT LLC,COMMERCIAL AND RESIDENTIAL ASPHALT MAINTENANCE
"UNITED SEATING AND MOBILITY, L.L.C.","RETAIL DME PROVIDER, SPECIALIZING IN CUSTOMIZED WHEELCHAIRS"
UNITED SECURITY FINANCIAL CORP,MORTGAGE BANKING
"UNITED SECURITY SYSTEMS,INC.","UNITED SECURITY SYSTEMS, INC"
"UNITED SECURITY, INC.",ARMED AND UNARMED SECURITY SERVICES
"UNITED SENIOR ADVISORS, INC.",FINANCIAL SERVICES
"UNITED SERVICE ADJUSTMENT, INC.",INSURANCE ADJUSTING
"UNITED SERVICE AGENCY, INC.",INSURANCE PLACEMENT & RISK MANAGEMENT
UNITED SERVICE COMPANY LLC,HAZARDOUS MATERIALS ABATEMENT AND REMEDIATION
"UNITED SERVICE CONTRACT ADMINISTRATIVE COMPANY,",ADMINISTRATOR AND OBLIGOR OF VEHICLE SERV CONTRACT
UNITED SERVICE CONTRACT GROUP LLC,MOTOR VEHICLE SERVICE CONTRACT ADMINISTRATOR
"UNITED SERVICE GROUP, INC.",CLEANING SERVICES
UNITED SERVICE MANAGEMENT LLC,PLUMBING ELECTRICAL HVAC CONSTRUCTION
"UNITED SERVICE ORGANIZATIONS, INCORPORATED",LIFTS THE SPIRITS OF AMERICA'S TROOPS
UNITED SERVICE PROTECTION CORPORATION,SERVICE CONTRACT PROVIDER
"UNITED SERVICE SOLUTIONS, LLC",MEDICAL EQUIPMENT REPAIR SERVICES
"FIRST COMMAND FINANCIAL PLANNING, INC.",FIRST COMMAND INSURANCE SERVICES
"UNITED SERVICES SOLUTIONS, INC.",CONSULTING SERVICES
"UNITED SEWING & PATTERNS, INC.",MANUFACTURNING OF CLOTHES AND PATTERNS
"UNITED SHOCKWAVE THERAPIES, LLC",THE TRANSACTION OF ANY OR ALL LAWFUL BUSINESS FOR WHICH LIMITED LIABILITY
UNITED SHOE MACHINERY CORPORATION,SHOE/CUTTING MACHINE MFG AND INDUSTRIAL SUPPLIES
"UNITED SHORE FINANCIAL SERVICES, LLC",RESIDENTIAL MORTGAGE LENDING
UNITED SIDING & PAINTING INC.,RESIDENTIAL & COMMERCIAL SIDING & PAINTING
UNITED SITE NATIONAL SERVICES COMPANY,RENTAL AND SERVICE OF PORTABLE RESTROOMS
"UNITED SITE SERVICES NORTHEAST, INC.",PORTABLE RESTROOM SERVICES
"UNITED SITE SERVICES, INC.",PORTABLE SANITATION AND RELATED SITE SERVICES
"UNITED SLEEP DIAGNOSTICS, INC.",SLEEP DIAGNOSTIC TESTING
"UNITED SNACKS, INC.",DELIVERY OF SNACK FOODS TO SMALL BUSINESSES
"UNITED SOCCER LEAGUES, LLC",MANAGAEMENT OF SOCCER LEAGUES
"UNITED SOLAR ASSOCIATES, LLC","TO CONDUCT OR ENGAGE IN THE ELECTRICAL CONTRACTING AND INSTALLATION WORK,"
"UNITED SOLUTION SERVICES, INC.",CONSTRUCTION SERVICES
"UNITED SOLUTIONS, INC.",SOFTWARE SALES AND SERVICE
"UNITED SOUND SERVICES, LLC","REPAIR OF AUDIO EQUIPMENT. SOUND SERVICES, AND CONSULTING."
"UNITED SOUTHWEST MORTGAGE CORPORATION, INC.",MORTGAGE BROKER
"THE AD KING, INC.",ADVERTISING NOVELTIES
"UNITED SPORTS ASSOCIATES, LLC","CONSULTING, SPORTS MARKETING AND EVENTS"
"UNITED STAFFING SERVICES, LLC",TO ENGAGE IN THE BUSINESS OF EMPLOYING AND SUPPLYING SKILLED AND UNSKILLED
"UNITED STAFFING SOLUTIONS, INC.",HEALTHCARE STAFFING EMPLOYING NURSES
"UNITED STAFFING, INC.",STAFFING AND RELATED SERVICES
"UNITED STAGING & RIGGING, LLC","TO BUY, SELL AND LEASE STAGING AND RIGGING EQUIPMENT; AND TO ENGAGE IN ANY O"
"SB PRODUCTION SERVICES, LLC",THEATRICAL STAGING AND RIGGING EQUIPMENT
"UNITED STATES ADJUSTERS, INC.",INSURANCE ADJUSTERS - CONSULTING
UNITED STATES ANTI-DOPING AGENCY,ANTI-DOPING EFFORTS WITH OLYMPIC ATHLETES
"UNITED STATES APPRAISALS, LLC",APPRAISAL MANAGEMENT COMPANY
UNITED STATES ARMY VETERAN SUPPORT COMMAND OF,THE USAVSC IS NON-PROFIT ORGANIZATION TO VOLUNTEER
"UNITED STATES AUTO CLUB MOTORING DIVISION, INC.",PROVIDE AUTO CLUB SERVICES
"UNITED STATES AVIATION UNDERWRITERS, INCORPORATED",AVIATION INSURANCE POOL MANAGER
"UNITED STATES BEVERAGE, L.L.C.",THE IMPORTATION AND MARKETING OF BEER AND SPIRITS.
UNITED STATES BIOLOGICAL CORPORATION,BIOTECHNOLOGY
UNITED STATES BIOMED CAPITAL LLC,BIOMEDICAL TECHNOLOGY DEVELOPMENT AND CONSULTING
UNITED STATES CENTRAL AGENCY SERVICES CORP.,LIFE INSURANCE SALES
UNITED STATES CHAMPIONS CORP,GENERAL CONTRACTOR
"UNITED STATES CORPORATION AGENTS, INC.","UNITED STATES CORPORATION AGENTS, INC."
"UNITED STATES DETERMINATION SERVICES, INC.",SOFTWARE PROVIDERS
"UNITED STATES DISTANCE LEARNING ASSOCIATION, THE",PROMOTE THE DEVELOPMENT OF DISTANCE LEARNING.
UNITED STATES DISTILLED PRODUCTS CO.,Address (no PO Box)
UNITED STATES EDUCATION SERVICES INC.,EDUCATION SERVICES
"AJN SERVICES, INC.",GLASS AND DOOR MAINTENANCE
"UNITED STATES EQUITY FUNDING, LLC",COMMERCIAL FINANCING
RICK'S APPLIANCES & TVS INC.,APPLIANCE SERVICE
"UNITED STATES FLEET LEASING, INC.",LOANS/LEASING
"UNITED STATES FOUNDRIES, INC.",DISTRIBUTOR OF CAST IRON PRODUCTS.
UNITED STATES FUND FOR UNICEF,NOT FOR PROFIT ORGANIZATION
"UNITED STATES GOLF ASSOCIATION, INC.",TO PROMOTE & CONSERVE THE GAME OF GOLF
UNITED STATES GYPSUM COMPANY,MANUFACTURING OF GYPSUM
UNITED STATES HOLDCO LLC,REAL ESTATE
"UNITED STATES HUNTER JUMPER ASSOCIATION, INC.",NON-PROFIT EDUCATIONAL
"UNITED STATES INFORMATION SYSTEMS, INC.",STRUCTURED CABLING INSTALLATION AND SUPPORT
UNITED STATES INFORMATION TECHNOLOGIES,SOFTWARE DEVELOPMENT AND CONSULTING
UNITED STATES INSURANCE SERVICES INC.,NON RESIDENT INSURANCE AGENCY
UNITED STATES JARVIS EXPORT TRADING INTERNATIONAL,"EXPORTER , USA INTERNATIONAL TRADING COMPANY"
UNITED STATES MINERAL PRODUCTS COMPANY,MANUFACTURER OF FIREPROOFING
AMERICAN CRANE AND HOIST CORPORATION,WHOLESALE MATERIAL HANDLING EQUIPMENT
UNITED STATES OF AMERICA CONSUMER NETWORK INC,MULTI-LEVEL MARKETING
UNITED STATES OF ARITZIA INC.,RETAILER OF WOMEN'S APPAREL AND ACCESSORIES
UNITED STATES OLYMPIC AND PARALYMPIC FOUNDATION,GENERATE PHILANTHROPIC SUPPORT FOR THE USOC.
UNITED STATES OLYMPIC COMMITTEE,COORDINATING/DEVELOPING AMATEUR ATHLETE ACTIVITY
"UNITED STATES PHARMACEUTICAL GROUP,",HEALTHCARE BUSINESS PROCESS OUTSOURCING & TECHNOLOGY COMPANY
UNITED STATES PIPE AND FOUNDRY,MANUFACTURING
"UNITED STATES PONY CLUBS, INC.",YOUTH PROGRAM USING EQUINES TO TEACH LEADERSHIP.
"UNITED STATES PREMIER HOCKEY LEAGUE,",SPORTS LEAGUE
UNITED STATES PUBLIC INTEREST RESEARCH GROUP,"EDUCATE THE PUBLIC ON HEALTH, ECONOMY AND GOV'T."
"UNITED STATES PUBLIC INTEREST RESEARCH GROUP, INC.","RESEARCH, PUBLIC EDUCATION AND POLICY DEVELOPMENT"
"UNITED STATES RESTORATION, INC.",MASONRY RESTORATION
UNITED STATES SERVICE CENTER FOR OVERSEAS STUDENTS,CONSULTING & HOUSING SERVICES FOR STUDENTS
"UNITED STATES SOCCER FEDERATION, INC.",PROMOTION AND GOVERNANCE OF SOCCER
"BOSTON SKI AND SPORTS CLUB, INC.","BOSTON SKI AND SPORTS CLUB, INC."
USX CORPORATION,STEEL PRODUCTION
UNITED STATES STEEL CORPORATION,STEEL MANUFACTURING
UNITED STATES SURGICAL CORPORATION,Address (no PO Box)
SGS U.S. TESTING COMPANY INC.,INSPECTION/TESTING SERVICES-CONSUMER PRODUCTS
"UNITED STATES TOWER SERVICES, LIMITED",TOWER AND ANTENNA INSTALLATION AND ERECTION
BOSTON TRUST & INVESTMENT MANAGEMENT COMPANY,ASSET MANAGEMENT
"UNITED STATES TRUST COMPANY, NATIONAL ASSOCIATION","PRIVATE BANKING, FIDUCIARY SERVICES & INVESTMENT"
UNITED STATES WARRANTY CORP.,MOTOR VEHICLE SERVICE AGREEMENTS.
UNITED STATES WARRANTY CORPORATION,MOTOR VEHICLE SERVICE CONTRACT PROVIDER
"UNITED STATES YOUTH CHORALE AND WIND ENSEMBLE, INC.,",STUDENT MUSIC TOURS
ESSENDANT CO.,WHOLESALE OFFICE AND COMPUTER SUPPLIES
UNITED STEEL INC.,FABRICATE & ERECT STRUCTURAL STEEL & MISC METALS
UNITED STONE AND CABINET INC.,"RETAIL TRADE AND INSTALLATION, STONE AND CABINET"
"UNITED STONE AND SITE, INC.",MASONRY CONSTRUCTION
"UNITED STONES OF AMERICA, INC.",GRANITE & MARBLE SALES
UNITED STONEWORKS INC.,"RESIDENTIAL & COMMERCIAL, INTERIOR STONE & TILE"
"UNITED STOR-ALL MANAGEMENT, L.L.C.",MANAGE SELF STORAGE RENTAL FACILITIES
UNITED STRETCH DESIGN CORPORATION,MANUFACTURE ELASTIC BRAID
"UNITED STRUCTURAL CONSULTANTS, INC.",BUSINESS CONSULTING
"UNITED STUDENT AID FUNDS, INC.",CHARITABLE AND EDUCATIONAL ACTIVITITIES
UNITED SUPERIOR CONSTRUCTION INC,CONSTRUCTION SERVICES
"UNITED SUPPORT SERVICES, LLC",CONSULTING
UNITED SYMBOL LLC,"REAL ESTATE CONSULTING AND RELATED SERVICE, ENVIRONMENTAL PROTECTION RELA"
"UNITED SYSTEMS ADVERTISING, INC.",PROMOTIONAL MARKETING AND SALES CONSULTING
"A & N CONSULTING SERVICES, INC.",FINANCIAL CONSULTING SERVICES
"UNITED TECH COMMUNICATIONS, INC.",COMMUNICATION SERVICES
CARRIER CORPORATION,"MANUFACTURE, SALE, DISTRIBUTION, SERVICE, REPAIR"
UNITED TELECOM INC.,TELECOMMUNICATIONS
"UNITED TELECOMM, INC.",TELECOMMUNICATIONS
"UNITED TELEPHONE AND WIRING, INC.",TELECOMMUNICATIONS
"UNITED TELESERVICES, INC.",TELECOMMUNICATIONS
"UNITED TEMPS, INC.",TEMPORARY STAFFING
"UNITED THERAPIES, INC.",MASSAGE & FACIALS
"UNITED TILE AMERICA, INC.",RETAIL SALES OF MARBLES AND TILES
UNITED TILES INC,FLOORING AND TILE INSTALLATIONS
"UNITED TITLE REAL ESTATE SERVICES, LLC",TITLE SERVICES
"UNITED TITLE, LLC.",TITLE SEARCH
UNITED TOOL & MACHINE CORPORATION,MANUFACTURING
EAMES STREET PROPERTY CORPORATION,REAL ESTATE
"UNITED TOOL & MANUFACTURING, INC.",MANUFACTURER
"UNITED TOOL CO.,INC. OF SOUTH HADLEY,THE",TOOL MAKER
UNITED TOTE COMPANY,WAGERING DATA SECURE DISPLAYING
"UNITED TRACTOR TRAILER SCHOOL, INC.",TRUCK DRIVING SCHOOL
"UNITED TRANSMISSION EXCHANGE OF WESTFIELD, INC.",TRANSMISSION REPAIR SHOP
"UNITED TRANSPORT OF EAST LONGMEADOW, INC.",TRANSPORTING FOR OTHER COMPANY
UNITED TRANSPORTATION CORPORATION,TRANSPORTATION INTERSTATE
UNITED TRANSPORTATION GROUP INC.,TRANSPORTATION
UNITED TRANSPORTATION SYSTEM LLC,TRANSPORT SERVICE
"UNITED TRANZACTIONS, LLC","CHECK GUARANTEE, PAYMENT PROCESSING"
"UNITED TRAVEL SERVICES, LLC",AIR TRAVEL SUPPORT SERVICES
"UNITED TRAVEL, INC.",TARVEL AGENT
UNITED TREE & CONSTRUCTION SERVICES CORP,TREE SERVICES
UNITED TRUCKING L.L.C.,"TRANSPORTING GOODS USE FOR CONSTRUCION MATERIAL SUCH AS SAND, GRAVEL , ASP"
"UNITED TRUST HOME LOANS, INC.",MORTGAGE BROKER
"UNITED UNDERWRITERS, INC.",LIFE INSURANCE BROKERAGE
"SURACY INSURANCE AGENCY, INC.",INSURANCE AGENCY
"I.G.I. UNDERWRITING AGENCY, INC.",INSURANCE AGENCY
UNITED UTILITIES INC.,UTILITY CONSTRUCTION
UNITED UTILITY SERVICES GROUP CORPORATION,043496305
"UNITED VALLEY INSURANCE SERVICES, INC.",INSURANCE SALES AND SERVICE
"UNITED VALUATION GROUP, LLC",REAL ESTATE APPRAISAL MANAGEMENT
UNITED VEHICLE REMARKETING INC,USED CAR SALES
"UNITED VILLAGES, INC.",TECHNOLOGY DEVELOPMENT
"UNITED VISION FINANCIAL, INC.",MORTGAGE BROKERING
"UV SALES, INC.",SALES OF CONSUMER GOODS COMPANY
"UNITED VISION SOLUTIONS, LLC",UNITED VISION YOUR SOURCE FOR THE BEST IN PROFESSIONAL QUALITY CCTV EQUIPMENT
"UNITED VOCATIONAL & HEALTH SERVICES,",THE GENERAL CHARACTER OF THE BUSINESS OF THE LIMITED LIABILITY COMPANY IS (I) T
UNITED WALL PANEL AND TRUSSES INC,MANUFACTURER AND RETAIL OF WALL PANEL AND TRUSSES
UNITED WALLS SYSTEMS LLC,CONSTRUCTION GENERAL CONTRACTORS
"UNITED WASTE MANAGEMENT OF HOLYOKE,",THE COMPANY IS IN THE WASTE SERVICES BUSINESS
REENERGY ROXBURY LLC,HAULER OF CONSTRUCTION AND DEMOLITION WASTE/TRANSFER STATION OWNER
REENERGY ROXBURY INC.,WASTE MANAGEMENT
"UNITED WASTE SYSTEMS LEASING, INC.",WASTE SERVICES
"UNITED WASTE SYSTEMS OF GARDNER, INC.",WASTE SERVICES
SUEZ WATER ENVIRONMENTAL SERVICES INC.,CONSULTING SERVICES AND WATER CONTRACT OPS
UNITED WATER NACO LLC,WATER AND WASTERWATER CONTRACT OPERATIONS
"UNITED WATER SOLUTIONS, INC.","COMMERCIAL WATER METER TESTING, REPAIR AND REPLACE"
UNITED WATER SPRINGFIELD LLC,WATER AND WASTERWATER CONTRACT OPERATIONS
"UNITED WE STAND, LLC","HOME IMPROVEMENT, ROOFING, NEW CONSTRUCTION"
UNITED WE WIN CORP.,TO OWN AND OPERATE A SOCIAL MEDIA PLATFORM.
"UNITED WINDOW & DOOR MANUFACTURING, INC.",MANUFACTURER OF VINYL WINDOWS & DOORS
UNITED WINDOWS CO. INC.,CONSTRUCTION
"UNITED WINE AND SPIRITS, LLC",RETAIL LIQUOR STORE
"UNITED WOMEN'S HEALTH SERVICES, LLC",PROVIDER OF WOMEN'S DIAGNOSIS AND HEALTH SERVICES
UNITED WORLD TRADING INCORPORATED,USED AUTO SALES
UNITED-COUNTY INDUSTRIES CORPORATION,COMMERCIAL STEEL TREATING
UNITED-PUETT ELECTRICAL STARTING GATE CORPORATION,LEASE THOROUGHBRED HORSE RACING STARTING GATES
"UNITED/ANCO SERVICES, INC.",COMMERCIAL CONTRACTOR
"UNITEDAUTO FINANCE, INC.",HOLDING COMPANY
UNITEDCLEANING.COM INCORPORATED,OFFICE CLEANING SERVICES
"UNITEDHEALTH ADVISORS, LLC",INSURANCE AGENCY
"UNITEDHEALTHCARE CHILDREN'S FOUNDATION, INC.",CHARITABLE SOLICITATION
"UNITEDHEALTHCARE SPECIALTY BENEFITS,","""THIRD PARTY ADMINISTRATOR MANAGING CLAIMS AND BUSINESS FOR INTERNAL AND E"
GETHEALTHINSURANCE.COM AGENCY INC.,SALE AND MARKETING OF INSURANCE AND DISCOUNT MEDIC
"UNITEDLINX, INC.","HEALTH CARE, IT SERVICES, PROMOTION,R&D, EDUCATION"
UNITEDRER CORP.,REAL ESTATE AND REMODELING
"UNITEDWEB, INC.",MANAGEMENT SERVICES
"UNITEK CONSULTING, INC.",SOFTWARE CONSULTING AND DEVELOPMENT
3M UNITEK CORPORATION,SALE OF DENTAL EQUIPMENT
MIYACHI AMERICA CORPORATION,CAPITAL EQUIPMENT MANUFACTURER
"UNITERRA CONSULTING, LLC",PROFESSIONAL ENGINEERING SERVICES
UNITERRA DRIVING SCHOOL INCORPORATED,DRIVING SCHOOL
"UNITEX INTERNATIONAL, INC.",TEXTILE IMPORTER
UNITI LEASING LLC,WIRELESS INFRASTRUCTURE PRODUCTS AND SERVICES
UNITI LEASING X LLC,"TELECOMMUNICATIONS INFRASTRUCTURE, SERVICES AND PRODUCTS"
UNITI LLC,"RESTAURANT SERVICES, AND ANY OTHER PURPOSE FOR WHICH A LIMITED LIABILITY CO"
UNITI TOWERS LLC,WIRELESS INFRASTRUCTURE PRODUCTS AND SERVICES
"UNITIL RESOURCES, INC.",TO ENGAGE IN THE BUSINESS OF POWER MARKETING
UNITIME SOFTWARE ACQUISITION LLC,"PROVIDER OF SOFTWARE, HARDWARE, MAINTENANCE AND CONSULTING SERVICES FOR"
UNITING WITH YOU HOME CARE LLC,THE GOAL OF THIS AGENCY IS TO PROVIDE HOME HEALTH CARE TO THE COMMONWEALT
"T1D EXCHANGE, INC.",IMPROVE TYPE 1 DIABETES OUTCOMES
"UNITRADE COMPANY, INC.",SIGN RAW MATERIAL AND EQUIPMENT SUPPLY
"UNITRANS WORLDWIDE, INC.",TRANSPORTATION
"UNITRANSFER MASSACHUSETTS, INC.",MONEY SERVICES BUSINESSES
"UNITRANSFER U.S.A., INC.",HOLDING & SERVICES COMPANY
UNITRENDS INC.,SELLING DATA BACK UP
"UNITROL CO., INC.",HEATING & AIR CONDITIONING CONTRACTOR
SONOVA USA INC.,HEARING LOSS SOLUTION
"UNITRON, INC.",REAL ESTATE DEVELOPMENT AND MANAGEMENT
"UNITS 15 & 16 BOXCAR BOULEVARD, LLC",REAL ESTATE LEASING
"UNITS V, VI & VIII, LLC",REAL ESTATE OWNERSHIP AND MANAGEMENT
"UNITY ACUPUNCTURE, LLC",ACUPUNCTURE
UNITY CARPET INC.,CARPET INSTALLERS
"UNITY CONSTRUCTION, INC,",- - PLEASE MAKE A SELECTION - -
"UNITY DENTAL ROSLINDALE, PC",DENTAL OFFICE
"UNITY ENVIRONMENTAL TECHNOLOGIES, LLC","ENVIRONMENTAL, SAFETY PRODUCTS , SERVICES"
UNITY FARM LLC,FARM: AGRICULTURE AND HORTICULTURE. UNITY FARM RAISES AWARD WINNING ALPAC
"UNITY FEEDS, INC.",CONSULTING
"UNITY FIRST DIRECT, INC.",PUBLIC RELATIONS AND MARKETING
"UNITY FOOD SALES, LLC",THE GENERAL CHARACTER OF THE BUSINESS IS TO ENGAGE IN A FOOD BROKERAGE BUSI
"UNITY GRAPHICS AND ENGRAVING, INC.",MA.SALES OFFICE FOR PRINTG. PLATES MANUFACTURED NJ
UNITY HALL LLC,"THE GENERAL CHARACTER OF THE BUSINESS OF THE LLC IS TO OWN, MANAGE, DEVELOP,"
UNITY INVESTMENT PROPERTIES LLC,REAL ESTATE SALES
UNITY INVESTMENT REAL ESTATE INC.,REAL ESTATE MANAGEMENT
UNITY LANDSCAPING LLC,"TO PROVIDE COMMERCIAL, INDUSTRIAL AND RESIDENTIAL LANDSCAPING, DESIGN OF LA"
UNITY LINK INTERNATIONAL BOSTON INCORPORATED,INTERNATIONAL SYSTEM DEVELOPMENT
UNITY LINK INTERNATIONAL CORPORATION,INTERNATIONAL BUSINESS DEVELOPMENT
UNITY MARTIAL ARTS ACADEMY INC.,MARTIAL ART INSTRUCTION
"UNITY NETWORK SOLUTIONS, LLC",TECHNOLOGY - IT CONSULTING SERVICES
"UNITY NETWORKING, INC.",COMPUTER TECH SUPPORT
UNITY PAINTING & HANDYMAN SERVICES LLC,PAINTING AND HANDYMAN SERVICES
UNITY PLACE LLC,HOUSING DEVELOPMENT
UNITY PLACE MM LLC,AFFORDABLE HOUSING
"UNITY PROPERTY MANAGEMENT, INC.",REAL ESTATE - MANAGING REAL ESTATE FOR OTHERS
UNITY REALTY INC.,REAL ESTATE
UNITY SEMICONDUCTOR INC,"SOFTWARE RESEARCH, DEVELOPMENT AND SALES"
"UNITY SOLUTIONS, INC.",1945
"UNITY SURVEILLANCE & INVESTIGATIONS,",SURVEILLANCE & INVESTIGATIONS
UNITY TECHNOLOGIES SF,TECHNICAL & NON TECHNICAL SERVICES
"UNITY TELECOM, LLC",TELECOMMUNICATIONS RESELLER.
"UNITY TITLE GROUP, LLC",TITLE COMPANY
"UNITY VOLLEYBALL CLUB, INC.",OPERATION OF A VOLLEYBALL CLUB
UNITYCLEAN LLC,GENERAL CLEANING SERVICES
UNIVACCO FOILS EAST CORPORATION,WHOLESALE - HOLOGRAM
UNIVAR USA INC.,CHEMICAL DISTRIBUTION
UNIVATION LLC,MANAGED IT SERVICES
UNIVENTION NORTH AMERICA INC.,"SOFTWARE DEVELOPMENT, MARKETING AND SALES"
UNIVERSAL AUTO SALES LLC,UNIVERSAL AUTO SALES LLC IS IN THE BUSINESS OF SELLING MOTOR VEHICLES TO THE G
"UNIVERBAL.COM, INC.",BUSINESS DEVELOPMENT CONSULTING
UNIVERDEALS CORP.,IMPORT AND EXPORT
"UNIVERSAL ABATEMENT SERVICES, INC.",SALE OF GOODS AND SERVICES
"UNIVERSAL ACCOUNT SERVICING, LLC",UNIVERSAL ACCOUNT SERVICING (UAS) OFFERS THE MOST COMPREHENSIVE BILLING AN
"UNIVERSAL ACOUSTIC & EMISSION TECHNOLOGIES, INC.","PROVIDER OF ACOUSTIC, EMISSION AND FILTRATION SYST"
"UNIVERSAL AMERICAN FINANCIAL SERVICES, INC.",HOLDING COMPANY
"UNIVERSAL AMERICAN INSURANCE AGENCY, INC.",NON-RESIDENT INSURANCE AGENCY
"EAGLE HOME MORTGAGE, LLC",ORIGINATE AND SERVICE MORTGAGES.
"UNIVERSAL ATLANTIC SYSTEMS, INCORPORATED","INSTALL,SERVICE,MONITOR SECURITY SYSTEMS"
"UNIVERSAL AUTO BODY, INC.",AUTO BODY REPAIR
"UNIVERSAL AUTO GLASS, INC.",AUTO GLASS INSTALLATION
"UNIVERSAL AUTO REPAIR AND SALES, INC.",REPAIR AND SALES OF AUTOMOBILES AND LIGHT TRUCKS.
UNIVERSAL AUTO REPAIR INC.,AUTO REPAIR SERVICES
"UNIVERSAL AUTO, INC.",AUTO BODY REPAIR
"UNIVERSAL AUTOMATION & MECHANICAL SERVICES, INC.",AUTOMATION ELECTRICAL MECHANICAL PLUMBING WORK
UNIVERSAL BASKETBALL TRAINING LLC,"SPORTS AND BASKETBALL TRAINING, COACHING, MENTORING INCLUDING PRACTICE; GA"
"UNIVERSAL BENEFIT PLANS, INC.",SALES OF INSURANCE PLANS
UNIVERSAL BENEFITS CORPORATION,THIRD PARTY ADMIN
"UNIVERSAL BENEFITS, LLC",THIRD PARTY ADMINISTRATOR
UNIVERSAL BOOK AND PERIODICALS SERVICE CORPORATION,BOOKS IMPORT/EXPORT
"UNIVERSAL BUILDERS OF AMERICA, INC.",GENERAL CONTRACTOR
"UNIVERSAL BUSINESS COMMUNICATIONS, INC.",CONSTRUCTION
UNIVERSAL BUSINESS EQUIPMENT CORPORATION,OFFICE SUPPLIES & FURNITURE DEALER
"UNIVERSAL BUSINESS SYSTEMS, INC.",SOFTWARE SALES WITHOUT MEDIA
"UNIVERSAL CAB, INC.",TRANSPORTATION(TAXI)
"UNIVERSAL CAPITAL, LLC",THE GENERAL CHARACTER OF THE BUSINESS OF THE LLC IS TO INVEST CAPITAL IN NON-
UNIVERSAL CARPENTER INC,CARPENTRY SERVICES
UNIVERSAL CENTURY INCORPORATED,RETAIL STORE
"UNIVERSAL CHOICE AUTO, LLC","ALL LAWFUL FOR PROFIT PURPOSES, INCLUDING IDENTIFYING OPPORTUNITIES AND CON"
